source,notice_id,title,description,organisation,value_low,value_high,currency,published_date,deadline,notice_type,status,cpv_codes,url,scraped_at
Contracts Finder,ocds-b5fd17-a3f3a421-4a99-461b-b8c5-614e5f701228_44983f0a-8f8d-44de-b156-23bb0418b928-903941,MIS/FIS Licensing & Support,MIS/FIS Licensing & Support for schools,Cantium Business Solutions Limited,,1200000.0,GBP,2026-06-30,2026-06-30,award,complete,48190000,https://www.contractsfinder.service.gov.uk/Notice/44983f0a-8f8d-44de-b156-23bb0418b928-903941,2026-07-01T10:40:01.296818+00:00
Contracts Finder,ocds-b5fd17-09af349b-11c0-472f-a202-55eb38ad5c25_1823fdb1-889d-4cc9-ba12-f2d6f755e105-903939,MEGRFI/01008 - Hostile Vehicle Mitigation (HVM) Vehicle Security Barriers RFI,"This is a Request for Information and not currently an opportunity to tender.

The Authority is seeking to explore Hostile Vehicle Mitigation (HVM) solutions, specifically in the form of Vehicle Security Barriers (VSBs). This includes the potential establishment of a comprehensive through-life support including installations and maintenance contract, anticipated to span approximately 10 years, incorporating provisions for capability upgrades, technology refresh, and asset sustainment.
The Aut",Ministry of Defence,,,GBP,2026-06-30,,planning,planning,34928100,https://www.contractsfinder.service.gov.uk/Notice/1823fdb1-889d-4cc9-ba12-f2d6f755e105-903939,2026-07-01T10:40:01.296980+00:00
Contracts Finder,ocds-b5fd17-c052db04-b9ec-46dd-8f69-0fc554f4b0ff_24a9822d-8891-41f1-97f7-8cf8364161fa-903940,"QIP143 0900 2026-06-29 Felixstowe - Suffolk new college, Ipswich (4-seated vehicle required) - AWARD","Suffolk County Council is seeking a mini competition against the following Dynamic Purchasing System: `The supply of Passenger Transport Services`, OJEU Notice Id: 2018/S 031-067685.
      
      QIP143 0900 2026-06-29 Felixstowe - Suffolk new college, Ipswich (4-seated vehicle required)
      
      Further details can be found in the 'Tenders / My Tenders' area of this website, by selecting the 'View Details' button for this project.
      
      The deadline for returned submissions is ",Suffolk County Council Passenger Transport,,,GBP,2026-06-30,2026-06-29,award,complete,60000000,https://www.contractsfinder.service.gov.uk/Notice/24a9822d-8891-41f1-97f7-8cf8364161fa-903940,2026-07-01T10:40:01.297153+00:00
Contracts Finder,ocds-b5fd17-014a24fa-7eab-4f48-b319-4686446fc409_36103301-7c81-43f8-9025-860aab2654f7-903938,DN804772-Quantity Surveying & Contract Management-Asbestos & Fire-BBC,"Provision of contract management and QS support, specifically for both the asbestos and fire management work streams in relation to the Customer's housing stock. This provision is required as there is no current internal resource to cover these functions. The scope of these services will include the faciliation of all monthly contractor valuations, formal project meetings, site inspections and a minimum of 10% post work quality inspections. There will also be a requirement to provide technical a",Nottinghamshire County Council,,100000.0,GBP,2026-06-30,2025-03-31,award,complete,71324000,https://www.contractsfinder.service.gov.uk/Notice/36103301-7c81-43f8-9025-860aab2654f7-903938,2026-07-01T10:40:01.297348+00:00
Contracts Finder,ocds-b5fd17-2f5554a0-3f1a-4ed2-929f-956043013b80_397f4807-4222-46ba-bbf3-5b61714b6950-903935,Request for Information - Lyophilisation services,"The key dates for this RFI are as follows:

RFI Published: 30th June 2026

RFI Response: 14th July 2026

Should you have any questions or queries relating to this RFI, please use the Atamis portal's messaging centre to direct your questions to us for a response.

If a response is not received by the RFI response deadline this will have no impact on your ability to tender for the opportunity in the future. UKHSA will not enter into contracts on the basis of replies to this RFI.  

Descr",UK Health Security Agency,,,GBP,2026-06-30,,planning,planning,85111800,https://www.contractsfinder.service.gov.uk/Notice/397f4807-4222-46ba-bbf3-5b61714b6950-903935,2026-07-01T10:40:01.297513+00:00
Contracts Finder,ocds-b5fd17-376849d6-2d79-48e5-ad77-11cb220745c9_596657b9-55fd-4614-81aa-aab4e70ed9eb-903933,Strategic Transport Support Services,"Award of contract for comprehensive transport planning and highways advisory support to the Authority, delivering a flexible and responsive service across strategy, policy development, scheme feasibility, development management and project support.",Blackburn With Darwen Borough Council,,150000.0,GBP,2026-06-30,2026-04-21,award,complete,71311200,https://www.contractsfinder.service.gov.uk/Notice/596657b9-55fd-4614-81aa-aab4e70ed9eb-903933,2026-07-01T10:40:01.297689+00:00
Contracts Finder,ocds-b5fd17-e6706402-b8c6-4df5-8fff-2f8c4cc0e0ee_ae708b82-e7d7-4650-9d1d-086d587dbc23-903932,HPFT - Rosanne House Renovation Works,"The Hertfordshire Partnership NHS Foundation Trust has awarded a contract to the supplier CLC CONTRACTORS LTD for the provision of Rosanne House Renovation Works

Additional information: 
This was awarded via Direct Award SBS10166",The Hertfordshire Partnership University NHS Foundation Trust,30000.0,40000.0,GBP,2026-06-30,2026-06-02,award,complete,45210000,https://www.contractsfinder.service.gov.uk/Notice/ae708b82-e7d7-4650-9d1d-086d587dbc23-903932,2026-07-01T10:40:01.297865+00:00
Contracts Finder,ocds-b5fd17-241dc5fa-5cdf-49f6-9702-c23ed60c94ef_05b9fd16-04a9-4919-a63c-aae198129616-903931,Shared AVC Salary Sacrifice Scheme for Employee Pensions,To implement a salary sacrifice scheme to enable BCC staff to invest and shared costs additional voluntary as part of  local government pensions scheme.,Bristol City Council,220000.0,440000.0,GBP,2026-06-30,2026-06-29,award,complete,66520000,https://www.contractsfinder.service.gov.uk/Notice/05b9fd16-04a9-4919-a63c-aae198129616-903931,2026-07-01T10:40:01.298045+00:00
Contracts Finder,ocds-b5fd17-23e4cc0b-a47a-489d-83a8-abdd8ef46f3d_b2037d1c-7311-409a-8cb6-68b7c8aef7e9-903930,PAHT - Supply & Installation of new Mortuary Offices Ventilation,"The Princess Alexandra Hospitals NHS Trust has awarded a contract to the supplier ECOFACTOR LTD for the provision of Supply & Installation of new Mortuary Offices Ventilation

Additional information: 
This was awarded via Direct Award CCS Low Value Purchasing System framework RM6237",The Princess Alexandra NHS Trust,50000.0,80000.0,GBP,2026-06-30,2026-06-03,award,complete,45331200,https://www.contractsfinder.service.gov.uk/Notice/b2037d1c-7311-409a-8cb6-68b7c8aef7e9-903930,2026-07-01T10:40:01.298239+00:00
Contracts Finder,ocds-b5fd17-a7042c06-06fd-45ec-a876-49813d7d28d9_e06a200a-860c-46e9-81bd-00a988bc43ac-903928,Insourced Services to Support the Provision of  Healthcare Services under RM6276,"Insourced Services to Support the Provision of 
Healthcare Services at Northampton General Hospital NHS Trust",KETTERING GENERAL HOSPITAL NHS FOUNDATION TRUST,,149760.0,GBP,2026-06-30,2026-06-26,award,complete,85112000,https://www.contractsfinder.service.gov.uk/Notice/e06a200a-860c-46e9-81bd-00a988bc43ac-903928,2026-07-01T10:40:01.298421+00:00
Contracts Finder,ocds-b5fd17-59d97901-1a09-4912-ac73-cf5a87318d96_8c6bd6b6-2bb7-4f16-bea0-a0d9d61b0bd9-903926,Invitation to Tender: Tree Equity & Urban Resilience Project,"Trees for Cities is delighted to support the Mayor of London's new London Tree Equity and Urban Resilience (TE&UR) project, a scheme initiated by the Greater London Authority (GLA) to improve access to trees, and the benefits they provide, within London neighbourhoods facing high heat risk and wider social vulnerability. 
As part of our role in this project, we are inviting bids from suitably qualified consultants to support delivery TE&UR initiative.  

Trees for Cities is acting as the cont",TREES FOR CITIES,200000.0,254000.0,GBP,2026-06-30,2026-08-04,tenderAmendment,active,71350000,https://www.contractsfinder.service.gov.uk/Notice/8c6bd6b6-2bb7-4f16-bea0-a0d9d61b0bd9,2026-07-01T10:40:01.298605+00:00
Contracts Finder,ocds-b5fd17-e93dc74c-08a3-46ac-a858-b034dd9c7722_8e51f5ab-5056-46f0-8ec6-8807ef88a180-903927,DPS1 1394 - Park Tree Work,"DPS1 1394 - Park Tree Work

Additional information: 
https://londonconstructionprogramme.co.uk/services/dynamic-purchasing-systems/",London Borough of Haringey,,90000.0,GBP,2026-06-30,2026-07-13,tender,active,71000000,https://www.contractsfinder.service.gov.uk/Notice/8e51f5ab-5056-46f0-8ec6-8807ef88a180,2026-07-01T10:40:01.298799+00:00
Contracts Finder,ocds-b5fd17-dc5677e7-60b0-444e-917d-3b57422cbabc_ff1a7449-a4be-4e1a-b480-6687b5672fdb-903555,ArcGIS Support & Maintenance Renewal,"ArcGIS Support & Maintenance Renewal, including Landclan Licenses and InstantAtlas from 21/08/26 - 20/08/27.",EAST RIDING OF YORKSHIRE COUNCIL,,167715.0,GBP,2026-06-30,2026-06-25,award,complete,72000000,https://www.contractsfinder.service.gov.uk/Notice/ff1a7449-a4be-4e1a-b480-6687b5672fdb-903555,2026-07-01T10:40:01.298981+00:00
Contracts Finder,ocds-b5fd17-72151a66-1b17-4e21-b504-8169829863ea_0f05328a-c03d-4e64-94fb-da8012d611d2-903920,Essex Flood Studies 2026,"Essex County Council (ECC), as Lead Local Flood Authority, has a statutory duty to identify and mitigate flood risks from rainfall, watercourses and groundwater. 
This contract will determine the baseline damages and properties at risk across the CDAs for given rainfall return periods; identify a long-list of potential options to reduce flood risk within the CDA based on flow paths and properties at risk; agree a short list of options with ECC for modelling,  and; return high-level cost-benefit",ESSEX COUNTY COUNCIL,,223473.0,GBP,2026-06-30,2026-04-10,award,complete,45246400,https://www.contractsfinder.service.gov.uk/Notice/0f05328a-c03d-4e64-94fb-da8012d611d2-903920,2026-07-01T10:40:01.299158+00:00
Contracts Finder,ocds-b5fd17-15d29acd-f8db-4994-be9a-5e64f417e2d3_c75023c8-fd50-4eaa-9f89-6f85bb7e602d-903924,"Equality, Diversity and Inclusion Development Programme - AWARD","Sandwell Metropolitan Borough Council ""The Council"" are seeking a provider to deliver a programme of Equality, Diversity, and Inclusion modules to support the EDI Strategy, a full list of modules required are detailed in section 2 of this Quotation document.",Sandwell Metropolitan Borough Council,,,GBP,2026-06-30,2026-06-05,award,complete,80000000,https://www.contractsfinder.service.gov.uk/Notice/c75023c8-fd50-4eaa-9f89-6f85bb7e602d-903924,2026-07-01T10:40:01.299349+00:00
Contracts Finder,ocds-b5fd17-716e24c6-c09b-4154-b09c-4f945cdee74b_98da59aa-6656-451b-848b-f5f5a549227f-903923,"QSB110 0900 2026-06-29 Capel St Mary - Centre academy Easy Anglia, Brettenham (4-seated vehicle required) - AWARD","Suffolk County Council is seeking a mini competition against the following Dynamic Purchasing System: `The supply of Passenger Transport Services`, OJEU Notice Id: 2018/S 031-067685.
      
      QSB110 0900 2026-06-29 Capel St Mary - Centre academy Easy Anglia, Brettenham (4-seated vehicle required)
      
      Further details can be found in the 'Tenders / My Tenders' area of this website, by selecting the 'View Details' button for this project.
      
      The deadline for returned su",Suffolk County Council Passenger Transport,,,GBP,2026-06-30,2026-06-29,award,complete,60000000,https://www.contractsfinder.service.gov.uk/Notice/98da59aa-6656-451b-848b-f5f5a549227f-903923,2026-07-01T10:40:01.299526+00:00
Contracts Finder,ocds-b5fd17-f6eb1dad-0b6f-40b7-a1e8-ed9d5a0b856d_73f2bdac-34aa-46d2-9ddc-13b00c300dd2-903922,TD2405 - Fleet Management Software,Implementation of new cloud-based Fleet Management software solution,DERBY CITY COUNCIL,,254500.0,GBP,2026-06-30,2026-06-26,award,complete,48000000,https://www.contractsfinder.service.gov.uk/Notice/73f2bdac-34aa-46d2-9ddc-13b00c300dd2-903922,2026-07-01T10:40:01.299705+00:00
Contracts Finder,ocds-b5fd17-ed64dbad-555a-4ed7-b25a-3515347c1211_b25a0087-14ae-4370-a08d-bacbb8bf3bde-903921,Food Waste Consultant,"Worcester City Council has appointed a Consultant to design, mobilise, and support the implementation of a new household food waste collection service. The Consultant will work collaboratively with the Council, its waste contractor(s), and key partners to ensure the service is deliverable, cost effective, compliant with relevant legislation, and capable of achieving high participation and capture rates.

This commission covers the period up to, but not including, the live implementation of the",Worcester City Council,,51065.0,GBP,2026-06-30,2026-03-13,award,complete,73000000,https://www.contractsfinder.service.gov.uk/Notice/b25a0087-14ae-4370-a08d-bacbb8bf3bde-903921,2026-07-01T10:40:01.299884+00:00
Contracts Finder,ocds-b5fd17-eb30f19b-01e0-4c50-9270-c05a526b540c_77492f70-f1a7-4d0e-9902-34b866fd8c56-903916,Microsoft Partner Contract CMA,Microsoft Partner Contract CMA,COMPETITION AND MARKETS AUTHORITY,,7500000.0,GBP,2026-06-30,2026-01-22,awardUpdate,complete,48100000,https://www.contractsfinder.service.gov.uk/Notice/77492f70-f1a7-4d0e-9902-34b866fd8c56-903916,2026-07-01T10:40:01.300060+00:00
Contracts Finder,ocds-b5fd17-33c827f4-c533-4ace-b2c3-0b2bb04e1867_ae28bd0f-da3f-4aea-a11a-fa3961681a8e-903919,PROC 058-2025,CMA Internet and Cloud connectivity 202,COMPETITION AND MARKETS AUTHORITY,,188365.48,GBP,2026-06-30,2025-10-16,awardUpdate,complete,48220000,https://www.contractsfinder.service.gov.uk/Notice/ae28bd0f-da3f-4aea-a11a-fa3961681a8e-903919,2026-07-01T10:40:01.300250+00:00
Contracts Finder,ocds-b5fd17-9420e66a-6d1e-4f2f-b7ff-a56a280d7688_2ad6532a-2e5d-4eef-bca8-dc61481d8911-903917,YNE - AOMR Lot1&3 Incident Response stonbury,YNE - AOMR Lot1&3 Incident Response,Environment Agency,,1.0,GBP,2026-06-30,2025-11-13,award,complete,45246000,https://www.contractsfinder.service.gov.uk/Notice/2ad6532a-2e5d-4eef-bca8-dc61481d8911-903917,2026-07-01T10:40:01.300445+00:00
Contracts Finder,ocds-b5fd17-9818c503-3476-4937-9ae0-629b2dc9338c_729dfebf-4123-4b29-9f79-461e9775d7e9-903915,CMA Summer 2025 License Renewal,CMA Summer 2025 License Renewal,COMPETITION AND MARKETS AUTHORITY,,71106.0,GBP,2026-06-30,2025-05-01,awardUpdate,complete,48100000,https://www.contractsfinder.service.gov.uk/Notice/729dfebf-4123-4b29-9f79-461e9775d7e9-903915,2026-07-01T10:40:01.300629+00:00
Contracts Finder,ocds-b5fd17-22a2832d-8427-4ecd-9ff0-c9c589a2ce65_7cd1880c-7622-433b-973f-d6568841ba6a-903908,Forensic Laptop,Forensic Laptop,COMPETITION AND MARKETS AUTHORITY,,40782.0,GBP,2026-06-30,2025-01-02,award,complete,44316400,https://www.contractsfinder.service.gov.uk/Notice/7cd1880c-7622-433b-973f-d6568841ba6a-903908,2026-07-01T10:40:01.300815+00:00
Contracts Finder,ocds-b5fd17-0e70660b-2778-439e-b7bf-282248cd1e4e_86622335-50bb-40bc-8a64-1575fe481a58-903914,YNE AOMR Lot 1 Asset Reconditioning- package 11 lower aire west cross- FY26-27,YNE AOMR Lot 1 Asset Reconditioning FY26-27,Environment Agency,,105693.41,GBP,2026-06-30,2026-04-02,award,complete,45246410,https://www.contractsfinder.service.gov.uk/Notice/86622335-50bb-40bc-8a64-1575fe481a58-903914,2026-07-01T10:40:01.300995+00:00
Contracts Finder,ocds-b5fd17-44785109-8c72-4345-b5dd-35c646aec108_ad1c2ea4-71a6-4bf8-a1b4-2d339dabda19-903909,Contract for services relating to the Community Engagement Project,"Under the Flood and Water Management Act 2010, Worcestershire County Council is a Lead Local Flood Authority, with a duty to manage local flood risk in Worcestershire. 

Part of this duty extends to the production of a local flood risk management strategy. 

Worcestershire's draft Local Flood Risk Management Strategy sets out how the Council aims to help communities be better prepared and more self-resilient to flooding through positive engagement.",Worcestershire County Council,,202865.0,GBP,2026-06-30,2023-12-29,awardUpdate,complete,45246400,https://www.contractsfinder.service.gov.uk/Notice/ad1c2ea4-71a6-4bf8-a1b4-2d339dabda19-903909,2026-07-01T10:40:01.301187+00:00
Contracts Finder,ocds-b5fd17-9b19e906-fbc1-492c-9dfa-4039ca4957b1_ffdfc530-c92a-4696-a649-67b1640fd2a8-903913,Temporary Payroll Advisor (ADC),Contract extension for a temporary payroll advisor by Sellick Partnership Ltd,Nottinghamshire County Council,12166.87,33699.0,GBP,2026-06-30,2026-05-29,award,complete,79600000,https://www.contractsfinder.service.gov.uk/Notice/ffdfc530-c92a-4696-a649-67b1640fd2a8-903913,2026-07-01T10:40:01.301374+00:00
Contracts Finder,ocds-b5fd17-252ca897-3dd3-4af9-bb89-95af70863538_a3a711a8-40a6-46c7-b881-b4cb5921bdb1-903912,HPFT - Oxford House Lighting Works,"The Hertfordshire Partnership NHS Foundation Trust has awarded a contract to the supplier CLC CONTRACTORS LTD for the provision of Oxford House Lighting Works

Additional information: 
This was awarded via Direct Award SBS10166",The Hertfordshire Partnership University NHS Foundation Trust,20000.0,40000.0,GBP,2026-06-30,2026-06-10,award,complete,45210000,https://www.contractsfinder.service.gov.uk/Notice/a3a711a8-40a6-46c7-b881-b4cb5921bdb1-903912,2026-07-01T10:40:01.301553+00:00
Contracts Finder,ocds-b5fd17-782dd40c-e84e-4a3c-be0c-969820239668_74cab785-11ad-438b-b83b-220e2bcd3e6e-903907,Delivered Ready Prepared Meals,"Delivered Ready Prepared Meals
NHS Supply Chain Framework Agreement: Delivered Ready Prepared Meals 2024 (Lot 2 - Specialist
Ready Prepared Meals) (the ""Framework Agreement"") & FAG 994",NHS PROPERTY SERVICES LIMITED,,4655614.0,GBP,2026-06-30,2026-03-01,award,complete,15894200,https://www.contractsfinder.service.gov.uk/Notice/74cab785-11ad-438b-b83b-220e2bcd3e6e-903907,2026-07-01T10:40:01.301729+00:00
Contracts Finder,ocds-b5fd17-2f8810a0-de75-4f62-bcf0-6f8b9a634ed5_f2aaa032-a875-4aea-ba6d-eab5d5aef27e-903906,St Mary's Hospital Financial Advisor,Financial Advisory Services associated with the redevelopment of St Mary's Hospital (SMH).,Imperial College Healthcare NHS Trust,,165000.0,GBP,2026-06-30,2026-03-31,award,complete,66171000,https://www.contractsfinder.service.gov.uk/Notice/f2aaa032-a875-4aea-ba6d-eab5d5aef27e-903906,2026-07-01T10:40:01.301903+00:00
Contracts Finder,ocds-b5fd17-fdb0ecfc-081b-45f4-b4c1-717ac3eaa130_fe2a3554-882f-45de-aec9-e57272ca7185-903904,"QIP142 0900 2026-06-29 Huntingfield - Suffolk new college, Ipswich (4-seated vehicle required) - AWARD","Suffolk County Council is seeking a mini competition against the following Dynamic Purchasing System: `The supply of Passenger Transport Services`, OJEU Notice Id: 2018/S 031-067685.
      
      QIP142 0900 2026-06-29 Huntingfield - Suffolk new college, Ipswich (4-seated vehicle required)
      
      Further details can be found in the 'Tenders / My Tenders' area of this website, by selecting the 'View Details' button for this project.
      
      The deadline for returned submissions i",Suffolk County Council Passenger Transport,,,GBP,2026-06-30,2026-06-29,award,complete,60000000,https://www.contractsfinder.service.gov.uk/Notice/fe2a3554-882f-45de-aec9-e57272ca7185-903904,2026-07-01T10:40:01.302073+00:00
Contracts Finder,ocds-b5fd17-cfe64e7c-36b8-40f7-843a-82d483f5866f_40404336-1f37-46ba-9861-174380d394bc-903902,Ossett External Upgrade Works,Call off contract from the Estates Works Framework 1737-2018,West Yorkshire Combined Authority,,159701.83,GBP,2026-06-30,2026-06-01,award,complete,45000000,https://www.contractsfinder.service.gov.uk/Notice/40404336-1f37-46ba-9861-174380d394bc-903902,2026-07-01T10:40:01.302262+00:00
Contracts Finder,ocds-b5fd17-213f2067-264e-4afe-8d2e-eb9ed9668375_0705d02d-c5cf-4522-8356-e11e19f91b36-903903,PAHT - Rubrik/Epaton Backup Solution,The Princess Alexandra Hospital NHS Trust award for Rubrik Backup Solution via NHS SBS Framework.,The Princess Alexandra Hospital NHS Trust,,385000.0,GBP,2026-06-30,2026-04-06,award,complete,72260000,https://www.contractsfinder.service.gov.uk/Notice/0705d02d-c5cf-4522-8356-e11e19f91b36-903903,2026-07-01T10:40:01.302451+00:00
Contracts Finder,ocds-b5fd17-1d3d189b-6569-4f2a-854a-af0454919187_6c16faea-450a-4efb-8d17-68e4064d5f8c-903899,WSFT - Radiology - Magnetom AERA,Maintenance of Aera,West Suffolk NHS Foundation Trust,,108769.48,GBP,2026-06-30,2026-06-18,award,complete,50420000,https://www.contractsfinder.service.gov.uk/Notice/6c16faea-450a-4efb-8d17-68e4064d5f8c-903899,2026-07-01T10:40:01.302629+00:00
Contracts Finder,ocds-b5fd17-b57d4be0-1bb6-4dcd-bf56-41ca7c19d8e6_b357b449-bd9f-48db-961a-1980a198f66c-903894,Workforce Solutions Contract,Workforce solutions services,Government Legal Department,,198000000.0,GBP,2026-06-30,2025-02-05,award,complete,79620000,https://www.contractsfinder.service.gov.uk/Notice/b357b449-bd9f-48db-961a-1980a198f66c-903894,2026-07-01T10:40:01.302808+00:00
Contracts Finder,ocds-b5fd17-68a4d5c0-907f-413f-a7d5-fb2a1991f229_139f9851-2b10-41b4-9a8e-1c7cff94558d-903897,ENHT - Omnissa Horizon Renewal,East and North Hertfordshire NHS Trust award for Omnissa Horizon Renewal via NOE CPC Total Technology Solutions Framework.,East and North Hertfordshire NHS Trust,,58000.0,GBP,2026-06-30,2026-04-13,award,complete,72260000,https://www.contractsfinder.service.gov.uk/Notice/139f9851-2b10-41b4-9a8e-1c7cff94558d-903897,2026-07-01T10:40:01.302985+00:00
Contracts Finder,ocds-b5fd17-5ab88d21-2fca-433e-8583-005d3c9dccd3_eb524e46-a1ad-4c24-9b32-adaac8cf4463-903896,Vehicle Lease,"Provision of vehicle lease for Air Accident Investigations Branch.

Direct Award using framework option for 3 year lease of vehicle to provide operational support for employees",DfTc - Department for Transport,,144928.32,GBP,2026-06-30,2026-06-30,award,complete,50111000,https://www.contractsfinder.service.gov.uk/Notice/eb524e46-a1ad-4c24-9b32-adaac8cf4463-903896,2026-07-01T10:40:01.303160+00:00
Contracts Finder,ocds-b5fd17-9c1b5627-d285-4778-a98f-68292eb932d5_7a7c0977-e567-467a-b01a-1f280b1393ab-903893,ITEP1204 - Gartner Research Services,Subscription based Gartner services for national highways,National Highways Limited,,207200.0,GBP,2026-06-30,2026-06-29,award,complete,48517000,https://www.contractsfinder.service.gov.uk/Notice/7a7c0977-e567-467a-b01a-1f280b1393ab-903893,2026-07-01T10:40:01.303353+00:00
Contracts Finder,ocds-b5fd17-481d021b-88d4-4856-8b0c-c72003461503_ec598c26-0109-449d-add7-f5335d07976a-903892,Edgware Plot A Demolition - Consultancy Services,"Edgware Plot A Demolition - Consultancy Services

NHS SBS Healthcare Planning, Construction Consultancy and Ancillary Services (HPCCAS)

Framework Reference SBS10190,Lot 8 Building Surveying",NHS PROPERTY SERVICES LIMITED,,32321.69,GBP,2026-06-30,2026-04-22,award,complete,71530000,https://www.contractsfinder.service.gov.uk/Notice/ec598c26-0109-449d-add7-f5335d07976a-903892,2026-07-01T10:40:01.303533+00:00
Contracts Finder,ocds-b5fd17-d9087801-183a-4172-85a5-b8cb515cdebb_e6cf7cce-e632-466a-97f4-86ebda89369b-903891,WHHT - Review of the BAU Capital Programme,"The West Hertfordshire Teaching Hospitals NHS Trust has awarded a contract to the supplier Electrolite Consulting Limited for review of the BAU capital programme.

Additional information: 
CCS RM6237",West Hertfordshire Teaching Hospitals NHS Trust,80000.0,85000.0,GBP,2026-06-30,2026-06-22,award,complete,71315200,https://www.contractsfinder.service.gov.uk/Notice/e6cf7cce-e632-466a-97f4-86ebda89369b-903891,2026-07-01T10:40:01.303712+00:00
Contracts Finder,ocds-b5fd17-22eaf2c1-a621-4064-b87b-d761d478316c_011330f0-7d68-4e88-9220-a659614e7cd5-903890,EAN - AOMR - Tollesbury Embankment Repairs,EAN - AOMR - Tollesbury Embankment Repairs,Environment Agency,,79920.81,GBP,2026-06-30,2026-05-13,award,complete,45243510,https://www.contractsfinder.service.gov.uk/Notice/011330f0-7d68-4e88-9220-a659614e7cd5-903890,2026-07-01T10:40:01.303889+00:00
Contracts Finder,ocds-b5fd17-6ed0c581-70ff-43c6-bb3a-47523f248f93_00494e7f-3bde-4908-b8c1-a2503ad3dcfb-903888,NDA9/00916.091 - Support to Sealed sources landscape Review,Support to Sealed sources landscape Review - Variation to original scope,Nuclear Decommissioning Authority,,80000.0,GBP,2026-06-30,2026-06-23,award,complete,73000000,https://www.contractsfinder.service.gov.uk/Notice/00494e7f-3bde-4908-b8c1-a2503ad3dcfb-903888,2026-07-01T10:40:01.304064+00:00
Contracts Finder,ocds-b5fd17-3ff657c4-42e5-47f1-a1cb-67a409f5308b_cc0387c3-ff6f-447e-8d94-647cd4a684f8-903883,Transformation Porfolio Programme Management Services,This contract was awarded following a mini-competition process completed under the Yorkshire Purchasing Organisation Managing Consultancy and Professional Services framework ref: 1141. This contract includes options to extend for up to 24 months in total.,THE POLICE AND CRIME COMMISSIONER FOR LINCOLNSHIRE,,1035535.0,GBP,2026-06-30,2026-03-26,awardUpdate,complete,79400000,https://www.contractsfinder.service.gov.uk/Notice/cc0387c3-ff6f-447e-8d94-647cd4a684f8-903883,2026-07-01T10:40:01.304259+00:00
Contracts Finder,ocds-b5fd17-ef1f4f1c-2a6f-49c4-b6f0-78e8ec185f83_38f914a7-d867-4a1c-9c6c-62c46f5d4bf5-903887,Scaling the application of low carbon concrete and FRP reinforcement - Phase 2,"This proposal is in alignment with our roadmap for concrete, steel and asphalt and focuses on one of its main levers of maximising the use of alternative supplementary lower carbon cementitious materials to replace a percentage of carbon intensive Portland cement used in concrete.",National Highways Limited,,215000.0,GBP,2026-06-30,2026-06-26,award,complete,71311000,https://www.contractsfinder.service.gov.uk/Notice/38f914a7-d867-4a1c-9c6c-62c46f5d4bf5-903887,2026-07-01T10:40:01.304440+00:00
