source,notice_id,title,description,organisation,value_low,value_high,currency,published_date,deadline,notice_type,status,cpv_codes,url,scraped_at
Contracts Finder,ocds-b5fd17-217d10f0-68f3-4291-a1aa-b5724ff54477_ef2d3d59-34ae-42f3-b94b-552e32288111-898144,UKSBS DDaT23237 - Provision of Verto Licences,"***Please note this is an award notice, not a call for competition*** 

Department for Energy & Industrial Strategy had a requirement for the provision of project Management Software Licences and Maintenance Service. This Call Off contract has been sources via a mini competition under CCS Technology Products & Associated Services 2 (RM6098) Framework.  


***Contract Variation 001 was raised in line with the original contract to activate the optional 12 month extension.***",ICS on behalf of DSIT and DESNZ,999665.1,1362398.1,GBP,2026-05-19,2024-05-17,awardUpdate,complete,48000000,https://www.contractsfinder.service.gov.uk/Notice/ef2d3d59-34ae-42f3-b94b-552e32288111-898144,2026-05-19T16:49:47.031145+00:00
Contracts Finder,ocds-b5fd17-5d1df5bb-c622-42d6-a972-18412ac48f4a_69d8e998-8b9c-4fbc-bc55-9f119c595135-898141,Residential and Nursing Care Home Services,"Staffordshire County Council (the Council) has put in place a Dynamic Purchasing System (DPS) arrangement for the provision of residential and nursing care home services for its clients. 

The Council has received applications to join the DPS from providers registered with the Care Quality Commission and has entered into a DPS Agreement for the provision of Residential and Nursing Care Home Services (the DPS Agreement) with each of the successful applicants in respect of one or more of ten lot",Staffordshire County Council,247330000.0,274810000.0,GBP,2026-05-19,2017-07-14,tender,active,85000000,https://www.contractsfinder.service.gov.uk/Notice/69d8e998-8b9c-4fbc-bc55-9f119c595135-898141,2026-05-19T16:49:47.031149+00:00
Contracts Finder,ocds-b5fd17-883e0a13-c764-4297-9cea-662ceb1971cc_46bd799a-3683-464b-b8fa-b40c84407dbc-898142,Child in Need transport Contract CBKF1,Child in Need transport Contract CBKF1,Halton Borough Council,,81000.0,GBP,2026-05-19,2025-09-08,award,complete,60120000,https://www.contractsfinder.service.gov.uk/Notice/46bd799a-3683-464b-b8fa-b40c84407dbc-898142,2026-05-19T16:49:47.031154+00:00
Contracts Finder,ocds-b5fd17-a547e85c-de82-44f2-96f0-793a69046ba7_0fea057b-e347-44a4-8e6e-823449b20a3c-898139,Special Education Transport Contract SWLV2,Special Education Transport Contract SWLV2,Halton Borough Council,,124200.0,GBP,2026-05-19,2025-08-13,award,complete,60120000,https://www.contractsfinder.service.gov.uk/Notice/0fea057b-e347-44a4-8e6e-823449b20a3c-898139,2026-05-19T16:49:47.031158+00:00
Contracts Finder,ocds-b5fd17-bcd9d4c2-59c5-4af3-a8d4-cd7beb90642d_40eed860-bd1b-480d-b716-ed1d6c3d2304-898140,Storage Arrays and Migration Services (with support),Storage Arrays and Migration Services (with support),West Sussex County Council,,495882.21,GBP,2026-05-19,2026-04-28,award,complete,30200000,https://www.contractsfinder.service.gov.uk/Notice/40eed860-bd1b-480d-b716-ed1d6c3d2304-898140,2026-05-19T16:49:47.031162+00:00
Contracts Finder,ocds-b5fd17-0560c397-f1c3-4ecf-b8d5-0cea65dbb722_6feb6add-4f9c-41fb-aeae-f1651dc1c909-898138,Special Educational Needs Contract SRSB2,Special Educational Needs Contract SRSB2,Halton Borough Council,,118800.0,GBP,2026-05-19,2025-08-18,award,complete,60120000,https://www.contractsfinder.service.gov.uk/Notice/6feb6add-4f9c-41fb-aeae-f1651dc1c909-898138,2026-05-19T16:49:47.031167+00:00
Contracts Finder,ocds-b5fd17-f1e755a7-9589-4589-8d27-0a6ee3e39889_71ab96d5-cb45-41d9-9a30-89c7f2bff083-898132,Research & Evaluation Partner,"The Police and Crime Commissioner for Cleveland are seeking to award a contract for the provision of Research and Evaluation Services for - Shape Your Safety - Young Voices Consultation 2025.  
The successful provider will develop and draft a full Strategic Needs Assessment (SNA), by no later than the 31st December 2026. 
Further detail of the requirements of the contract can be found here: https://sell2.in-tend.co.uk/blpd/home",POLICE & CRIME COMMISSIONER FOR CLEVELAND,50000.0,100000.0,GBP,2026-05-19,2026-06-09,tender,active,73000000,https://www.contractsfinder.service.gov.uk/Notice/71ab96d5-cb45-41d9-9a30-89c7f2bff083-898132,2026-05-19T16:49:47.031170+00:00
Contracts Finder,ocds-b5fd17-d16eb722-0fb4-49d5-a19b-ea2310781f91_f9f27750-7498-4e29-872c-4352b72d5f21-898134,Special Educational Needs Contract SRSA2,Special Educational Needs Contract SRSA2,Halton Borough Council,,68400.0,GBP,2026-05-19,2025-08-18,award,complete,60120000,https://www.contractsfinder.service.gov.uk/Notice/f9f27750-7498-4e29-872c-4352b72d5f21-898134,2026-05-19T16:49:47.031175+00:00
Contracts Finder,ocds-b5fd17-b0e9aef2-c274-4363-ad33-1378b9449700_8cca3775-9339-4793-9182-d547fc57858c-898135,CA16626 - Finchley Catholic High School - Supply and Installation of Floodlighting to an All-Weather Pitch,"Finchley Catholic High School requires one supplier to fulfil their requirement for the Supply and Installation of Floodlighting to an All-Weather Pitch.

To access this competition: 

Registered:
Login to https://suppliers.multiquote.com and view the opportunity CA16626.

Not registered:
Visit https://suppliers.multiquote.com then register and quote CA16626 as the reason for registration. 

 Any queries please contact MultiQuote on 020 3920 8054.",Finchley Catholic High School,,,GBP,2026-05-19,2026-04-08,awardUpdate,complete,31527260,https://www.contractsfinder.service.gov.uk/Notice/8cca3775-9339-4793-9182-d547fc57858c-898135,2026-05-19T16:49:47.031179+00:00
Contracts Finder,ocds-b5fd17-84a1a8fb-015d-408e-aeff-91cdc2b092f1_2eb70eb4-07b1-4e8c-868a-a624b510ded5-898136,GB-Manchester: ACE 720 CCS - Purchase of Surface Pros and Laptops,"Purchase of Surface Pros and Laptops

Additional information: Purchased under CCS Framework RM6098",The Arts Council of England,,199960.0,GBP,2026-05-19,2026-03-20,award,complete,30213100,https://www.contractsfinder.service.gov.uk/Notice/2eb70eb4-07b1-4e8c-868a-a624b510ded5-898136,2026-05-19T16:49:47.031183+00:00
Contracts Finder,ocds-b5fd17-882f052b-da23-4805-96c3-e65f94de57fc_c2ec1964-824b-4a1b-aefe-34ad48744571-898133,WHTHT - SACH Endoscopy Project Technical Review of Site Infrastructure,Direct award under CCS RM6165,West Hertfordshire Teaching Hospitals NHS Trust,40000.0,60000.0,GBP,2026-05-19,2026-03-01,award,complete,71240000,https://www.contractsfinder.service.gov.uk/Notice/c2ec1964-824b-4a1b-aefe-34ad48744571-898133,2026-05-19T16:49:47.031187+00:00
Contracts Finder,ocds-b5fd17-b908885a-5a4a-4163-ace9-d6633df53704_eadaff9c-f962-4340-93ce-5bf83a035e33-898128,Special Education Transport Contract SOHS1,Special Education Transport Contract SOHS1,Halton Borough Council,,68400.0,GBP,2026-05-19,2025-08-12,award,complete,60120000,https://www.contractsfinder.service.gov.uk/Notice/eadaff9c-f962-4340-93ce-5bf83a035e33-898128,2026-05-19T16:49:47.031191+00:00
Contracts Finder,ocds-b5fd17-e677d2ea-2a43-4d9e-8744-f4b3e64a173a_23d44da3-544c-4b81-a14e-f25613ad7493-898130,P4105015 Provision of Legal Advisers for High Speed Two Phase 1 Rolling Stock,"The call-off contract shall commence on the 13th May  2026 and the expiry date will be 12th August 2026 for a period of Three (3) months. The total contract value will be up to £100,000.00 excluding VAT.  

This Direct Award is being offered under Panel RM6360 Legal Panel for Government Lot 5: Rail Legal Services and the Panel Terms and Conditions shall apply.",DfTc - Department for Transport,,100000.0,GBP,2026-05-19,2026-05-01,award,complete,79100000,https://www.contractsfinder.service.gov.uk/Notice/23d44da3-544c-4b81-a14e-f25613ad7493-898130,2026-05-19T16:49:47.031194+00:00
Contracts Finder,ocds-b5fd17-cb032345-4291-4bb2-b5ad-77bc925ee305_f9439c31-9234-45a8-a3f4-f5c68ae12ab9-898127,"Supply of Smoking Aprons, FR throws and FR Rubber Mats","Supply of smoking aprons, FR throws and rubber mats to be provided to vulnerable members of the community during Safe and Well visits conducted by West Midlands Fire Service.

Additional information: Call off from Safe and Well Equipment Framework C5682",West Midlands Fire Service,,25900.0,GBP,2026-05-19,2026-05-13,award,complete,39143110,https://www.contractsfinder.service.gov.uk/Notice/f9439c31-9234-45a8-a3f4-f5c68ae12ab9-898127,2026-05-19T16:49:47.031198+00:00
Contracts Finder,ocds-b5fd17-958a3bed-87de-4a96-a2e8-6282642fd582_c1bb4d80-0d55-4863-bfd8-4c0447cb4ecf-898129,"CA17564 - RFQ 2026/02 - Retender - NMANDD PEACEPLUS ""Thriving Together"" - Market Ready Programme - Sustainably Made, Ready to Trade","Newry Mourne & Down District Council's PEACEPLUS Action Plan includes the delivery of Collaborative Interaction Programmes under Strand 2 - Thriving and Peaceful Communities. A need has been identified through consultation for the delivery of a Market Ready Programme.  This programme will aim to work alongside specific groups to promote the use of sustainable and environmentally friendly business practices, while engaging local home industries and encouraging the development of new relationships","Newry, Mourne and Down District Council (NMD)",,,GBP,2026-05-19,2026-05-18,awardUpdate,complete,80000000,https://www.contractsfinder.service.gov.uk/Notice/c1bb4d80-0d55-4863-bfd8-4c0447cb4ecf-898129,2026-05-19T16:49:47.031202+00:00
Contracts Finder,ocds-b5fd17-64a21fbd-e117-441e-93dc-6a52fd61dfde_d03ccd60-b54c-417e-8b81-73ba000f7bfe-898123,Special Education Transport Contract SEDS1,Special Education Transport Contract SEDS1,Halton Borough Council,,89600.0,GBP,2026-05-19,2025-08-12,award,complete,60120000,https://www.contractsfinder.service.gov.uk/Notice/d03ccd60-b54c-417e-8b81-73ba000f7bfe-898123,2026-05-19T16:49:47.031205+00:00
Contracts Finder,ocds-b5fd17-75f484da-11e9-4a13-8470-9115c9657f4c_1d2bfbe1-bfd5-4f4f-961d-00c13632a9c5-898126,CA17856 - Tender for the provision of General Roofing Services,"New College Swindon is seeking a contractor to provide planned and reactive roofing services across its estate. This includes inspections, maintenance, repairs and emergency works across multiple sites.

The contract will run for 4 years from September 2026 on a call-off basis, with no guaranteed volumes. Full details are provided in the tender documentation.

To access this competition: 

Registered:
Login to https://suppliers.multiquote.com and view the opportunity CA17856.

Not regis",New College Swindon,,210000.0,GBP,2026-05-19,2026-06-15,tender,active,45261900,https://www.contractsfinder.service.gov.uk/Notice/1d2bfbe1-bfd5-4f4f-961d-00c13632a9c5-898126,2026-05-19T16:49:47.031209+00:00
Contracts Finder,ocds-b5fd17-877db092-9735-4e66-a83c-56386e4ca2ab_a2f3219f-11ec-48f7-a2ec-c1403797ecac-898125,"QSB442 0900 2026-05-19 Lavenham - Sudbury library, Sudbury (4-seated vehicle required) - AWARD","Suffolk County Council is seeking a mini competition against the following Dynamic Purchasing System: `The supply of Passenger Transport Services`, OJEU Notice Id: 2018/S 031-067685.
      
      QSB442 0900 2026-05-19 Lavenham - Sudbury library, Sudbury (4-seated vehicle required)
      
      Further details can be found in the 'Tenders / My Tenders' area of this website, by selecting the 'View Details' button for this project.
      
      The deadline for returned submissions is  0900 ",Suffolk County Council Passenger Transport,,,GBP,2026-05-19,2026-05-19,award,complete,60000000,https://www.contractsfinder.service.gov.uk/Notice/a2f3219f-11ec-48f7-a2ec-c1403797ecac-898125,2026-05-19T16:49:47.031212+00:00
Contracts Finder,ocds-b5fd17-528ce886-c72d-4902-980a-6377f263839e_7615cb10-e532-4a5d-b8f2-702531526887-898119,Supply of Fire Retardant Bedding,"The supply and delivery of fire retardant bedding, which will be provided to vulnerable members of the community during Safe and Well visits conducted by West Midlands Fire Service",West Midlands Fire Service,,25000.0,GBP,2026-05-19,2026-05-13,award,complete,39143110,https://www.contractsfinder.service.gov.uk/Notice/7615cb10-e532-4a5d-b8f2-702531526887-898119,2026-05-19T16:49:47.031218+00:00
Contracts Finder,ocds-b5fd17-787ed05b-9797-4b9b-8f1c-eb48d3a0864c_0c9a8471-4ed4-473b-94ac-d75a0d344b8a-898124,Legal Services to support Agratas Gigafactory Project,"This contract has been awarded and is published for transparency purposes.

This contract is for legal services to support the Agratas Gigafactory Project.",Department for Business and Trade,,1666666.67,GBP,2026-05-19,2026-01-14,award,complete,79100000,https://www.contractsfinder.service.gov.uk/Notice/0c9a8471-4ed4-473b-94ac-d75a0d344b8a-898124,2026-05-19T16:49:47.031222+00:00
Contracts Finder,ocds-b5fd17-19206318-fa38-4762-ac74-bad46bb4ed4d_751fc8c2-e9e9-4a28-af21-60d6b5d4fc43-898122,Special Education Transport Contract SWLV3,Special Education Transport Contract SWLV3,Halton Borough Council,,129200.0,GBP,2026-05-19,2025-08-12,award,complete,60120000,https://www.contractsfinder.service.gov.uk/Notice/751fc8c2-e9e9-4a28-af21-60d6b5d4fc43-898122,2026-05-19T16:49:47.031225+00:00
Contracts Finder,ocds-b5fd17-6feac676-7e9f-4128-8fae-504e5357adf5_d7435b17-4186-4035-a0ed-3e1b0cfb31e6-898120,Special Education Transport Contract SGRP7,Special Education Transport Contract SGRP7,Halton Borough Council,,91200.0,GBP,2026-05-19,2025-08-12,award,complete,60120000,https://www.contractsfinder.service.gov.uk/Notice/d7435b17-4186-4035-a0ed-3e1b0cfb31e6-898120,2026-05-19T16:49:47.031229+00:00
Contracts Finder,ocds-b5fd17-8383a717-9449-42c2-b047-ca75dc1a2dd5_516354f4-c46a-4e3c-bc36-84079309d8d8-898121,CA17719 - ITT 10/2026 - PEACEPLUS PP2014 - Moneydarragh community Hub Ltd - Creation of new outdoor classroom,"Applications are invited from Contractors, under the terms of the NEC4 ECSC Short Contract,
for the following PEACEPLUS project: Moneydarragh Community Hub Ltd - Creation of new outdoor
classroom - PP2014: Supply and installation of new outdoor Messy Play activity area and
associated site works at Moneydarragh Community Hub, Annalong.

The works will be for Civil Engineering - 45200000-9, Landscaping - 45112700-2, Paved
Areas - 45233200-1, Land Clearance - 45111220-6, Works for complete or","Newry, Mourne and Down District Council (NMD)",,,GBP,2026-05-19,2026-05-27,tender,active,45200000,https://www.contractsfinder.service.gov.uk/Notice/516354f4-c46a-4e3c-bc36-84079309d8d8-898121,2026-05-19T16:49:47.031233+00:00
Contracts Finder,ocds-b5fd17-c3294e56-64c8-446d-9350-33c43b58c4d3_77a3d5ef-9586-409c-ba60-ff3f5b79e407-898118,Special Education Transport Contract SGRP1 SGRP4 SGRP5,Special Education Transport Contract SGRP1 SGRP4 SGRP5,Halton Borough Council,,298500.0,GBP,2026-05-19,2025-08-12,award,complete,60120000,https://www.contractsfinder.service.gov.uk/Notice/77a3d5ef-9586-409c-ba60-ff3f5b79e407-898118,2026-05-19T16:49:47.031237+00:00
Contracts Finder,ocds-b5fd17-259af958-e438-4aee-9091-43848b668991_1e82fcda-8960-4bb0-a332-c8a39a353e93-898116,TD2394 - 2026/27 Footway Slurry Sealing Programme,Procurement for DCCs 2026/27 Footway Slurry Sealing Programme.,DERBY CITY COUNCIL,,250000.0,GBP,2026-05-19,2026-04-23,award,complete,45000000,https://www.contractsfinder.service.gov.uk/Notice/1e82fcda-8960-4bb0-a332-c8a39a353e93-898116,2026-05-19T16:49:47.031241+00:00
Contracts Finder,ocds-b5fd17-28669850-59c9-4e7c-97c4-9deb775f710c_532fdfc4-ef19-47e7-bb95-f6f268a561bd-898115,Special Education Transport Contract SWGC1,Special Education Transport Contract SWGC1,Halton Borough Council,,67600.0,GBP,2026-05-19,2025-08-12,award,complete,60120000,https://www.contractsfinder.service.gov.uk/Notice/532fdfc4-ef19-47e7-bb95-f6f268a561bd-898115,2026-05-19T16:49:47.031244+00:00
Contracts Finder,ocds-b5fd17-7b3c514f-2ef1-4ebd-9ca6-b153908094f7_4a64338e-d04e-49ad-848a-cf648c4bef2d-898089,HSM Support for HMPO,This contract is the provision of HSM support for HMPO,Home Office,,62630.68,GBP,2026-05-19,2026-04-30,award,complete,72611000,https://www.contractsfinder.service.gov.uk/Notice/4a64338e-d04e-49ad-848a-cf648c4bef2d-898089,2026-05-19T16:49:47.031248+00:00
Contracts Finder,ocds-b5fd17-f6841bb5-1356-4dfe-8d0b-a0f8960c177f_6e500f9e-f1ea-4fef-a096-5e1f6e483c52-898103,Special Educational Needs Transport Contract SVRP2,Special Educational Needs Transport Contract SVRP2,Halton Borough Council,,83600.0,GBP,2026-05-19,2025-08-12,award,complete,60120000,https://www.contractsfinder.service.gov.uk/Notice/6e500f9e-f1ea-4fef-a096-5e1f6e483c52-898103,2026-05-19T16:49:47.031251+00:00
Contracts Finder,ocds-b5fd17-4c40a2f2-c498-4fd3-bb01-88051ac0ddda_3285f173-4db6-4538-bace-701b7de89969-898114,CA17797 - Invitation to Tender for Harleston Sancroft Secondary Phase Stage Lighting,"The Diocese of Norwich Education Services Company (DoNESC) is carrying out a procurement exercise on the behalf of Harleston Sancroft Secondary Phase to procure the replacement of a full lighting system and infrastructure above the stage and auditorium.

To access this competition: 

Registered:
Login to https://suppliers.multiquote.com and view the opportunity CA17797.

Not registered:
Visit https://suppliers.multiquote.com then register and quote CA17797 as the reason for registration.",Diocese of Norwich Education and Academies Trust,,40000.0,GBP,2026-05-19,2026-06-19,tender,active,45212322,https://www.contractsfinder.service.gov.uk/Notice/3285f173-4db6-4538-bace-701b7de89969-898114,2026-05-19T16:49:47.031256+00:00
Contracts Finder,ocds-b5fd17-cfb28189-ef67-4559-a154-045428eec9d2_d9b43aa8-74bc-4516-9d98-0537b484baaf-898113,CA17800 - DN Colleges Group - ITT for Waterfront Restaurant Refurbishment Works,"DN Colleges Group is seeking to appoint a suitably experienced contractor to deliver the refurbishment works to the Waterfront Restaurant, located on the second floor of The Hub, Chappell Drive, Doncaster, DN1 2RF.

The project relates to internal alterations and refurbishment of the existing Waterfront Restaurant, associated bar area, takeaway/collection area and adjoining classroom space. The works are intended to improve the layout, finishes, appearance and functionality of the space, creat",DN Colleges Group,,110000.0,GBP,2026-05-19,2026-06-03,tender,active,45421153,https://www.contractsfinder.service.gov.uk/Notice/d9b43aa8-74bc-4516-9d98-0537b484baaf-898113,2026-05-19T16:49:47.031260+00:00
Contracts Finder,ocds-b5fd17-07a6d459-c972-42cc-902f-f5de0ca13f55_d8c51240-1e89-4267-8e83-ed5b12b10467-898112,CA17804 - Leasing of Minibuses,"Requirement for 8 minibuses ( 2 x 15-seater and 6 x 17-seater) on a 5-year lease. Quotes requested for maintained and non-maintained.

To access this competition: 

Registered:
Login to https://suppliers.multiquote.com and view the opportunity CA17804.

Not registered:
Visit https://suppliers.multiquote.com then register and quote CA17804 as the reason for registration. 

 Any queries please contact MultiQuote on 020 3920 8054.",Sparsholt College Hampshire,,264000.0,GBP,2026-05-19,2026-06-08,tender,active,34114400,https://www.contractsfinder.service.gov.uk/Notice/d8c51240-1e89-4267-8e83-ed5b12b10467-898112,2026-05-19T16:49:47.031264+00:00
Contracts Finder,ocds-b5fd17-e770180e-4418-4d3d-a5bc-c866dea4da22_5854d9a7-fa36-46f7-acf4-a4554a3b2573-898111,"CA17737 - Salford College, ITT Tiils","The College require the upgrade of the current POS till system and online payment solution to comprehensively cover the requirements detailed below. The current systems are circa 10  years old. 



To access this competition: 

Registered:
Login to https://suppliers.multiquote.com and view the opportunity CA17737.

Not registered:
Visit https://suppliers.multiquote.com then register and quote CA17737 as the reason for registration. 

 Any queries please contact MultiQuote on 020 3920",Salford City College,,75000.0,GBP,2026-05-19,2026-06-05,tender,active,48110000,https://www.contractsfinder.service.gov.uk/Notice/5854d9a7-fa36-46f7-acf4-a4554a3b2573-898111,2026-05-19T16:49:47.031267+00:00
Contracts Finder,ocds-b5fd17-e56fc72f-9801-4ebe-8a55-3fbf2597986d_4cdeb318-181d-4eeb-a173-96b5f5b51989-898110,CA17783 - Recruitment Systems and Pre Employment Services,"Chichester College Group is conducting an open procurement under the Procurement Act 2023 to appoint one or more suppliers to provide recruitment-related systems and pre-employment services.
The procurement is divided into two lots:

Lot 1: Online job board advertising services to support vacancy promotion, candidate attraction, and performance reporting;
Lot 2: Online Disclosure and Barring Service (DBS) checks and right to work verification services, including digital identity validation a",Chichester College Group,,310000.0,GBP,2026-05-19,2026-06-06,tender,active,79600000,https://www.contractsfinder.service.gov.uk/Notice/4cdeb318-181d-4eeb-a173-96b5f5b51989-898110,2026-05-19T16:49:47.031271+00:00
Contracts Finder,ocds-b5fd17-cad8a4fc-4d79-4ace-93d6-ab4ae708bc23_dc4ca274-723f-47a2-9c9a-81bd9a380b04-898109,CA17773 - DN Colleges Group - Provision of Student Transport Services,"North Lindsey College, of Kingsway, Scunthorpe, DN17 1AJ requires the provision of reliable, safe, and compliant student transport services for designated Route 642.

The Service Provider shall deliver a fully managed transport service, including vehicles, drivers, operational management, and all supporting systems required to meet the needs of the College and its learners.
The appointed Service Provider will be considered the approved supplier of Student Transport services route 642.


To",DN Colleges Group,,250000.0,GBP,2026-05-19,2026-06-08,tender,active,60100000,https://www.contractsfinder.service.gov.uk/Notice/dc4ca274-723f-47a2-9c9a-81bd9a380b04-898109,2026-05-19T16:49:47.031274+00:00
Contracts Finder,ocds-b5fd17-feafd21b-2a9b-4ded-a4eb-d57641fa9610_97b92fd9-deba-4717-ac30-e135e01381a8-898108,CA17774 - Coventry College - Marketing Services,"Coventry College are seeking proposals from providers of marketing services to provide a full agency service from a contract commencement date of 1st September 2026. 

To access this competition: 

Registered:
Login to https://suppliers.multiquote.com and view the opportunity CA17774.

Not registered:
Visit https://suppliers.multiquote.com then register and quote CA17774 as the reason for registration. 

 Any queries please contact MultiQuote on 020 3920 8054.",Coventry College,,625000.0,GBP,2026-05-19,2026-06-15,tender,active,79342000,https://www.contractsfinder.service.gov.uk/Notice/97b92fd9-deba-4717-ac30-e135e01381a8-898108,2026-05-19T16:49:47.031277+00:00
Contracts Finder,ocds-b5fd17-2a5a2148-1572-459f-abd6-2f56169c32b8_2e183ea3-26e8-49fc-ad77-6dc9556b0cdd-898107,CA17764 - CoWC Temporary and Permanent Staffing - Direct Award via CPC Framework,"City of Wolverhampton College is procuring temporary and permanent staffing services by direct award using an established CPC framework. This route provides a compliant and efficient procurement method, ensures value for money through pre?agreed terms, and supports continuity of operational and academic staffing. 

To access this competition: 

Registered:
Login to https://suppliers.multiquote.com and view the opportunity CA17764.

Not registered:
Visit https://suppliers.multiquote.com t",City of Wolverhampton College,,294000.0,GBP,2026-05-19,2025-07-31,award,complete,79620000,https://www.contractsfinder.service.gov.uk/Notice/2e183ea3-26e8-49fc-ad77-6dc9556b0cdd-898107,2026-05-19T16:49:47.031281+00:00
Contracts Finder,ocds-b5fd17-d73b2bee-41ef-452d-867d-190ba495fbf1_1f66daa3-3239-4329-8ca8-ee621ceee1fb-898106,CA17726 - Nova Education Trust Tender for Grounds Maintenance Services,"To provide grounds maintenance services for the Nova Education Trust based in the East Midlands.  The competition is to divided into 6 Lots.

Includes Lots: 
Lot 1: Lot 1 - Nottingham
Lot 2: Lot 2 - Bingham
Lot 3: Lot 3 Leicester
Lot 4: Lot 4 Newark
Lot 5: Lot 5 North Nottinghamshire
Lot 6: Lot 6 - Derbyshire

To access this competition: 

Registered:
Login to https://suppliers.multiquote.com and view the opportunity CA17726.

Not registered:
Visit https://suppliers.multiquote.co",Nova Trust,,584100.0,GBP,2026-05-19,2026-06-12,tender,active,77314000,https://www.contractsfinder.service.gov.uk/Notice/1f66daa3-3239-4329-8ca8-ee621ceee1fb-898106,2026-05-19T16:49:47.031285+00:00
Contracts Finder,ocds-b5fd17-03f1ecd7-ae3c-47ac-bc06-6da8d2bec77a_ccd09d4c-fd0d-43f6-9da5-a26ffa84c9a6-898105,CA17710 - Fire and Intruder Alarm System Maintenance  Tender,"To maintain a multitude of devices at Leicester College relating to Fire and Intruder systems

To access this competition: 

Registered:
Login to https://suppliers.multiquote.com and view the opportunity CA17710.

Not registered:
Visit https://suppliers.multiquote.com then register and quote CA17710 as the reason for registration. 

 Any queries please contact MultiQuote on 020 3920 8054.",Leicester College,,100.0,GBP,2026-05-19,2026-06-01,tender,active,44115500,https://www.contractsfinder.service.gov.uk/Notice/ccd09d4c-fd0d-43f6-9da5-a26ffa84c9a6-898105,2026-05-19T16:49:47.031288+00:00
Contracts Finder,ocds-b5fd17-6b8c46c7-3910-4195-8178-6344d1891b49_636ee7e6-05bb-4fe4-8f4d-21561580e661-898104,CA17701 - Dereham Infants & Swaffham Windows & Doors,"To undertake the replacement of windows and doors at two academies. 

To access this competition: 

Registered:
Login to https://suppliers.multiquote.com and view the opportunity CA17701.

Not registered:
Visit https://suppliers.multiquote.com then register and quote CA17701 as the reason for registration. 

 Any queries please contact MultiQuote on 020 3920 8054.",Diocese of Norwich Education and Academies Trust,,25000.0,GBP,2026-05-19,2026-05-27,tender,active,45421130,https://www.contractsfinder.service.gov.uk/Notice/636ee7e6-05bb-4fe4-8f4d-21561580e661-898104,2026-05-19T16:49:47.031293+00:00
