source,notice_id,title,description,organisation,value_low,value_high,currency,published_date,deadline,notice_type,status,cpv_codes,url,scraped_at
FTS,ocds-h6vhtk-051024_045930-2026,Two Stage tender for the provision of Pre-Construction Services and Construction Works for Andover Theatre,"A Competitive Flexible procurement for the pre-construction services and construction works for Andover Theatre. The existing Site is owned by the Authority. It included a vacant retail unit (Unit 62) which was last occupied by Poundstretcher. To support the construction of Andover's New Theatre, the Authority has let a separate contract for demolition of the existing unit, leaving a clear site ready for development. The new theatre will be the new home of The Lights, a successful, Authority ope",Test Valley Borough Council,,,GBP,2026-05-19,,award,complete,,https://www.find-tender.service.gov.uk/Notice/045930-2026,2026-05-19T16:49:45.162708+00:00
FTS,ocds-h6vhtk-069c4e_045929-2026,Employers Agent and Clerk of Works for Town Road Phase 3 Development,"*This is for information only, as the contract has been awarded* West Kent require Employer's Agent and Clerk of Works services to their development scheme known as Town Road Phase 3. This will be a below-threshold direct award to the preferred supplier, following successful delivery of services to the previous phase.",West Kent Housing Association,,,GBP,2026-05-19,,award,complete,,https://www.find-tender.service.gov.uk/Notice/045929-2026,2026-05-19T16:49:45.162733+00:00
FTS,ocds-h6vhtk-069c4d_045928-2026,Supply of 2 x 3.5 Tonne Panel Vans,Supply of two vans as per specification document,Shrewsbury Town Council,,,GBP,2026-05-19,2026-06-05,tender,active,,https://www.find-tender.service.gov.uk/Notice/045928-2026,2026-05-19T16:49:45.162739+00:00
FTS,ocds-h6vhtk-069c4c_045927-2026,Supply of 1 x 3.5T 4-Wheel Drive Vehicle,Per Tender document supply of one vehicle,Shrewsbury Town Council,,,GBP,2026-05-19,2026-06-05,tender,active,,https://www.find-tender.service.gov.uk/Notice/045927-2026,2026-05-19T16:49:45.162744+00:00
FTS,ocds-h6vhtk-067f68_045926-2026,Neighbourhood Health Community Prevention and Empowerment Programme,"North, Central and South Croydon
South West London Integrated Care Board (SWL ICB) - Croydon Place is inviting providers, voluntary and community sector organisations, social enterprises, primary care partners and other interested organisations to attend a pre-procurement online Market Engagement Event in relation to the forthcoming procurement of the:
Croydon Neighbourhood Health Community Prevention and Empowerment Programme
The programme represents a significant transition to integrated, loca",NHS SOUTH WEST LONDON INTEGRATED CARE BOARD,,1801600.0,GBP,2026-05-19,,planning,planning,,https://www.find-tender.service.gov.uk/Notice/045926-2026,2026-05-19T16:49:45.162748+00:00
FTS,ocds-h6vhtk-05217b_045925-2026,Care and Support Services within Extra Care Housing,"The Council is seeking to award a contract for the provision of care and support services for the following extra care accommodation settings:
• Haddington Vale
• Cherry Tree Gardens
Service requirements include Care and Support Services to individuals who are aged 18 years and over have been assessed by the Council as being eligible under the Care Act 2014 for care and support and whose care and support is fully or part funded by the Local Authority.
The service will be provided to tenants with",Sunderland City Council,,,GBP,2026-05-19,2026-06-17,tender,active,,https://www.find-tender.service.gov.uk/Notice/045925-2026,2026-05-19T16:49:45.162753+00:00
FTS,ocds-h6vhtk-069c4b_045924-2026,NHS Health Checks,"NHS Health Checks are a key national prevention programme, intended to identify and manage cardiovascular risk among eligible adults. However, delivery and uptake in Lancashire remains inconsistent, with significant variation between practices, including conversion from invitations to completed checks and changing administrative workloads. Many practices report low response rates to invitations due to lack of awareness of the NHS Health Check programme, high levels of non attendance, and substan",Lancashire County Council,,,GBP,2026-05-19,,planning,planning,,https://www.find-tender.service.gov.uk/Notice/045924-2026,2026-05-19T16:49:45.162757+00:00
FTS,ocds-h6vhtk-06690e_045922-2026,Community Investigation Hubs,"Community Investigation Hubs form part of the network of Community Diagnostic Centres in Somerset with the aim of offering patients a wide range of diagnostic tests closer to home and greater choice as to where and how they are undertaken, reducing the need for hospital visits and potentially expediting the start of treatment.",SOMERSET NHS FOUNDATION TRUST,,,GBP,2026-05-19,,tenderUpdate,,85323000,https://www.find-tender.service.gov.uk/Notice/045922-2026,2026-05-19T16:49:45.162770+00:00
FTS,ocds-h6vhtk-0666c2_045921-2026,Supply of Miscellaneous Tyres,"West Yorkshire Police (WYP) have their own Transport Department which undertakes servicing and repairs to police vehicles including replacing worn and punctured tyres.
To complement an existing contract with Goodyear for their own brand tyres, for this contract Suppliers will be required to provide a variety of tyre brands, for both cars and motorcycles, to meet ad-hoc requirements. Based on historic data, the required range is likely to include, but not be strictly limited to, the following bra",West Yorkshire Combined Authority,,600000.0,GBP,2026-05-19,2026-06-08,tenderUpdate,active,,https://www.find-tender.service.gov.uk/Notice/045921-2026,2026-05-19T16:49:45.162776+00:00
FTS,ocds-h6vhtk-069c46_045920-2026,YORbuild4 Minor Works Contractors Framework Agreement West Area,"A Framework Agreement to serve all public sector bodies (and their statutory successors) and third sector organisations in the West Yorkshire.
The works involved are principally general building works and new housing, including contractors design when required. In addition some civil engineering works may also be included.
Principles of collaborative working and partnering will be key to the relationships under the framework.",Leeds City Council,,,GBP,2026-05-19,,planningUpdate,planned,,https://www.find-tender.service.gov.uk/Notice/045920-2026,2026-05-19T16:49:45.162780+00:00
FTS,ocds-h6vhtk-069c4a_045919-2026,Umbrella Crisis Payment Provider,"As part of the scheme guidance for the Crisis and Resilience Fund, there is a requirement to assess and administer crisis payments. 
Recommendation is to use an umbrella payment approach to enable the Local Welfare Provision and Crisis Payments Team to quickly support residents experiencing financial crisis. It ensures access to a range of payment options including energy vouchers, supermarket vouchers, goods in kind and other types of payments so that residents can be supported when
experiencin",Oldham Metropolitan Borough Council,,4400000.0,GBP,2026-05-19,,planning,planned,,https://www.find-tender.service.gov.uk/Notice/045919-2026,2026-05-19T16:49:45.162784+00:00
FTS,ocds-h6vhtk-069c49_045918-2026,YORbuild4 Medium Works Contractors Framework Agreement West Area,"A Framework Agreement to serve all public sector bodies (and their statutory successors) and third sector organisations in the Yorkshire and Humber region, Sheffield Local Enterprise Partnership region, Nottinghamshire, Derbyshire and areas of Leicestershire.
The works involved are principally general building works and new housing, including contractors design when required. In addition some civil engineering works may also be included. 
Principles of collaborative working and partnering will b",Leeds City Council,,400000000.0,GBP,2026-05-19,,planning,planned,,https://www.find-tender.service.gov.uk/Notice/045918-2026,2026-05-19T16:49:45.162788+00:00
FTS,ocds-h6vhtk-069c48_045917-2026,Preliminary Market Engagement - Rochdale Council Empty Homes and Leasing Programme,"The GMCA Council Empty Homes and Leasing Programme (Council EHLP) aims to bring in to use properties that have been empty for 6 months or more. The properties will be used to rehouse families who are currently living in Temporary Accommodation (TA) or at risk of moving into TA.
Rochdale Council has received a grant funding offer to deliver a minimum of 32 homes for the Council EHLP. The grant period commences 1st April 2026 and ends 31st March 2027.
The funding will be used to bring empty homes ",Rochdale Borough Council,,,GBP,2026-05-19,,planning,planning,,https://www.find-tender.service.gov.uk/Notice/045917-2026,2026-05-19T16:49:45.162792+00:00
FTS,ocds-h6vhtk-069c47_045916-2026,SSRO Security Assessment and Penetration Test,"The SSRO is seeking to appoint a supplier to provide a core programme of work surrounding Security Assessment and Penetration Test services. 
The Supplier is required to carry out in each year of the contract the core programme of work as detailed below.  
Phase 1: Security Assessment and Penetration Testing and reporting the results (one combined report or separate documents at Supplier discretion) as set out in the Service Specification.  
Phase 2: Liaising with the SSRO and the SSRO's IT Mana",Single Source Regulations Office,,41667.0,GBP,2026-05-19,2026-06-08,tender,active,,https://www.find-tender.service.gov.uk/Notice/045916-2026,2026-05-19T16:49:45.162796+00:00
FTS,ocds-h6vhtk-06714a_045915-2026,"Award of Ceredigion, Pen Dinas – Wellington Monument Repair and Conservation Works / Dyfarniad Gwaith Atgyweirio a Chadwraeth Henebion Pen Dinas – Wellington, Ceredigion","Ceredigion County Council is awarding to a contractor who can undertake repair and conservation works to the Wellington Monument at Pen Dinas, Aberystwyth, a Scheduled Monument. The works include the provision of access scaffolding, inspection and repair of stonework to the upper section of the monument, and coordination with specialist contractors undertaking lightning conductor works. All repairs must be carried out using appropriate heritage methods and materials, in accordance with Cadw guid",Cyngor Sir Ceredigion County Council,,,GBP,2026-05-19,,award,complete,,https://www.find-tender.service.gov.uk/Notice/045915-2026,2026-05-19T16:49:45.162801+00:00
FTS,ocds-h6vhtk-050f4c_045914-2026,CN250245 - Traffic Systems Asset Maintenance,"The Traffic Systems Asset Maintenance contract provides full maintenance provision for existing and new technology assets on the Kent Highway network, primarily traffic signals but also electronic message signs, CCTV and associated communications infrastructure, to include:
• Routine inspections of equipment to meet statutory duties
• Fault repairs due to wear and tear or third-party damage
• Temporary switch off traffic signals to allow third parties to undertake works
• Planned works to modify",Kent County Council,,,GBP,2026-05-19,,award,complete,,https://www.find-tender.service.gov.uk/Notice/045914-2026,2026-05-19T16:49:45.162805+00:00
FTS,ocds-h6vhtk-069c46_045913-2026,YORbuild4 Minor Works Contractors Framework Agreement West Area,"A Framework Agreement to serve all public sector bodies (and their statutory successors) and third sector organisations in the West Yorkshire. 
The works involved are principally general building works and new housing, including contractors design when required. In addition some civil engineering works may also be included.
Principles of collaborative working and partnering will be key to the relationships under the framework.",Leeds City Council,,,GBP,2026-05-19,,planning,planned,,https://www.find-tender.service.gov.uk/Notice/045913-2026,2026-05-19T16:49:45.162809+00:00
FTS,ocds-h6vhtk-04facf_045912-2026,Stray Dog Collection & Kennelling Service,"1.0.1.	Mid Sussex District Council (""the Council"") is inviting bids from suitably qualified and experienced organisations for the collection and accommodation of stray dogs that are found within the area of Mid Sussex, West Sussex. The contract is scheduled to start on the 8th June 2025 for a period of three years ending on the 7th June 2028, with an option to extend for a further one year period subject to performance and the absolute discretion of the Council.
1.0.2.	The Commencement Date for ",Mid Sussex District Council,,,GBP,2026-05-19,,award,complete,,https://www.find-tender.service.gov.uk/Notice/045912-2026,2026-05-19T16:49:45.162814+00:00
FTS,ocds-h6vhtk-059eb2_045911-2026,Former London Chest Hospital - JCT Design and Build - Phase 1 Works,Works included the erection of two blocks within phase 1 of the former London Chest Hospital for 76 affordable units and associated landscaping works.,BONNER ROAD LLP,,,GBP,2026-05-19,,award,complete,,https://www.find-tender.service.gov.uk/Notice/045911-2026,2026-05-19T16:49:45.162818+00:00
FTS,ocds-h6vhtk-065603_045910-2026,"Health, Wellbeing and Night Hub","Durham County Council (the Council) are seeking submissions from suitably experienced and skilled organisations to provide the specified services for the Health, Wellbeing and Night Hub.  This includes the Safe Night Hub, Integrated Support Hub and dispersed properties.  The main service should be based in one premises which is able to deliver the wrap around support required.  The contract will also include the provision of 10 dispersed supported accommodation properties to be used as a step do",Durham County Council,,1750000.0,GBP,2026-05-19,2026-08-31,tender,active,,https://www.find-tender.service.gov.uk/Notice/045910-2026,2026-05-19T16:49:45.162823+00:00
FTS,ocds-h6vhtk-069c45_045909-2026,"Choice, Independence and Community Living Framework","The purpose of the Choice, Independence and Community Living Framework is to commission a diverse, high-quality and sustainable range of services that enable adults in Wirral to live with choice, independence and strong connections to their local communities.
The framework will secure provision across Supported Living (including outreach and accommodation based support), Day Opportunities, Short Breaks and Innovation and Future need services. It is intended to ensure that support is flexible, in",Wirral Council,,,GBP,2026-05-19,,planning,planned,,https://www.find-tender.service.gov.uk/Notice/045909-2026,2026-05-19T16:49:45.162827+00:00
FTS,ocds-h6vhtk-0663f6_045908-2026,The Council requires a mobile coffee style catering provider to supply hot and cold drinks and light refreshments at Sanders Park,,,,,GBP,2026-05-19,,tenderCancellation,complete,,https://www.find-tender.service.gov.uk/Notice/045908-2026,2026-05-19T16:49:45.162832+00:00
FTS,ocds-h6vhtk-069c44_045907-2026,JHG - Office Cleaning (Tameside) Contract 2026-2028,"The service provider shall be required to have the skills, knowledge, experience and qualifications necessary to deliver a first-class office cleaning provision in two of our main offices with the potential to add satellite workplaces in Tameside to the contract in the future. 
Cavendish 249, Cavendish Street, Ashton-u-Lyne OL6 7AT
Globe Lane Depot, Outram Road, Globe Lane Industrial Estate, Dukinfield SK16 4XP
Jigsaw Homes Group are looking for one service provider to deliver this contract.
The",Jigsaw Homes Group,,100000.0,GBP,2026-05-19,2026-06-15,tender,active,,https://www.find-tender.service.gov.uk/Notice/045907-2026,2026-05-19T16:49:45.162836+00:00
FTS,ocds-h6vhtk-05d9d3_045906-2026,"Soft Marketing Questionnaire- Choice, Independence and Community Living Framework","The purpose of the Choice, Independence and Community Living Framework is to commission a diverse, high-quality and sustainable range of services that enable adults in Wirral to live with choice, independence and strong connections to their local communities.
The framework will secure provision across Supported Living (including outreach and accommodation-based support), Day Opportunities, Short Breaks and Innovation and Future need services. It is intended to ensure that support is flexible, in",Wirral Council,,,GBP,2026-05-19,,planning,planned,,https://www.find-tender.service.gov.uk/Notice/045906-2026,2026-05-19T16:49:45.162841+00:00
FTS,ocds-h6vhtk-05f4f7_045905-2026,Alternative Education Provision,Establish an Open Framework for Alternative Educational Provision for children who are not in school.,North East Lincolnshire Borough Council,,5000000.0,GBP,2026-05-19,,planning,planned,,https://www.find-tender.service.gov.uk/Notice/045905-2026,2026-05-19T16:49:45.162845+00:00
FTS,ocds-h6vhtk-069c43_045904-2026,Your Bus Journey Survey  Transport Focus,"The Council has awarded a contract to Transport Focus for the delivery of the Your Bus Journey (YBJ) passenger satisfaction survey for the period 2026/27 to 2028/29. Participation in the YBJ survey is now mandated by the Department for Transport (DfT) as a condition of receiving the Local Authority Bus Grant within the Consolidated Transport Funding
Contract value: 
£ 56,450.90   excluding VAT
£ 67,741.08      including VAT",Swindon Borough Council,,,GBP,2026-05-19,,award,complete,,https://www.find-tender.service.gov.uk/Notice/045904-2026,2026-05-19T16:49:45.162848+00:00
FTS,ocds-h6vhtk-069c42_045903-2026,PURCH2915 Framework Agreement for the Provision of Engineering Inspection Services and Plant Protection Policy,"PURCH2915 Provision of Framework Agreement for the Provision of Engineering Inspection Services and Plant Protection Policy for the period of three (3) years with the option to extend for Two (2) x Twelve (12) months.
This procurement process is being conducted using the Competitive Procedure with Negotiation (CPN) in accordance with the requirements of Regulation 30 of the PC(S)R 2015. Although this procurement is being conducted under the Competitive Procedure with Negotiation (CPN), it is str",University of Glasgow,,,GBP,2026-05-19,2026-06-19,tender,active,66519200,https://www.find-tender.service.gov.uk/Notice/045903-2026,2026-05-19T16:49:45.162852+00:00
FTS,ocds-h6vhtk-05cd4c_045902-2026,UOW974 - Sports Performance Software & GPS Tracking System,"This is a formal invitation to tender. 
The University of Worcester is seeking to enhance its Sports Performance Analysis (SPA) and GPS-based physical tracking capabilities. This solution supports the University’s strategic growth in SPA across multiple academic teaching programs, research partnerships, and applied sport contexts.
To support the University’s ambitious growth in its SPA portfolio the University is seeking a SPA and GPS-based physical performance tracking solution, enabling advanc",University of Worcester,,,GBP,2026-05-19,,award,complete,,https://www.find-tender.service.gov.uk/Notice/045902-2026,2026-05-19T16:49:45.162857+00:00
FTS,ocds-h6vhtk-069c41_045901-2026,NLFT - Ambient Voice Technology,"NLFT is seeking to procure an Ambient Voice Technology (AVT) solution as part of its digital transformation strategy. The aim is to reduce clinicians’ administrative burden and improve the timeliness and quality of clinical documentation across the Trust.
At this stage, NLFT is undertaking early market engagement to better understand the current capabilities, maturity, integration and delivery models available within the AVT market. This Request for Information (RFI) is intended to gather insigh",North London NHS Foundation Trust,,,GBP,2026-05-19,,planning,planning,,https://www.find-tender.service.gov.uk/Notice/045901-2026,2026-05-19T16:49:45.162862+00:00
FTS,ocds-h6vhtk-069c40_045900-2026,"NBY/19/ES - The Winchcombe School, Maple Crescent, Newbury, RG14 1LN & The Castle School, Love Lane, Newbury, RG14 2JG (Lot 1) Requires Passenger Assistant","Home to School Transport serving The Winchcombe School, Maple Crescent, Newbury, RG14 1LN & The Castle School, Love Lane, Newbury, RG14 2JG",West Berkshire Council,,,GBP,2026-05-19,,award,complete,60130000,https://www.find-tender.service.gov.uk/Notice/045900-2026,2026-05-19T16:49:45.162866+00:00
FTS,ocds-h6vhtk-069c3f_045898-2026,Framework for Specialist & Alternative Day Education,"To provide education placements for children and young people with special educational needs or disabilities up to age 25, where mainstream or LA education providers cannot meet need",Warwickshire County Council,,,GBP,2026-05-19,,planning,planned,,https://www.find-tender.service.gov.uk/Notice/045898-2026,2026-05-19T16:49:45.162869+00:00
FTS,ocds-h6vhtk-069b61_045897-2026,Complex Care Home - Block Provision,The provision of block contract for adults with complex care needs.,Swindon Borough Council,,40000000.0,GBP,2026-05-19,,planningUpdate,planned,,https://www.find-tender.service.gov.uk/Notice/045897-2026,2026-05-19T16:49:45.162873+00:00
FTS,ocds-h6vhtk-069899_045896-2026,H0900 - Provision of Solution Focused Brief Therapy (SFBT) Training Services,"Health Education and Improvement Wales (HEIW) awards a contract to BRIEF Therapy UK Ltd – Centre for Solution Focused Practice for the provision of online tutor‑led Solution Focused Brief Therapy (SFBT) training, including Levels 1–4, Advanced Certification, and Train the Trainer programmes.The arrangement is established as a non‑committal call‑off contract, with services to be commissioned as required in line with organisational need and available funding.",Health Education and Improvement Wales,,,GBP,2026-05-19,,award,complete,,https://www.find-tender.service.gov.uk/Notice/045896-2026,2026-05-19T16:49:45.162877+00:00
FTS,ocds-h6vhtk-069c3e_045895-2026,AnyComms - Licence & Support for West Northamptonshire and 185 schools,"Annual Licence, Hosting and Support Costs. Web-based secure file transfer solution used by Education to send sensitive data between LA and Schools",West Northamptonshire Council,,,GBP,2026-05-19,,award,complete,,https://www.find-tender.service.gov.uk/Notice/045895-2026,2026-05-19T16:49:45.162880+00:00
FTS,ocds-h6vhtk-069c3d_045894-2026,ET154 - Electrical Services & Maintenance,"LSTM is inviting suitably qualified and experienced contractors to tender for the provision of electrical services and maintenance support across its facilities. The appointed supplier(s) will be expected to deliver safe, compliant, and responsive electrical works, including planned preventative maintenance, reactive repairs, and minor installation projects, in support of LSTM’s operational requirements across its Liverpool and Chester estate.
LSTM intends to establish a framework of approved su",Liverpool School of Tropical Medicine,,,GBP,2026-05-19,,planning,planning,,https://www.find-tender.service.gov.uk/Notice/045894-2026,2026-05-19T16:49:45.162885+00:00
FTS,ocds-h6vhtk-069c3c_045893-2026,Supply of Natural Gas,Supply of natural gas and meter operated services for Council owned offices and other premises.,Kingston Upon Hull City Council,,8000000.0,GBP,2026-05-19,,planning,planned,,https://www.find-tender.service.gov.uk/Notice/045893-2026,2026-05-19T16:49:45.162889+00:00
FTS,ocds-h6vhtk-069c3b_045892-2026,Commissioning Virtual Educational Assessments,"The Authority has statutory duties under the Children and Families Act 2014 in relation to Education, Health and Care Needs Assessments.
The Authority is experiencing increased demand and requires additional Educational Psychology capacity to support the delivery of statutory advice and to assist in reducing assessment backlogs.
The Supplier must specialise in the provision of Educational Psychology services and have the professional expertise and capacity to provide the Services remotely.
The S",Rotherham Borough Council,,,GBP,2026-05-19,,award,complete,,https://www.find-tender.service.gov.uk/Notice/045892-2026,2026-05-19T16:49:45.162893+00:00
FTS,ocds-h6vhtk-069c3a_045891-2026,Refurbishment of the Mortuary Portacabins,This is a refurbishment of the STH changing area and not a refurbishment of the cold storage areas.,Guy's and St Thomas' NHS Foundation Trust,,,GBP,2026-05-19,,award,complete,,https://www.find-tender.service.gov.uk/Notice/045891-2026,2026-05-19T16:49:45.162897+00:00
FTS,ocds-h6vhtk-069c39_045890-2026,Outsourcing for Upper GI and Bariatric surgery,Provision of  additional surgical capacity to be performed at other hospital premises to assist in the urgent reduction of waiting times for routine Upper GI and Bariatric surgery and ensure there are zero 65 week waits.,Somerset NHS Foundation Trust,,,GBP,2026-05-19,,award,complete,85111100,https://www.find-tender.service.gov.uk/Notice/045890-2026,2026-05-19T16:49:45.162901+00:00
FTS,ocds-h6vhtk-069c38_045888-2026,COV - 25758 Books for Looked After Children,Providing books for Looked after Children to be delivered by post,Coventry City Council,,,GBP,2026-05-19,,award,complete,,https://www.find-tender.service.gov.uk/Notice/045888-2026,2026-05-19T16:49:45.162905+00:00
FTS,ocds-h6vhtk-069c37_045887-2026,Provision of Associate Trainers,"Framework for the Call-Off Provision of Associate Trainers –
Digital Skills, Management Skills, Marketing including digital marketing and social media, Communication and Soft Skills, Health and Safety, Construction and Trade, Training and Assessment, Care, Mindfulness and Wellbeing, HR Training, Procurement, Tendering and bid writing, Accountancy systems, Visual Merchandising, Customer Service and Retail Optimisation",Dundee and Angus College,,800000.0,GBP,2026-05-19,2026-06-19,tender,active,80500000,https://www.find-tender.service.gov.uk/Notice/045887-2026,2026-05-19T16:49:45.162909+00:00
