source,notice_id,title,description,organisation,value_low,value_high,currency,published_date,deadline,notice_type,status,cpv_codes,url,scraped_at
FTS,ocds-h6vhtk-06ce58_068027-2026,Provision of Social Media licences and support,Social Media licences and support,Mayor's Office for Policing and Crime,,,GBP,2026-07-19,,award,complete,72000000,https://www.find-tender.service.gov.uk/Notice/068027-2026,2026-07-20T09:57:16.867706+00:00
FTS,ocds-h6vhtk-06ce57_068026-2026,DfI TRAM - Supply and Delivery of Spare and Replacement Parts and Specialist Engineering Services for Voith Schneider Propulsion Systems,"The Department for Infrastructure (DfI), Public Transport Operations, is directly responsible for the operation of Strangford Lough Ferry Service utilising two large passenger vessels: MV Portaferry II and MV Strangford II. Both vessels are owned by the Department and must undergo an annual inspection by Maritime and Coastguard Agency (MCA) prior to the issuing of a Passenger Ship Safety Certificate (PSSC) -  required for the ferry service to be legally operated. Part of this inspection focuses ",Department for Infrastructure,,,GBP,2026-07-19,,award,complete,,https://www.find-tender.service.gov.uk/Notice/068026-2026,2026-07-20T09:57:16.867709+00:00
FTS,ocds-h6vhtk-06ce56_068025-2026,Holme Beck Path Retaining Wall Rebuild Scheme,Holme Beck Path masonry retaining wall rebuild,The North Yorkshire Council,,,GBP,2026-07-19,,award,complete,,https://www.find-tender.service.gov.uk/Notice/068025-2026,2026-07-20T09:57:16.867712+00:00
Contracts Finder,ocds-b5fd17-81d433e9-1cf4-4061-91c4-950bd9983124_5dd32fb6-13f0-4b9c-8555-8757e088907a-907057,"Southern Housing, May26, C17&19 -MD Clean LOT3",Dynamic Purchasing System (DPS) for Cleaning Services: Window Cleaning - external - up to and over 75ft & internal - high rise,Southern Housing,,236584.0,GBP,2026-07-19,2026-05-20,award,complete,90900000,https://www.contractsfinder.service.gov.uk/Notice/5dd32fb6-13f0-4b9c-8555-8757e088907a-907057,2026-07-20T09:57:19.621260+00:00
Contracts Finder,ocds-b5fd17-fcec7fd4-cf5b-48a4-b618-15b8aaf03794_b9e1de66-b1e5-45c8-b886-0ceefb8854fb-907055,"Southern Housing, May26, C17&19 - Four Corners Cleaning LOT5",Dynamic Purchasing System (DPS) for Cleaning Services: Window Cleaning - external - up to and over 75ft & internal - high rise,Southern Housing,,466688.64,GBP,2026-07-19,2026-05-20,award,complete,90900000,https://www.contractsfinder.service.gov.uk/Notice/b9e1de66-b1e5-45c8-b886-0ceefb8854fb-907055,2026-07-20T09:57:19.621429+00:00
Contracts Finder,ocds-b5fd17-f14dba60-c4d7-427f-b24f-a82c57d2f074_98fe6e3b-0ca4-47cf-b94c-a60b3d871d2e-907054,"Southern Housing, May26, C17&19 - Cleanscapes LOT4",Dynamic Purchasing System (DPS) for Cleaning Services: Window Cleaning - external - up to and over 75ft & internal - high rise,Southern Housing,,596746.94,GBP,2026-07-19,2026-05-20,award,complete,90900000,https://www.contractsfinder.service.gov.uk/Notice/98fe6e3b-0ca4-47cf-b94c-a60b3d871d2e-907054,2026-07-20T09:57:19.621568+00:00
