source,notice_id,title,description,organisation,value_low,value_high,currency,published_date,deadline,notice_type,status,cpv_codes,url,scraped_at
FTS,ocds-h6vhtk-06c0bf_061504-2026,Full Inspection and Testing of Fire Alarm Systems at British Embassy Baghdad,"Inspection, testing, and servicing of multiple fire alarm systems across the British Embassy in Baghdad.","Foreign, Commonwealth and Development Office",,,GBP,2026-07-01,,award,complete,,https://www.find-tender.service.gov.uk/Notice/061504-2026,2026-07-01T10:39:58.344359+00:00
Contracts Finder,ocds-b5fd17-8718ec9a-eb12-497e-9607-377e5472e63a_336cb675-1fe7-452f-b23d-2f87addeeec1-904052,*UPDATED* FM Procurement Consultancy Support,PRIOR NOTICE Notice identifier: 2026/S 000-061483 IS INCORRECT. THIS IS THE CORRECT NOTICE. THE CORRECT VALUE IS £50K. The requirement is for FM Procurement Consultancy Support for Hard and Soft FM Contracts.,Watford Borough Council,,50000.0,GBP,2026-06-30,2026-03-02,award,complete,79418000,https://www.contractsfinder.service.gov.uk/Notice/336cb675-1fe7-452f-b23d-2f87addeeec1-904052,2026-07-01T10:40:01.281838+00:00
Contracts Finder,ocds-b5fd17-a9eb7e20-2142-479e-a75b-2150076eee3c_1f127324-8cf4-4c50-8fec-bafb230be8fb-904051,FM Procurement Consultancy Support,The requirement is for FM Procurement Consultancy Support for Hard and Soft FM Contracts.,Watford Borough Council,,71402.2,GBP,2026-06-30,2026-03-02,award,complete,79418000,https://www.contractsfinder.service.gov.uk/Notice/1f127324-8cf4-4c50-8fec-bafb230be8fb-904051,2026-07-01T10:40:01.282093+00:00
Contracts Finder,ocds-b5fd17-ec3ba848-11ef-44f1-a130-c302bfc11c04_197b1f3d-7ec1-4bf2-a3dd-29696e75beb7-904049,Repairs and Call Outs to Generators,Repairs and Call Outs to Generators - GHC,Gloucestershire Health and Care NHS Foundation Trust,0.01,200000.0,GBP,2026-06-30,2026-03-31,award,complete,50700000,https://www.contractsfinder.service.gov.uk/Notice/197b1f3d-7ec1-4bf2-a3dd-29696e75beb7-904049,2026-07-01T10:40:01.282334+00:00
Contracts Finder,ocds-b5fd17-ed9825b9-6365-4851-886a-cd2d992c2e67_185d8bf3-04b8-468f-8d00-6b04b8f3b326-904046,Electronic Payment Services Apr26 - Stoke on Trent City Council - awarded,"This contract award notice is to notify the market that Stoke On Trent City Council based in Stoke On Trent, UK have appointed Allpay as their Electronic Payment Services provider for a period of TWO years, with an option to extend for a further TWO years. This appointment has been made under the Northern Housing Consortium's Electronic Payment Services Framework. (Contract Award Notice 2023/S 000-023456)",NORTHERN HOUSING CONSORTIUM LIMITED,,210092.4,GBP,2026-06-30,2026-03-09,award,complete,66000000,https://www.contractsfinder.service.gov.uk/Notice/185d8bf3-04b8-468f-8d00-6b04b8f3b326-904046,2026-07-01T10:40:01.282544+00:00
Contracts Finder,ocds-b5fd17-87e41bd7-aa15-4941-858a-c3593c6550dd_0b95fc21-fcd0-4932-9ee3-79c30a56ea7c-904047,MP102 WDC Property Management Software,"Wealden District Council awarded the contract to Civica UK Ltd for the provision of property software management. 
The contract was awarded via the Crown Commercial Framework, Lot 2.",Wealden District Council,,148359.0,GBP,2026-06-30,2026-03-30,award,complete,48100000,https://www.contractsfinder.service.gov.uk/Notice/0b95fc21-fcd0-4932-9ee3-79c30a56ea7c-904047,2026-07-01T10:40:01.282740+00:00
Contracts Finder,ocds-b5fd17-00c6107b-1f15-4f1d-8932-2269617b4727_19a6e254-6a4b-4086-98c7-c4a365e5ba52-904045,CA18158 - ITT Provision of:  Maintenance and Small Works,"New College Swindon invites tenders for the provision of maintenance and small works services, as described in the Specification.
This is a single-stage tender process, and interested organisations are invited to submit one response in accordance with these instructions.



To access this competition: 

Registered:
Login to https://suppliers.multiquote.com and view the opportunity CA18158.

Not registered:
Visit https://suppliers.multiquote.com then register and quote CA18158 as the r",New College Swindon,,1000000.0,GBP,2026-06-30,2026-07-31,tender,active,50000000,https://www.contractsfinder.service.gov.uk/Notice/19a6e254-6a4b-4086-98c7-c4a365e5ba52,2026-07-01T10:40:01.282935+00:00
Contracts Finder,ocds-b5fd17-002be7db-a58a-4bbc-848d-43f4b62e5e37_f79342f0-30e7-4154-bb88-623c06501ff0-904042,Redevelopment of Austhorp Grove Play  Area,"The purpose of this project is to redevelop the existing play area at Austhorp Grove, Cottesmore, to provide a safe, inclusive, and engaging environment for children of all ages and abilities.
This redevelopment will address the key priorities identified in the 2025 Cottesmore Play Areas Community Survey, ensuring that the site becomes a vibrant and well-used community space.

Proposals:
We wish for each company to submit two designs; one for a larger budget (under £300,00) and one smaller b",Cottesmore Parish Council,150000.0,300000.0,GBP,2026-06-30,2026-07-31,tender,active,37535000,https://www.contractsfinder.service.gov.uk/Notice/f79342f0-30e7-4154-bb88-623c06501ff0,2026-07-01T10:40:01.283131+00:00
Contracts Finder,ocds-b5fd17-d505930f-832a-4efe-8a75-1386893e2acc_f8b8afc8-9de9-44cd-976c-91fe13c5f826-904043,CA18159 - 2026 Replacement of Reversible Air Source Heat Pump Systems,"2026 Replacement of Reversible Air Source Heat Pump Systems
Red Lion Quarter, Spalding

To access this competition: 

Registered:
Login to https://suppliers.multiquote.com and view the opportunity CA18159.

Not registered:
Visit https://suppliers.multiquote.com then register and quote CA18159 as the reason for registration. 

 Any queries please contact MultiQuote on 020 3920 8054.",Boston College,,50000.0,GBP,2026-06-30,2026-07-15,tender,active,45350000,https://www.contractsfinder.service.gov.uk/Notice/f8b8afc8-9de9-44cd-976c-91fe13c5f826,2026-07-01T10:40:01.283369+00:00
Contracts Finder,ocds-b5fd17-7d1ca1a5-f6d7-4a82-a0af-ef962c596578_62c9403e-b9b9-4a23-9fb4-0eca46fd483e-904038,Design and Construction of All Weather Pitch,The design and build of an artifical 3G Full Size Football Pitch.,Bishops Cleeves Parish Council,750000.0,1000000.0,GBP,2026-06-30,2026-08-13,tender,active,71000000,https://www.contractsfinder.service.gov.uk/Notice/62c9403e-b9b9-4a23-9fb4-0eca46fd483e,2026-07-01T10:40:01.283573+00:00
Contracts Finder,ocds-b5fd17-75d4c0ed-5c50-4246-85a4-a857f70467e4_6e46af8e-1509-4ea8-8100-48a9d0b352d6-904036,Welsh Translation Service,Translation of English to Welsh and Welsh to English.,MOD Corsham,,60000.0,GBP,2026-06-30,2026-06-19,award,complete,75000000,https://www.contractsfinder.service.gov.uk/Notice/6e46af8e-1509-4ea8-8100-48a9d0b352d6-904036,2026-07-01T10:40:01.283762+00:00
Contracts Finder,ocds-b5fd17-9f04f2ea-ac05-40cf-a996-e16171f32402_e7feff95-5002-4f7d-a910-02fcefc405f2-904033,"File Storage, Retrieval and Destruction Services","This is a Contract Award Notice.

The Care Quality Commission (CQC) require the services of an off-site storage (boxes and files) including retrieval and destruction services

This procurement was undertaken through the HealthTrust Europe LLP (HTE) Framework Agreement for the supply of Document, Communication and Print Management and
Associated goods and services, Lot 1 Document Management, following the Direct Award process.

The Contract is awarded for a total period of 24 months

Tot",Care Quality Commission,,147440.0,GBP,2026-06-30,2026-02-16,award,complete,72512000,https://www.contractsfinder.service.gov.uk/Notice/e7feff95-5002-4f7d-a910-02fcefc405f2-904033,2026-07-01T10:40:01.283948+00:00
Contracts Finder,ocds-b5fd17-9bd739df-1ebf-4609-872b-21b54ee9b30e_211ea461-2f08-4c40-a05c-ae91c2761d5e-904031,Adobe Licences (CCS ETLA),"This is a Contract Award Notice.

Call-Off Contract for the supply of Adobe software licenses.

This procurement was undertaken through the Adobe Enterprise Term License Agreement (ETLA), an aggregated procurement (ref. NFC199) conducted by Crown Commercial Services (CCS), using Technology Products and Associated Services 2 Framework (RM6098), Lot 3 Software.

The Contract is awarded for a total period of 36 months.

Total Awarded Value is maximum of all charges including any optional co",Care Quality Commission,,110464.92,GBP,2026-06-30,2026-02-18,award,complete,72260000,https://www.contractsfinder.service.gov.uk/Notice/211ea461-2f08-4c40-a05c-ae91c2761d5e-904031,2026-07-01T10:40:01.284138+00:00
Contracts Finder,ocds-b5fd17-bcf32f29-1d30-44c1-9056-9441edd5ce0b_84f27547-e45d-4883-b0fe-f617a2d31029-904030,CPMO Project Management Tool,Provision of a cloud-based project and portfolio management solution,NHS Blood and Transplant,,106760.0,GBP,2026-06-30,2026-03-13,award,complete,72268000,https://www.contractsfinder.service.gov.uk/Notice/84f27547-e45d-4883-b0fe-f617a2d31029-904030,2026-07-01T10:40:01.284345+00:00
Contracts Finder,ocds-b5fd17-e3f18f2f-7217-4ba4-b14c-e44327665693_462e9658-09c8-4dd5-b735-adc7990ab04d-904028,MAXQDA Subscription 2025-2028,"This is a Contract Award Notice.

The Care Quality Commission (CQC) require a MAXQDA 3-year licence subscription for 75 users.

This procurement was undertaken through the CCS Technology Products & Associated Services 2 Agreement (RM6098), Lot 3 - Software, following the Direct Award process.

The Contract is awarded for a total period of 36 months.

Total Awarded Value is maximum of all charges including any optional contract extensions.          

Contract Reference: CQC TDI 002

U",Care Quality Commission,,33621.58,GBP,2026-06-30,2025-09-26,award,complete,72000000,https://www.contractsfinder.service.gov.uk/Notice/462e9658-09c8-4dd5-b735-adc7990ab04d-904028,2026-07-01T10:40:01.284532+00:00
Contracts Finder,ocds-b5fd17-872707ff-5e36-43cb-8606-57d9cf1a238d_9ac26b36-45f1-4314-b411-6da57e4c3676-904027,Rydal Mount - Brief for a Feasibility Study,"The Wordsworth Trust invites applications to tender for a feasibility study to identify a future operating model for Rydal Mount, a heritage property located within the Lake District World Heritage Site. Rydal Mount, the Wordsworths' family home from 1813, was acquired by the Wordsworth Trust in March 2026 with the support of The Julia Rausing Trust and the Charlotte Aitken Trust.

The purpose of the feasibility study is to identify a preferred option for the future use and sustainable operati",THE WORDSWORTH TRUST,,60000.0,GBP,2026-06-30,2026-07-24,tenderAmendment,active,92500000,https://www.contractsfinder.service.gov.uk/Notice/9ac26b36-45f1-4314-b411-6da57e4c3676,2026-07-01T10:40:01.284720+00:00
Contracts Finder,ocds-b5fd17-7c80a710-fa7e-40e6-9271-e1d0fe7ac28c_ea2bbf4b-0556-4060-a189-2f0948aa8952-904025,CPU 7368 - Supply and Installation of Steel Fabrication Products,"The works covered by this Service include the supply, or the supply and installation, of various metal fabrications in accordance with relevant British and European industry standards. Supply-only items may include products such as lintels provided to NCC. Supply and installation works typically include handrails, gates, fencing, railings, and similar fabrications.

The majority of the Service focuses on providing handrails for tenants with mobility needs. The objective of this process is to e",Nottingham City Council,,720000.0,GBP,2026-06-30,2026-07-28,tender,active,45000000,https://www.contractsfinder.service.gov.uk/Notice/ea2bbf4b-0556-4060-a189-2f0948aa8952,2026-07-01T10:40:01.284994+00:00
Contracts Finder,ocds-b5fd17-04cf5909-8a42-4522-94eb-cbe538a1ee09_744be6d3-6188-4f7d-a29f-3f9281ad7fb4-904023,GB-Leeds: PE2026-27_5017 Provision of Student Block Hall Insurance,"Provision of student personal possessions insurance for residents across the University of Leeds accommodation portfolio (approximately 8,000 bed spaces), including properties for married and international students. The policy must provide a standard level of cover with optional enhanced cover available for individual purchase. The provider must accommodate portfolio changes over the contract term and may offer options to mitigate the University's liability for losses such as damage and voids.",University of Leeds,50000.0,100000.0,GBP,2026-06-30,2026-07-30,tender,active,66510000,https://www.contractsfinder.service.gov.uk/Notice/744be6d3-6188-4f7d-a29f-3f9281ad7fb4,2026-07-01T10:40:01.285206+00:00
Contracts Finder,ocds-b5fd17-438b3fdb-8bba-416a-be1f-ba6ca56c133d_ab3fe19c-f4e0-4d87-be36-9f50989e4986-904022,Traws PCDD Project - Hydrogeological Support,Traws PCDD Project - Hydrogeological Support,Nuclear Restoration Services Ltd,,20000.0,GBP,2026-06-30,2026-05-22,award,complete,71800000,https://www.contractsfinder.service.gov.uk/Notice/ab3fe19c-f4e0-4d87-be36-9f50989e4986-904022,2026-07-01T10:40:01.285403+00:00
Contracts Finder,ocds-b5fd17-52d47e7f-d973-4308-92c6-da1a6f14ee68_92301ebd-0ec1-4ba3-abc3-d2ff2c5bec12-904020,"CA18156 - Tender 42/2026 - Integrated Consultancy Team for Extension to Struell Cemetery, Downpatrick","The purpose of these services is to appoint a suitably qualified Consultant to support the Council in the delivery of the Struell Cemetery extension, Downpatrick. The Consultant will provide the necessary technical, design, procurement, and contract administration services to enable the successful expansion of burial capacity and associated infrastructure. The services are being commissioned to ensure the scheme is developed, procured, and delivered in a coordinated and efficient manner, meeting","Newry, Mourne and Down District Council (NMD)",,,GBP,2026-06-30,2026-07-24,tender,active,71530000,https://www.contractsfinder.service.gov.uk/Notice/92301ebd-0ec1-4ba3-abc3-d2ff2c5bec12,2026-07-01T10:40:01.285588+00:00
Contracts Finder,ocds-b5fd17-bff93927-4447-4555-a530-26886704e83c_7cf3102e-eda3-4ac8-9831-9f24de906304-904009,"Cabinet Office: Recruitment Advertising, Media Buying & Creative Services","The contract will provide advertising, media buying & creative design services",Cabinet Office,,4920000.0,GBP,2026-06-30,2026-05-07,award,complete,79340000,https://www.contractsfinder.service.gov.uk/Notice/7cf3102e-eda3-4ac8-9831-9f24de906304-904009,2026-07-01T10:40:01.285770+00:00
Contracts Finder,ocds-b5fd17-42f923d0-4ce1-4517-b4f0-a4cc6c6419aa_0a8eb330-f492-439c-846a-2090354474bd-904015,JAX: Imaging equipment maintenance Artis zee multi-purpose,"Four year maintenance plan for Radiology assets based in MAIN X-RAY IRS, Royal Sussex County Hospital. The contract will be awarded to SIEMENS PLC - HEALTHCARE under NHS SC Framework - Maintenance, Repair and Calibration of Medical Equipment - OJEU 2021/S000-021535",University Hospitals Sussex NHS Foundation Trust,,126649.21,GBP,2026-06-30,2026-05-05,award,complete,85150000,https://www.contractsfinder.service.gov.uk/Notice/0a8eb330-f492-439c-846a-2090354474bd-904015,2026-07-01T10:40:01.285957+00:00
Contracts Finder,ocds-b5fd17-14403cac-b039-48c4-acd5-652c82c975ca_58862df7-6fbd-4708-af36-4aa933c1f09e-904013,Demolition of Nockolds Building,"The Trust has a requirement for the demolition of the Nockolds Building, Lewisham High Street, London, SE13 6LH.",Guy's and St Thomas' NHS Foundation Trust,1640000.0,1647500.0,GBP,2026-06-30,2023-11-25,award,complete,45111000,https://www.contractsfinder.service.gov.uk/Notice/58862df7-6fbd-4708-af36-4aa933c1f09e-904013,2026-07-01T10:40:01.286141+00:00
Contracts Finder,ocds-b5fd17-89e31483-d1e1-4a44-bd24-a7f5bf8e47bc_f86a8c5b-d425-4b87-b412-5bd80937ba7b-904010,Consumable Contract for SLS,A contract that covers the supply of Laboratory consumables from SLS to UKHSA laboratories.,UK Health Security Agency,,644000.0,GBP,2026-06-30,2026-06-15,award,complete,33124130,https://www.contractsfinder.service.gov.uk/Notice/f86a8c5b-d425-4b87-b412-5bd80937ba7b-904010,2026-07-01T10:40:01.286339+00:00
Contracts Finder,ocds-b5fd17-f87b0fe9-32bf-4704-b66b-ff2ee7ef2d5f_b274dea4-52f5-41db-aeb3-e708b97c2e7a-904011,Planned Roofing Works 27 North,Planned roofing works across Yorkshire Housing assets for financial year 26-27 North,Yorkshire Housing Limited,,879350.0,GBP,2026-06-30,2026-05-27,award,complete,45261210,https://www.contractsfinder.service.gov.uk/Notice/b274dea4-52f5-41db-aeb3-e708b97c2e7a-904011,2026-07-01T10:40:01.286522+00:00
Contracts Finder,ocds-b5fd17-1b2a9e9f-b0e5-44ad-8df0-146d8f470e58_c4d21a6d-51dc-4b91-8a8e-df123c97a91a-904007,Private Cath Lab Refurbishment - Architect Services,"The Trust has a requirement to undertake the design of a new private Electrophysiology (EP) Catheterisation Laboratory for Royal Brompton Hospital to help facility this requirement the project team requires Professional Services to ensure that main contractor delivers in a cost-effective manner.

this was awarded through the  NHS SBS framework Healthcare Planning, Construction Consultancy and Ancillary Services Framework Agreement Reference: SBS10190",Guy's and St Thomas' NHS Foundation Trust,170000.0,170467.0,GBP,2026-06-30,2025-10-31,award,complete,71530000,https://www.contractsfinder.service.gov.uk/Notice/c4d21a6d-51dc-4b91-8a8e-df123c97a91a-904007,2026-07-01T10:40:01.286792+00:00
Contracts Finder,ocds-b5fd17-c12f2118-f52e-4347-a684-c1f4d55d81a4_b51378a7-2693-46fe-beaa-b1b45d0b817b-904006,Mini Competition 021 for the Provision of 700lb Cord Under the Multi Supplier Framework C17CSAE/708795450,"Contract Award Notice for the Provision of 700lb Cord (NSN 4020-99-3223567) via Mini
Competition 021 under the Multi Supplier Framework C17CSAE/708795450 for the
Provision of Cord, Thread, Bungee and Associated Items",Ministry of Defence,,7058.7,GBP,2026-06-30,2026-06-25,award,complete,39540000,https://www.contractsfinder.service.gov.uk/Notice/b51378a7-2693-46fe-beaa-b1b45d0b817b-904006,2026-07-01T10:40:01.286975+00:00
Contracts Finder,ocds-b5fd17-beccb249-2881-4917-937a-d7b72e920d8b_ea493f5b-cb20-40e5-8885-812130d46e4c-904003,Site Security and Clearance,"Provision of Site security and clearance
PCR Contract award notice on Contracts finder as is a PCR framework direct award",mhs homes group,,137500.0,GBP,2026-06-30,2026-06-29,award,complete,35100000,https://www.contractsfinder.service.gov.uk/Notice/ea493f5b-cb20-40e5-8885-812130d46e4c-904003,2026-07-01T10:40:01.287152+00:00
Contracts Finder,ocds-b5fd17-0d5ef8b6-94cd-42a4-b7e6-b71e3b515cbe_c0b8805c-35ea-4aa1-a1ff-774e9578fa42-904005,DPS1 1398 - Housing Tree Work,"DPS1 1398 - Housing Tree Work

Additional information: 
https://londonconstructionprogramme.co.uk/services/dynamic-purchasing-systems/",London Borough of Haringey,,90000.0,GBP,2026-06-30,2026-07-12,tender,active,71000000,https://www.contractsfinder.service.gov.uk/Notice/c0b8805c-35ea-4aa1-a1ff-774e9578fa42,2026-07-01T10:40:01.287355+00:00
Contracts Finder,ocds-b5fd17-a4eae413-79cb-4834-a9b1-0632540e6309_aa368bf0-d4ec-41a5-8fa6-fcb2490112af-903992,Management of Commercial Advertising Space on Staffordshire County Council Assets,"The provider(s) will manage advertising and/or sponsorship on the following Council-owned assets: 
• Roadside verges or central reservations (including existing variable message signs) 
• Streetlights  
• Roundabouts  
• Council buildings (internal and external) 
• Council-owned land and car parks 

The appointed provider(s) will be responsible for: 

• Surveying and assessing the suitability of assets for advertising or sponsorship, setting out clear ""roll out"" plans 
• Obtaining all ",Staffordshire County Council,,,GBP,2026-06-30,2026-04-23,award,complete,79340000,https://www.contractsfinder.service.gov.uk/Notice/aa368bf0-d4ec-41a5-8fa6-fcb2490112af-903992,2026-07-01T10:40:01.287534+00:00
Contracts Finder,ocds-b5fd17-b16022b3-72ba-4901-b63b-bf64dbd1484b_a4f1a284-e8ed-43b8-9291-2eb213919a9a-904004,Project Manager for Private Cath Labs,"The Trust require Project Management services to support the Private Patients Cath Lab Project, a scheme currently included within the medium-term capital plan.
Overview of Procurement activity; This will be a direct award under the NHS Shared Business Services (NHSSBS) framework ""Healthcare Planning, Construction Consultancy and Ancillary Services (HPCCAS)"" ref SBS10190, Lot 2 ""Project Management"".",Guy's and St Thomas' NHS Foundation Trust,,145000.0,GBP,2026-06-30,2026-01-30,award,complete,71541000,https://www.contractsfinder.service.gov.uk/Notice/a4f1a284-e8ed-43b8-9291-2eb213919a9a-904004,2026-07-01T10:40:01.287717+00:00
Contracts Finder,ocds-b5fd17-1cfad892-b5f9-4070-a18d-a56b90125970_1c4d1007-0d1b-429e-b147-bfa83f650a02-904001,FYY - Medical & Surgical Equipment Maintenance & cleaning - Specialist,"Three year maintenance plan for Cardiac assets based in Cardiac, Princess Royal Hospital , LMB L2C Cardiac OPD, Royal Sussex County Hospital and Cardiac Dept, Worthing Hospital. The contract will be awarded to Spacelabs Healthcare LTD  under NHS Supply Chain Maintenance Framework, 2021/S000-021535 Lot 4 which allows for direct awards.",University Hospitals Sussex NHS Foundation Trust,,64890.21,GBP,2026-06-30,2026-03-31,award,complete,33123210,https://www.contractsfinder.service.gov.uk/Notice/1c4d1007-0d1b-429e-b147-bfa83f650a02-904001,2026-07-01T10:40:01.287895+00:00
Contracts Finder,ocds-b5fd17-0440b694-ad1e-4993-8e20-76b76b5fca16_ce68fc7d-c438-4afb-ba5c-7da0e931153f-904000,UKHSA Health Security Campus_Common Data Environment,"The Common Data Environment (CDE) shall be established as the UK Health Security Agency's CDE and will serve as the single source of truth for the controlled production, management, review, approval, and dissemination of all infrastructure project information. The CDE shall provide a secure, auditable, and standardised environment in accordance with ISO 19650, enabling the UK Health Security Agency to maintain information governance, assurance, and control across all appointed parties.",UK Health Security Agency,699101.74,694603.0,GBP,2026-06-30,2026-06-26,award,complete,72000000,https://www.contractsfinder.service.gov.uk/Notice/ce68fc7d-c438-4afb-ba5c-7da0e931153f-904000,2026-07-01T10:40:01.288076+00:00
Contracts Finder,ocds-b5fd17-5bb40321-7922-45d6-8410-018865adf06e_0f42012b-4454-4771-8127-ac716e4f23e1-903993,MAINT7191- Royal Free  Bayer injector system,STELLANT WORKSTATION maintenance,Partners Procurement Service,,33075.0,GBP,2026-06-30,2026-03-25,award,complete,33100000,https://www.contractsfinder.service.gov.uk/Notice/0f42012b-4454-4771-8127-ac716e4f23e1-903993,2026-07-01T10:40:01.288266+00:00
Contracts Finder,ocds-b5fd17-671a5ad3-543b-4401-be4b-3cde9af19ced_32d43c02-8ad6-4abc-989f-dbe29c300916-903998,Crown Hosting Service,"Crown Hosting Data Centres (CHDC) Hosting Contract via RM6262 - Crown Hosting 2

The Customer shall have the right to extend the Initial Term for five (5) further periods of up to one (1) year (each an ""Extension Period"") by giving the Supplier at least 30 (thirty) days' notice before the end of the then current Term.",Department for Work and Pensions,7972293.432,11900885.65,GBP,2026-06-30,2026-04-30,award,complete,72317000,https://www.contractsfinder.service.gov.uk/Notice/32d43c02-8ad6-4abc-989f-dbe29c300916-903998,2026-07-01T10:40:01.288454+00:00
Contracts Finder,ocds-b5fd17-7c6340f0-a89b-4eac-8edf-f10ffb34fa67_f14a4e5e-e657-4774-a155-eb4f9d4336a0-903997,"QIP316 0900 2026-06-29 Kesgrave - Castle hill school, Ipswich (6-seated vehicle and a PA required) - AWARD","Suffolk County Council is seeking a mini competition against the following Dynamic Purchasing System: `The supply of Passenger Transport Services`, OJEU Notice Id: 2018/S 031-067685.
      
      QIP316 0900 2026-06-29 Kesgrave - Castle hill school, Ipswich (6-seated vehicle and a PA required)
      
      Further details can be found in the 'Tenders / My Tenders' area of this website, by selecting the 'View Details' button for this project.
      
      The deadline for returned submissio",Suffolk County Council Passenger Transport,,,GBP,2026-06-30,2026-06-29,awardUpdate,complete,60000000,https://www.contractsfinder.service.gov.uk/Notice/f14a4e5e-e657-4774-a155-eb4f9d4336a0-903997,2026-07-01T10:40:01.288628+00:00
Contracts Finder,ocds-b5fd17-54f64bbb-a0ce-47b2-ba2e-d89fcb931385_9ff050a2-f22b-4e80-91ee-cb83512e1880-903995,Provision of Tenable One Enterprise,"Provision of Tenable One Enterprise at 17,000 assets per annum.",Department for Business and Trade,,583333.33,GBP,2026-06-30,2026-06-08,award,complete,48900000,https://www.contractsfinder.service.gov.uk/Notice/9ff050a2-f22b-4e80-91ee-cb83512e1880-903995,2026-07-01T10:40:01.288805+00:00
Contracts Finder,ocds-b5fd17-99492d33-8ddb-4665-84a8-7883fb4c9293_38494ba1-ec3a-45b8-97df-4fad14dc05a7-903964,Forward Asset Service Plan (FASP01),Replacement and/or upgrade of building infrastructure mechanical and electrical assets and systems,Defence Science and Technology Laboratory,,15312571.07,GBP,2026-06-30,2026-05-04,award,complete,50700000,https://www.contractsfinder.service.gov.uk/Notice/38494ba1-ec3a-45b8-97df-4fad14dc05a7-903964,2026-07-01T10:40:01.288980+00:00
Contracts Finder,ocds-b5fd17-0cb0d1a1-0f2e-4aec-86fc-8f82ce0a5f35_b3b1f7e1-d39e-48a4-a51e-23f3d9927243-903994,SCC - Surrey County Wide Local Area Energy Plan,"Surrey County Council is seeking quotations from suitably qualified suppliers to create a ""fit for purpose"" Local Area Energy Plan that will determine the Net Zero journey for Surrey.",SURREY COUNTY COUNCIL,,110000.0,GBP,2026-06-30,2026-06-15,award,complete,71314300,https://www.contractsfinder.service.gov.uk/Notice/b3b1f7e1-d39e-48a4-a51e-23f3d9927243-903994,2026-07-01T10:40:01.289161+00:00
Contracts Finder,ocds-b5fd17-8fcfc1dd-ce48-4e8a-b5f2-fea2d5aa226c_da753b5d-4529-4410-97d9-a9e5973286bf-903991,Provision of Monitors Call-Off 2026,Provision of Monitors Call-Off 2026,DVLA - Driver & Vehicle Licensing Agency,,3996.7,GBP,2026-06-30,2026-05-29,award,complete,30000000,https://www.contractsfinder.service.gov.uk/Notice/da753b5d-4529-4410-97d9-a9e5973286bf-903991,2026-07-01T10:40:01.289404+00:00
