source,notice_id,title,description,organisation,value_low,value_high,currency,published_date,deadline,notice_type,status,cpv_codes,url,scraped_at
FTS,ocds-h6vhtk-069b5d_045885-2026,Sheepfolds Mobility Hub,"Design and build of the Sheepfolds Mobility Hub.
Key Mobility Hub components 
The Mobility Hub is planned to be a multi-story building, providing several mobility-related and other community facilities on floors Lower Ground, Ground and First. Further upper floors will be car parking spaces. The Mobility Hub will feature the following components (provisional numbers):  
Car parking (192 spaces)  
EV charging (up to 45 spaces)  
Car clubs (6 spaces)  
Secure cycle parking (90 spaces including som",Sunderland City Council,,11200000.0,GBP,2026-05-19,,planning,planned,,https://www.find-tender.service.gov.uk/Notice/045885-2026,2026-05-19T16:49:45.162914+00:00
FTS,ocds-h6vhtk-069c36_045884-2026,Dr Quasim A89041 (previously known as Happy House Surgery),General Medical Services Contract - GP practice,NHS NORTH EAST AND NORTH CUMBRIA INTEGRATED CARE BOARD,,,GBP,2026-05-19,,award,complete,85120000,https://www.find-tender.service.gov.uk/Notice/045884-2026,2026-05-19T16:49:45.162918+00:00
FTS,ocds-h6vhtk-069c35_045883-2026,"Boundaries/External Works - Thomas Court, Wrexham ","Wales & West Housing Group (WWHG) require a contractor to complete replacement fencing works at the above-named scheme, the works will also involve the resurfacing of small sections of footpaths, some tree/stump removal and shrubbery clearances. ",Wales and West Housing Association Ltd,,40000.0,GBP,2026-05-19,2026-06-16,tender,active,,https://www.find-tender.service.gov.uk/Notice/045883-2026,2026-05-19T16:49:45.162922+00:00
FTS,ocds-h6vhtk-067e50_045881-2026,Service Design for Embedding Positive Cultures in Residential Care across Wales ,"The contract will be divided into the following two Lots. Social Care Wales intends to appoint one provider per Lot:
Lot 1 – Co-design and Test Leadership Support Programme & tools for Adult Social Care Providers
Lot 2 – Programme evaluation and impact assessment of the co-design and testing of a new leadership programme and tool for nurturing positive cultures in adult social care services across Wales
Suppliers may submit bids for one or both Lots. However, a Supplier may not be awarded both L",Social Care Wales,,157500.0,GBP,2026-05-19,2026-06-15,tender,active,,https://www.find-tender.service.gov.uk/Notice/045881-2026,2026-05-19T16:49:45.162926+00:00
FTS,ocds-h6vhtk-069c34_045880-2026,Vehicle Purchasing Service,"The Authority is seeking to procure a vehicle purchasing service, known as ""Vehicle Purchasing"". This will entail sourcing, registration, and delivery of vehicles across the United Kingdom.
The Authority has considered the security context of this contract, and intends to treat this as an Exempt Contract under the Procurement Act 2023, pursuant to Schedule 2, paragraph 25. This means that this contract and procurement process will not be subject to the provisions of the Procurement Act 2023, inc",National Crime Agency,,46666666.67,GBP,2026-05-19,,planning,planning,,https://www.find-tender.service.gov.uk/Notice/045880-2026,2026-05-19T16:49:45.162930+00:00
FTS,ocds-h6vhtk-05aa64_045879-2026,CORE Education Trust - Catering Services Tender,"Based in Birmingham, CORE Education Trust are committed to delivering the best possible experiences across their Academy Schools. CORE exist to transform young people’s lives and build ambitious futures through Collaboration, Opportunity, Respect and Excellence. 
CORE Education Trust believe in the power of education to inspire, to enable and to enrich every life. 
The Trust are seeking Catering service providers to tender for the provision of all catering services presently offered within the S",CORE Education Trust,,,GBP,2026-05-19,,award,complete,,https://www.find-tender.service.gov.uk/Notice/045879-2026,2026-05-19T16:49:45.162934+00:00
FTS,ocds-h6vhtk-069945_045878-2026,Employee Health Screening,"Title of Procurement: Employee Health Screening
Indicative Contract Term: 3 years with two optional extension years 3 (+1+1) 
Indicative Budget: RSH anticipates a contract value in the region of £750,000 over the contract term (including all optional extension periods)  
The Regulator of Social Housing (RSH) is responsible for regulating social housing providers in England to ensure a viable, efficient and well-governed sector that delivers quality homes and services for current and future tenan",Regulator of Social Housing,,,GBP,2026-05-19,,planningUpdate,planning,,https://www.find-tender.service.gov.uk/Notice/045878-2026,2026-05-19T16:49:45.162939+00:00
FTS,ocds-h6vhtk-069c33_045877-2026,Supply of Food ingredients,"Supply of food ingredients to various establishments across the Council, Schools and Hull Culture and Leisure buildings.",Kingston Upon Hull City Council,,3600000.0,GBP,2026-05-19,,planning,planned,,https://www.find-tender.service.gov.uk/Notice/045877-2026,2026-05-19T16:49:45.162943+00:00
FTS,ocds-h6vhtk-05d31f_045876-2026,Elections and Electoral Registration Print Contract,"Printing of materials required for Electoral Registration and Elections such as Ballot Papers, Invitation to Register forms, Postal Vote Packs and Canvass Forms.​
The contract start date is 1 April 2026. Due to delays in the signing process, the UK7 notice could not be published on that date. The notice is therefore being issued at the earliest available opportunity.",North Northamptonshire Council,,,GBP,2026-05-19,,award,complete,,https://www.find-tender.service.gov.uk/Notice/045876-2026,2026-05-19T16:49:45.162946+00:00
FTS,ocds-h6vhtk-05accf_045875-2026,CAPTURE Document Disclosure,"DBT has carried out a Direct Award procedure to Post Office Limited in connection with the Capture Redress Scheme.
The Contract is for the provision of Disclosure services to faciliate the Capture Redress Scheme.
The Contract will be terminated once all valid claims have been proceed, however DBT anticipates that the Contract shall be in place no longer than 5 years.
This notice replaces the previously published Contract Details Notice (Notice ID: 2026/S 000-001539) on 8th January 2026 that incl",Department for Business & Trade,,,GBP,2026-05-19,,award,complete,,https://www.find-tender.service.gov.uk/Notice/045875-2026,2026-05-19T16:49:45.162950+00:00
FTS,ocds-h6vhtk-069c32_045874-2026,Level 5 & Level 4 Chartered Institute of Housing (CIH) Housing Management Qualifications,"Curo wish to procure a suitably qualified provider to deliver Chartered Institute of Housing (""CIH"") Level 5 and Level 4 Housing Management Qualifications for Senior Housing Executives and Senior Housing Managers.
This requirement will cover: 
•CIH Level 5 Diploma in Housing for Senior Housing Executives
•CIH Level 4 Certificate in Housing for Senior Housing Managers
The successful Provider will offer a flexible delivery model that fits around work patterns and learning preferences. It is expect",Curo Group (Albion) Ltd,,192600.0,GBP,2026-05-19,2026-05-27,tender,active,,https://www.find-tender.service.gov.uk/Notice/045874-2026,2026-05-19T16:49:45.162954+00:00
FTS,ocds-h6vhtk-055fdf_045873-2026,Adult Social Care (ASC) Workforce Support Programme 2026,"The Authority wishes to implement support for the adult social care workforce to deliver against the Authority’s objectives for adult social care
Lot 2 awards a contract for quality assurance service of training and qualifications for the ASC workforce and signpost high-quality training to the sector that is aligned to DHSC’s CWP. This will require the supplier to take over delivery of the QACL Service and work with existing qualification regulators (for example Ofqual), Awarding Organisations, ",Department of Health & Social Care,,,GBP,2026-05-19,,award,complete,,https://www.find-tender.service.gov.uk/Notice/045873-2026,2026-05-19T16:49:45.162958+00:00
FTS,ocds-h6vhtk-05aa54_045872-2026,Odour Treatment & Control,"The scope of the supply covered by this agreement is for the surveying, design, manufacturing, works testing (where required), delivery, offloading, installation, commissioning and testing of Odour Control and Treatment Plant and Equipment and associated Ventilation Plant and Equipment and all necessary ancillary equipment. This framework will be awarded on a Pan Scotland basis, including Highlands and Islands.",Scottish Water,,,GBP,2026-05-19,,award,complete,42996400,https://www.find-tender.service.gov.uk/Notice/045872-2026,2026-05-19T16:49:45.162961+00:00
FTS,ocds-h6vhtk-069c31_045871-2026,High Volume Pumps and Transportation Sleds,"Merseyside Fire and Rescue Authority, on behalf of National Resilience, seeks to purchase a number of High Volume Water pumps, to be stationed and deployed at various locations aross England.
The procurement will also include transportation sleds that will enable the pumps to be transported by hook loader vehicles.  Along with the pumps the sleds will include storage containers for high volume pump hose and mechanisms to lay and retrieve the hose.",Merseyside Fire and Rescue Authority,,10000000.0,GBP,2026-05-19,,planning,planned,,https://www.find-tender.service.gov.uk/Notice/045871-2026,2026-05-19T16:49:45.162966+00:00
FTS,ocds-h6vhtk-055fdf_045870-2026,Adult Social Care (ASC) Workforce Support Programme 2026,"The Authority wishes to implement support for the adult social care workforce to deliver against the Authority’s objectives for adult social care
Lot 1: aims to strengthen the adult social care sector by providing workforce expertise, training, and guidance via a focus on increasing sustainable recruitment, reducing reliance on international hires, improving retention through better training and career opportunities, upskilling staff to adapt to new technologies and care requirements, and suppor",Department of Health & Social Care,,,GBP,2026-05-19,,award,complete,,https://www.find-tender.service.gov.uk/Notice/045870-2026,2026-05-19T16:49:45.162970+00:00
FTS,ocds-h6vhtk-066586_045869-2026,Provision of Virtual Environment for Cambridge Regional College,"Cambridge Regional College is a leading further education college and is committed to serving the people of Cambridgeshire and the surrounding area.  The College’s current virtual environment is now 10 years old. It hosts 42 virtual machines supporting over 4000 endpoints and is overdue for replacement. We are inviting suppliers to propose a replacement solution to cover architecture and scalability, backup and Disaster recovery, security, migration plan.
For  tenderer instructions including ten",Cambridge Regional College,,,GBP,2026-05-19,,award,complete,,https://www.find-tender.service.gov.uk/Notice/045869-2026,2026-05-19T16:49:45.162975+00:00
FTS,ocds-h6vhtk-069c30_045868-2026,Crossgates Primary School - Replacement Fencing and Car Park Resurfacing Works,"Crossgates Primary School - Replacement Fencing and Car Park Resurfacing Works
£100,000 exc VAT budget",Rochdale Borough Council,,,GBP,2026-05-19,,award,complete,,https://www.find-tender.service.gov.uk/Notice/045868-2026,2026-05-19T16:49:45.162979+00:00
FTS,ocds-h6vhtk-069c2f_045867-2026,715863477 - Defence Hard Facilities Management (UK Estate),"Defence Hard Facilities Management (UK Estate) aims to provide reliable and high-quality regional Hard Facilities Management contracts that offer value for money and remain affordable, while fulfilling both current and future needs. These contracts will also focus on enhancing the Defence community’s Lived Experience by incorporating improvements identified during the operation of existing contracts, responding to changes in MOD policy, and engaging with our customers.
The contracts are expected",Defence Infrastructure Organisation,,12000000000.0,GBP,2026-05-19,,planning,planned,,https://www.find-tender.service.gov.uk/Notice/045867-2026,2026-05-19T16:49:45.163012+00:00
FTS,ocds-h6vhtk-069c2e_045866-2026,YAS 58 2026_27 (DA Non FW) Various Ortus Parts & Labour,Various Ortus Parts & Labour Medical Equipment Department,Yorkshire Ambulance Service NHS Trust,,,GBP,2026-05-19,,award,complete,,https://www.find-tender.service.gov.uk/Notice/045866-2026,2026-05-19T16:49:45.163016+00:00
FTS,ocds-h6vhtk-066562_045865-2026,Long Term Monitoring Network - Vegetation Survey - North Solent -2026,"A full repeat vegetation survey for Natural England's Long Term Monitoring Network project at North Solent NNR. A vegetation survey comprising recording of plant species presence and cover, and other attributes across 50 2mx2m permanent monitoring plots across the site. Preparation work includes relocating the permanent plot markers - feno markers - and re-recording the exact location using high-accuracy gps. The collected data is provided on an Excel template and quality assured, with a short s",Natural England,,,GBP,2026-05-19,,award,complete,,https://www.find-tender.service.gov.uk/Notice/045865-2026,2026-05-19T16:49:45.163020+00:00
FTS,ocds-h6vhtk-0557b7_045864-2026,Provision of Repairs and Maintenance,,Epping Forest District Council,,,GBP,2026-05-19,,award,,,https://www.find-tender.service.gov.uk/Notice/045864-2026,2026-05-19T16:49:45.163024+00:00
FTS,ocds-h6vhtk-069c2d_045863-2026,UK1 - Pipeline Notice Template,"Tracked Courier Services to Ministry of Justice (MoJ), MoJ HQ, HMCTS, HMPPS, Executive Agencies and ALB’s. This Pipeline notice is published for transparency purposes only. The scope, services and requirements described below are indicative, non-binding and subject to change. The anticipated service may include: Scheduled Courier Service, including next day collections and deliveries, Unscheduled/ Ad-hoc courier service, Secure Courier Services (scheduled/unscheduled), Secure Same Day Courier Se",Ministry of Justice,,30000000.0,GBP,2026-05-19,,planning,planned,,https://www.find-tender.service.gov.uk/Notice/045863-2026,2026-05-19T16:49:45.163028+00:00
FTS,ocds-h6vhtk-05d226_045862-2026,Robin Hood Multi Academy Trust - Catering Services Tender,"At Robin Hood Multi Academy Trust, Staff believe in showing children that they can overcome any obstacle in their lives to go on and become something truly great. The Trust firmly believe that the biggest barriers in life are the ones we place on ourselves, and it is our job to inspire children to think big and aim high.
The Trust are seeking Catering service providers to tender for the provision of all catering services presently offered within the Schools outlined in the PSQ document, includin",Robin Hood Multi Academy Trust,,,GBP,2026-05-19,,award,complete,,https://www.find-tender.service.gov.uk/Notice/045862-2026,2026-05-19T16:49:45.163031+00:00
FTS,ocds-h6vhtk-068dad_045861-2026,All Saints supply and fit of a Modular Building,UK 6 - Contract Award Notice - Supply and fit for a like-for-like or compatible modular building that integrates with existing infrastructure already in place at All Saints’ School.,Wrexham County Borough Council,,,GBP,2026-05-19,,award,complete,,https://www.find-tender.service.gov.uk/Notice/045861-2026,2026-05-19T16:49:45.163036+00:00
FTS,ocds-h6vhtk-069c2c_045860-2026,Waste RCV fleet replacement,Replacement of fleet for Waste vehicles using TPPL Framework,Oldham Metropolitan Borough Council,,3200000.0,GBP,2026-05-19,,planning,planned,,https://www.find-tender.service.gov.uk/Notice/045860-2026,2026-05-19T16:49:45.163040+00:00
FTS,ocds-h6vhtk-06024e_045859-2026,Court Funds Office Service - Preliminary Market Engagement Series,"The Ministry of Justice (MoJ), through the Office of the Accountant General (OAG), is preparing to procure a future operating model for the Court Funds Office (CFO) service, which provides banking, investment and funds administration services for clients of the civil courts in England and Wales, including the Court of Protection. The service operates within a highly regulated environment and supports the safeguarding and administration of funds held on behalf of vulnerable court users and childr",Ministry of Justice,,52000000.0,GBP,2026-05-19,,planning,planned,,https://www.find-tender.service.gov.uk/Notice/045859-2026,2026-05-19T16:49:45.163044+00:00
FTS,ocds-h6vhtk-065d58_045858-2026,Housing Related Support Services,Delivery of a range of accommodation and community based support.,North East Lincolnshire Borough Council,,7600000.0,GBP,2026-05-19,,planning,planned,,https://www.find-tender.service.gov.uk/Notice/045858-2026,2026-05-19T16:49:45.163049+00:00
FTS,ocds-h6vhtk-031c2c_045857-2026,Post Insulators,Supply and Delivery frameworks for Post Insulators,SCOTTISH POWER LIMITED,,,GBP,2026-05-19,,award,complete,31000000,https://www.find-tender.service.gov.uk/Notice/045857-2026,2026-05-19T16:49:45.163053+00:00
FTS,ocds-h6vhtk-069c2b_045856-2026,All Age Community Autism Support Service,Pre-assessment and post diagnostic support in the community.,Warwickshire County Council,,,GBP,2026-05-19,,planning,planned,,https://www.find-tender.service.gov.uk/Notice/045856-2026,2026-05-19T16:49:45.163056+00:00
FTS,ocds-h6vhtk-069c2a_045855-2026,NHS Providers Membership Fee,"Membership Fee - April 2026 to March 2027
Membership organisation for the NHS Hospital, Mental Health, Community and Ambulance Services treating patients and service users in the NHS in England",Liverpool University Hospitals NHS Foundation Trust,,,GBP,2026-05-19,,award,complete,,https://www.find-tender.service.gov.uk/Notice/045855-2026,2026-05-19T16:49:45.163060+00:00
FTS,ocds-h6vhtk-069c29_045854-2026,PA0034 Communal Heating,"The works comprise of the servicing, maintenance, inspection, installation, operation and
repair of:-
a) all tenanted residential properties, both occupied and vacant, within the Contract Area.
The Employer may, by agreement with the Contractor, extend this service to include
leasehold and shared ownership properties at sometime in the future.
b) all estate offices, community halls, houses let to tenants as individual rooms or bedsits
with domestic sized appliances.
c) all gas fired appliances, ",Peabody Trust,,,GBP,2026-05-19,,award,complete,45232141,https://www.find-tender.service.gov.uk/Notice/045854-2026,2026-05-19T16:49:45.163064+00:00
FTS,ocds-h6vhtk-069c1f_045853-2026,Maintenance of CT Trailer & Support Trailer,"Maintenance of CT Trailer and Support Trailer for Lung Screening Programme. 
This notice starts the standstill period.",York Teaching Hospital Facilities Management LLP,,,GBP,2026-05-19,,award,complete,,https://www.find-tender.service.gov.uk/Notice/045853-2026,2026-05-19T16:49:45.163067+00:00
FTS,ocds-h6vhtk-069c28_045852-2026,Contract for ReNEW: Culture Sector Development - Skills and Capacity Development Project,Contract for ReNEW: Culture Sector Development - Skills and Capacity Development Project - BDC,Bromsgrove District Council,,60000.0,GBP,2026-05-19,2026-06-22,tender,active,,https://www.find-tender.service.gov.uk/Notice/045852-2026,2026-05-19T16:49:45.163071+00:00
FTS,ocds-h6vhtk-069c27_045851-2026,Halo ITSM,"subscription service for Halo ITSM
this was  Direct Award via G cloud 14 on continuation of service",West Northamptonshire Council,,,GBP,2026-05-19,,award,complete,72261000,https://www.find-tender.service.gov.uk/Notice/045851-2026,2026-05-19T16:49:45.163074+00:00
FTS,ocds-h6vhtk-05115c_045850-2026,Asbestos Removal,"Removal of Asbestos.
The Authority will now observe a voluntary Eight (working) day standstill period before entering into any contract, in accordance with the requirements of the Procurement Act 2023. This period will conclude at midnight on 08/10/2025.",Lewisham and Greenwich NHS Trust,,,GBP,2026-05-19,,award,complete,,https://www.find-tender.service.gov.uk/Notice/045850-2026,2026-05-19T16:49:45.163079+00:00
FTS,ocds-h6vhtk-069c26_045849-2026,SHaRe Framework- help and resources for Children and Young People,"Share, Help and Resources framework - bringing together short breaks and floating support, Holiday Activities and Food programme (HAF), Crisis and Resilience Fund (CRF), and Access to Resources under one framework",Gloucestershire County Council,,6199144.0,GBP,2026-05-19,,planning,planned,,https://www.find-tender.service.gov.uk/Notice/045849-2026,2026-05-19T16:49:45.163084+00:00
FTS,ocds-h6vhtk-069c25_045848-2026,E-ACT RFQ for New Playgrounds at The Grange Primary and Mansfield Green Primary,"E-ACT RFQ for New Playgrounds at The Grange Primary and Mansfield Green Primary for work to be completed during the summer break
For more information about this opportunity, please visit the eSourcing portal at: 
https://www.delta-esourcing.com/tenders/UK-UK-Kettering:-Playground-equipment./6NQ927JFJ8
To respond to this opportunity, please click here: 
https://www.delta-esourcing.com/respond/6NQ927JFJ8",E-ACT,,80000.0,GBP,2026-05-19,2026-06-17,tender,active,,https://www.find-tender.service.gov.uk/Notice/045848-2026,2026-05-19T16:49:45.163092+00:00
FTS,ocds-h6vhtk-069c24_045847-2026,ready prepared meals,Ready prepared meals - frozen,Oxford Health NHS Foundation Trust,,3000000.0,GBP,2026-05-19,,planning,planned,,https://www.find-tender.service.gov.uk/Notice/045847-2026,2026-05-19T16:49:45.163096+00:00
FTS,ocds-h6vhtk-069c23_045846-2026,Dstl0000064286,Tox Planet Subscription for FY26/27,Defence Science and Technology Laboratory,,,GBP,2026-05-19,,award,complete,,https://www.find-tender.service.gov.uk/Notice/045846-2026,2026-05-19T16:49:45.163099+00:00
FTS,ocds-h6vhtk-069c22_045845-2026,EA & CoW Services - Milcross,"Provision Employers Agent, Clerk of Works and CDM Principal Designer services in respect of the site known as Millcross, Clevedon. Based on a January 2027 commencement on site and a 70 week construction programme.",NSAH (ALLIANCE HOMES) LIMITED,,,GBP,2026-05-19,,award,complete,,https://www.find-tender.service.gov.uk/Notice/045845-2026,2026-05-19T16:49:45.163103+00:00
FTS,ocds-h6vhtk-069c21_045843-2026,Data Centre Services (from ESHT for SCW),"NHS South, Central and West Commissioning Support Unit (SCW) has awarded a contract for Data Centre Services (from ESHT for SCW) to East Sussex Healthcare NHS Trust (ESHT). This requirement has been procured via Horizontal Agreement under The Procurement Act 2023.","NHS South, Central and West Commissioning Support Unit (hosted by NHS England)",,,GBP,2026-05-19,,award,complete,,https://www.find-tender.service.gov.uk/Notice/045843-2026,2026-05-19T16:49:45.163106+00:00
FTS,ocds-h6vhtk-05e261_045842-2026,Fire Escape Refurbishment (RBH),,,,,GBP,2026-05-19,,contractTermination,,,https://www.find-tender.service.gov.uk/Notice/045842-2026,2026-05-19T16:49:45.163110+00:00
FTS,ocds-h6vhtk-069c20_045841-2026,Condition Surveys at all campus locations,Invitation to tender for the provision of Conditions Surveys for all campus locations of Coleg y Cymoedd,Coleg y Cymoedd,,65000.0,GBP,2026-05-19,2026-06-16,tender,active,,https://www.find-tender.service.gov.uk/Notice/045841-2026,2026-05-19T16:49:45.163113+00:00
FTS,ocds-h6vhtk-069c1f_045840-2026,Maintenance of CT Trailer & Support Trailer,Maintenance of CT Trailer & Support Trailer for Lung Screening Programme,York Teaching Hospital Facilities Management LLP,,,GBP,2026-05-19,,award,complete,,https://www.find-tender.service.gov.uk/Notice/045840-2026,2026-05-19T16:49:45.163117+00:00
FTS,ocds-h6vhtk-058abc_045839-2026,TV Studio Refurbishment - Systems Integrator,"Bath Spa University is seeking an experienced systems integrator to support the refurbishment of its TV Studio facilities at Newton Park Campus. The project involves the design, procurement, fit-out, integration, and commissioning of a complete end-to-end solution for the University's multicamera TV production environment.
The existing facilities, installed in 2013, include two production studios, a TV studio gallery, a central apparatus room, two audio mixing studios, and nine postproduction ed",Bath Spa University,,,GBP,2026-05-19,,award,complete,,https://www.find-tender.service.gov.uk/Notice/045839-2026,2026-05-19T16:49:45.163120+00:00
FTS,ocds-h6vhtk-069c1e_045837-2026,"Health, Medical Assessments and  Associated Services in relation to Fitness to Practise","The General Dental Council (GDC) invites tenders for the provision of impartial, expert, and robust health and medical assessments, toxicology testing, and expert witness services to support its Fitness to Practise (FtP) regulatory functions. The Supplier will provide medical assessments, psychiatric assessments, toxicology testing (hair and blood), Civil Procedure Rules‐compliant expert reports, and attendance where required at Practice Committee hearings as expert witnesses. Assessments will b",General Dental Council,,,GBP,2026-05-19,2026-06-18,tender,active,,https://www.find-tender.service.gov.uk/Notice/045837-2026,2026-05-19T16:49:45.163124+00:00
FTS,ocds-h6vhtk-0677fa_045836-2026,Herts Urgent Care,The existing provider has fully satisfied the original contract and is expected to deliver the proposed contract to a sufficient standard (100%).,West Hertfordshire Hospitals NHS Trust,,,GBP,2026-05-19,,tenderUpdate,,85100000,https://www.find-tender.service.gov.uk/Notice/045836-2026,2026-05-19T16:49:45.163128+00:00
FTS,ocds-h6vhtk-069c1d_045835-2026,HR & Payroll Service,"Payroll services via the CCS G-Cloud Framework ref. RM1557.14 Lot 2 Cloud software for a 3+1 year contract, direct award valued at approx £242,951.40 ex vat",The City of Liverpool College,,,GBP,2026-05-19,,award,complete,,https://www.find-tender.service.gov.uk/Notice/045835-2026,2026-05-19T16:49:45.163132+00:00
FTS,ocds-h6vhtk-0677e7_045834-2026,Paul Strickland,The existing provider has fully satisfied the original contract and is expected to deliver the proposed contract to a sufficient standard (100%).,West Hertfordshire Hospitals NHS Trust,,,GBP,2026-05-19,,tenderUpdate,,85100000,https://www.find-tender.service.gov.uk/Notice/045834-2026,2026-05-19T16:49:45.163135+00:00
