source,notice_id,title,description,organisation,value_low,value_high,currency,published_date,deadline,notice_type,status,cpv_codes,url,scraped_at
FTS,ocds-h6vhtk-06b8cc_063456-2026,Biodiverse Winstead - Collaborative Agreement,"a) Deliver landscape change with increased biodiversity across the Winestead catchment that creates new habitats and links existing wildlife rich areas.
b) Reduce inputs of sediment and nutrients to Winestead Drain to improve water quality and reduce maintenance.
c) Provide climate change resilience for the WDAIP by slowing the flow of water into Winestead Drain.
d) Provide climate change resilience to the catchment by addressing water scarcity.
e) Engage stakeholders to begin developing a lands",ENVIRONMENT AGENCY,,,GBP,2026-07-07,,award,complete,,https://www.find-tender.service.gov.uk/Notice/063456-2026,2026-07-07T10:23:09.938141+00:00
FTS,ocds-h6vhtk-06c4cf_063455-2026,Northumberland Line Business Realisation and Monitoring and Evaluation,"Awarded via further competition using NEPO212 Support Services for the Development of the Built Environment Lot 2: Highways, Transportation & Civil Engineering
The Northumberland Line scheme has seen the introduction of passenger rail services on an existing freight only line between Ashington and Newcastle. Six new stations at Ashington, Bedlington, Bebside (Blyth), Newsham, Seaton Delaval & Northumberland Park have been delivered.
The key objective of the Northumberland Line scheme is to impro",Northumberland County Council,,,GBP,2026-07-07,,award,complete,71311300,https://www.find-tender.service.gov.uk/Notice/063455-2026,2026-07-07T10:23:09.938145+00:00
FTS,ocds-h6vhtk-06b690_063454-2026,(ULM) DESFERRIOXAMINE INFUSOR,Procurement of (ULM) DESFERRIOXAMINE INFUSOR,Belfast Health & Social Care Trust,,,GBP,2026-07-07,,award,complete,,https://www.find-tender.service.gov.uk/Notice/063454-2026,2026-07-07T10:23:09.938149+00:00
FTS,ocds-h6vhtk-06b7fd_063453-2026,Supply & Installation of Storage Garage at Knighton Park Depot,"Supply & installation of a 16m x 8m agricultural garage building to house grounds maintenance and environmental volunteering machinery and materials at Knighton Park Depot, Knighton Park, South Kingsmead Road, Leicester LE2 3YN.
Tenders will be required to register on the Central Digital Platform (Find a Tender service). To assist prospective Tenderers, the Cabinet Office have published video guides with accompanying PDF user manuals which will help Tenderers understand and navigate the platform",Leicester City Council,,50000.0,GBP,2026-07-07,2026-07-23,tenderUpdate,active,,https://www.find-tender.service.gov.uk/Notice/063453-2026,2026-07-07T10:23:09.938152+00:00
FTS,ocds-h6vhtk-06c473_063452-2026,Karbon Homes TCI NHC July 2026,This contract details notice is to notify the market that Karbon Homes has appointed Ecclesiastical Insurance Office PLC for their Simple Tenants' Contents Insurance Scheme (2026-2030). This appointment has been made under the Northern Housing Consortium's Simple Tenants' Contents Insurance Scheme Framework. OCID (Open Contracting ID) Ref: ocds-h6vhtk-055721.,Karbon Homes,,,GBP,2026-07-07,,award,complete,,https://www.find-tender.service.gov.uk/Notice/063452-2026,2026-07-07T10:23:09.938162+00:00
FTS,ocds-h6vhtk-06bbd4_063451-2026,"YERVOY (IPILIMUMAB)  CONCENTRATE FOR SOLUTION FOR INFUSION vial, PACK OF 1","Procurement of YERVOY (IPILIMUMAB)  CONCENTRATE FOR SOLUTION FOR INFUSION vial, PACK OF 1",Belfast Health & Social Care Trust,,,GBP,2026-07-07,,award,complete,,https://www.find-tender.service.gov.uk/Notice/063451-2026,2026-07-07T10:23:09.938165+00:00
FTS,ocds-h6vhtk-06c4c5_063450-2026,Thounsand Eyes,"The Thousand Eyes solution combines enterprise and endpoint agents used in conjunction with Cisco Technology. It gives visibility into the Trust network and application performance from different vantage points, monitoring the circuits, the paths that the traffic takes and performance along the route, it aids the Infrastructure Team to diagnose any problems.",West Midlands Ambulance Service University NHS Foundation Trust,,,GBP,2026-07-07,,award,complete,,https://www.find-tender.service.gov.uk/Notice/063450-2026,2026-07-07T10:23:09.938169+00:00
FTS,ocds-h6vhtk-06c4cb_063449-2026,VeriSight Pro 3D Intracardiac Echocardiography (ICE)  Catheters and System Integration,"VeriSight Pro 3D Intracardiac Echocardiography (ICE) Catheters and the Verisight ICE system integration for 3D imaging, to be used on the existing the ICE (Intra-Cardiac Echo) catheter system.",NOTTINGHAM UNIVERSITY HOSPITALS NHS TRUST,,,GBP,2026-07-07,,award,complete,,https://www.find-tender.service.gov.uk/Notice/063449-2026,2026-07-07T10:23:09.938172+00:00
