source,notice_id,title,description,organisation,value_low,value_high,currency,published_date,deadline,notice_type,status,cpv_codes,url,scraped_at
FTS,ocds-h6vhtk-06c0dc_061557-2026,Pre-Market Engagement - Counselling and  Talking Therapies,"The York and North Yorkshire Combined Authority (YNYCA), Policing, Fire and Crime Directorate, is undertaking a soft market testing exercise, the purpose of which is to engage with the market and gain a better understanding of the services available in relation to the market for a Counselling and Talking Therapies Service for victims of crime.","York and North Yorkshire Combined Authority Policing, Fire and Crime Directorate",,974000.0,GBP,2026-07-01,,planning,planning,,https://www.find-tender.service.gov.uk/Notice/061557-2026,2026-07-01T10:39:58.344137+00:00
FTS,ocds-h6vhtk-06c0db_061556-2026,Simulated Consultation Assessment (SCA) Exam Support for GP Resident Doctors EM,"NHS England Workforce, Training and Education is seeking to procure exam preparation course is for East Midlands GP registrars to support their preparation for the Simulated Consultation Assessment which is one of the Royal College of General Practitioners licencing exams.
Contract will run for 24 months, with one optional 12 month extensions 
Total funding available is £157,5000 ex vat. 
The deadline for submission of completed ITQ submissions is 22th July 2026 at 12:00pm (midday).
Late submiss",NHS England,,157500.0,GBP,2026-07-01,2026-07-22,tender,active,,https://www.find-tender.service.gov.uk/Notice/061556-2026,2026-07-01T10:39:58.344141+00:00
FTS,ocds-h6vhtk-06c0da_061555-2026,Simulated Consultation Assessment (SCA) Exam Support for GP Resident Doctors EM,"NHS England Workforce, Training and Education is seeking to procure exam preparation course is for East Midlands GP registrars to support their preparation for the Simulated Consultation Assessment which is one of the Royal College of General Practitioners licencing exams.
Contract will run for 24 months, with one optional 12 month extensions 
Total funding available is £157,5000 ex vat. 
The deadline for submission of completed ITQ submissions is 22th July 2026 at 12:00pm (midday).
Late submiss",NHS England,,157500.0,GBP,2026-07-01,2026-07-22,tender,active,,https://www.find-tender.service.gov.uk/Notice/061555-2026,2026-07-01T10:39:58.344145+00:00
FTS,ocds-h6vhtk-06c0d9_061554-2026,V4SDDC034 Healthcare Cashplan (EAP),"South Derbyshire District Council is seeking to procure a Healthcare Cash Plan and Employee Assistance Programme (EAP) to support the health, wellbeing, and overall employee experience of its workforce.",South Derbyshire District Council,,100000.0,GBP,2026-07-01,2026-07-31,tender,active,,https://www.find-tender.service.gov.uk/Notice/061554-2026,2026-07-01T10:39:58.344148+00:00
FTS,ocds-h6vhtk-06ad44_061553-2026,Tender 25/2026 - PEACEPLUS PP1025 - Camlough Rovers FC – Clubhouse Refurbishment Works,"Competent Contracting companies are hereby invited to tender to deliver Camlough Rovers FC – Clubhouse Refurbishment Works: redevelop and refurbish the existing facility provision at Camlough Rovers, bringing them up to modern standards and creating a safe and welcoming environment for all users of the club be they players, parents, visiting teams and officials.","Newry, Mourne and Down District Council (NMD)",,104930.0,GBP,2026-07-01,2026-07-09,tenderUpdate,active,,https://www.find-tender.service.gov.uk/Notice/061553-2026,2026-07-01T10:39:58.344152+00:00
FTS,ocds-h6vhtk-06c0d8_061552-2026,Maintenance of Pharmacy Robot,"This contract covers the maintenance and servicing of the pharmacy robot located within Swansea Bay University Health Board and supplied by Omnicell Ltd. The system included within this agreement is the RDS Pharmacy Robot (MA10200) located at Morriston Hospital.
This pharmacy robot is an automated dispensing and storage system designed to support hospital pharmacy operations through the accurate storage, selection, and dispensing of medicines, helping to improve efficiency, stock management, and",NHS Wales Shared Services Partnership-Procurement Services,,,GBP,2026-07-01,,award,complete,50000000,https://www.find-tender.service.gov.uk/Notice/061552-2026,2026-07-01T10:39:58.344156+00:00
FTS,ocds-h6vhtk-068a62_061551-2026,TVCA-PROC-0824 - Finance Agency Staff,,,,,GBP,2026-07-01,,contractTermination,,,https://www.find-tender.service.gov.uk/Notice/061551-2026,2026-07-01T10:39:58.344159+00:00
FTS,ocds-h6vhtk-069665_061550-2026,"Appointment of the multi-disciplinary architect team for RIBA Stages 4,5 & 6 of The Avenue Infant School SEND Extension Project","Following the completion of RIBA Stages 1-3 and the submission of the planning application to the Local Authority, we require the further input of a multi disciplinary architecture firm to include Architect, Principal Designer for CDM Regulations Compliance, Mechanical & Electrical Engineer, Structural & Civil Engineer, Quantity Surveyor and Contract Administrator to progress the scheme through RIBA Stages 4, 5 and 6 of the project.",North Northamptonshire Council,,,GBP,2026-07-01,,award,complete,,https://www.find-tender.service.gov.uk/Notice/061550-2026,2026-07-01T10:39:58.344163+00:00
FTS,ocds-h6vhtk-0606a5_061549-2026,Alternative Water Services (AWS) Tender,"About Southern Water:
Southern Water is responsible for providing, maintaining, and operating water supply and distribution services covering the counties of Kent, Sussex, Hampshire and the Isle of Wight and providing services for the maintenance, repair, renewal, or improvement of services forming Southern Water’s water distribution systems. 
The area in which we supply water and treat wastewater covers a total of some 10,530km² and extends from East Kent in the east, through parts of Sussex, t",Southern Water Services Limited,,160000000.0,GBP,2026-07-01,2026-07-30,tenderUpdate,active,,https://www.find-tender.service.gov.uk/Notice/061549-2026,2026-07-01T10:39:58.344167+00:00
FTS,ocds-h6vhtk-06c0d7_061548-2026,BirthRate Plus Workforce Planning,Birthrate Plus Workforce Planning - Full Assessment,MERSEY AND WEST LANCASHIRE TEACHING HOSPITALS NHS TRUST,,,GBP,2026-07-01,,award,complete,,https://www.find-tender.service.gov.uk/Notice/061548-2026,2026-07-01T10:39:58.344172+00:00
FTS,ocds-h6vhtk-06c0d6_061547-2026,Bikeability Cycle Training,"Newcastle City Council is seeking to procure a contractor to deliver the following modules:
•	Level 1, aimed at children in Year 3 or 4, is the gateway to starting to cycle and covers basic bike handling skills in a traffic-free environment, such as a playground. 
•	Level 2, aimed at children in Year 5 or 6, teaches children how to grow more confident and is taught on quiet roads but in real traffic conditions to provide a real cycling experience.
•	Level 3, for children who have completed previ",Newcastle City Council,,150000.0,GBP,2026-07-01,2026-07-15,tender,active,,https://www.find-tender.service.gov.uk/Notice/061547-2026,2026-07-01T10:39:58.344198+00:00
FTS,ocds-h6vhtk-069dd5_061546-2026,Pre Market Engagement - Asbestos Management Services - Request for Information,"Home Group are seeking experienced Service Providers to deliver Asbestos Management services for our Housing and Care services stock across our national footprint. It is the intention of Home Group to establish a Framework contract arrangement in 2027 following a full tender process, 
In order to ensure our procurement approach is focused, efficient and responds to the current market, we are inviting potential service providers to give us insight by responding to this soft market test.
This is n",Home Group,,4000000.0,GBP,2026-07-01,,planning,planned,,https://www.find-tender.service.gov.uk/Notice/061546-2026,2026-07-01T10:39:58.344202+00:00
FTS,ocds-h6vhtk-0606a5_061545-2026,Alternative Water & Incident Management - Request for Information (RFI),"Southern Water (SW) is seeking information from suppliers in relation to a potential procurement exercise. The information is not part of the procurement exercise, but your input will be critical in the development of the sourcing strategy and tender documentation. 
Southern Water is responsible for providing, maintaining, and operating water supply and distribution services covering the counties of Kent, Sussex, Hampshire and the Isle of Wight and providing services for the maintenance, repair,",Southern Water Services Limited,,160000000.0,GBP,2026-07-01,2026-07-30,tender,active,,https://www.find-tender.service.gov.uk/Notice/061545-2026,2026-07-01T10:39:58.344206+00:00
FTS,ocds-h6vhtk-05e87b_061544-2026,Roads Policing Innovation Project 25/2,,,,,GBP,2026-07-01,,contractTermination,,,https://www.find-tender.service.gov.uk/Notice/061544-2026,2026-07-01T10:39:58.344209+00:00
FTS,ocds-h6vhtk-0698b1_061543-2026,National Groundworkers Framework,Procurement of a national groundworkers framework for the sole use of PfP & PfP Developments.,Places for People Group Ltd,,,GBP,2026-07-01,2026-07-20,tenderUpdate,active,,https://www.find-tender.service.gov.uk/Notice/061543-2026,2026-07-01T10:39:58.344213+00:00
FTS,ocds-h6vhtk-067cfa_061542-2026,Water Hygiene (Legionella),Yorkshire Housing requires suitably qualified and experienced Contractors to provide Water Hygiene (Legionella Management) Services,Yorkshire Housing Limited,,,GBP,2026-07-01,,award,complete,,https://www.find-tender.service.gov.uk/Notice/061542-2026,2026-07-01T10:39:58.344218+00:00
FTS,ocds-h6vhtk-06c0d5_061541-2026,Contract for the Collection/Haulage and Treatment of Green/ Garden Waste ,The City & County of Swansea is seeking to procure services for the collection/haulage and treatment of green/garden wastes at a composting facility/ies as identified by the tenderer. The facility/ies must demonstrate proven and robust processing capability and capacity to maximise the composting of materials to an end use product and to minimise any residual waste from the process.,City & County of Swansea,,4200000.0,GBP,2026-07-01,2026-07-27,tender,active,,https://www.find-tender.service.gov.uk/Notice/061541-2026,2026-07-01T10:39:58.344222+00:00
FTS,ocds-h6vhtk-06c0d3_061540-2026,Compliance Sanctions & Shareholder Disclosures system,FundApps Shareholding Disclosure - Long Only & Sanctions Monitoring and Infrastructure Service. System to be integrated with Blackrock Aladdin.,BORDER TO COAST PENSIONS PARTNERSHIP LIMITED,,,GBP,2026-07-01,,award,complete,,https://www.find-tender.service.gov.uk/Notice/061540-2026,2026-07-01T10:39:58.344226+00:00
FTS,ocds-h6vhtk-05fb67_061539-2026,Provision of Environmental Support for the Transport and Works Act Orders Unit,,,,,GBP,2026-07-01,,contractTermination,,,https://www.find-tender.service.gov.uk/Notice/061539-2026,2026-07-01T10:39:58.344229+00:00
FTS,ocds-h6vhtk-06c0d4_061538-2026,CATERING SERVICES FOR THE BRITISH EMBASSY ANKARA,EVENT CATERING SERVICES FOR THE BRITISH EMBASSY ANKARA,"Foreign, Commonwealth and Development Office",,,GBP,2026-07-01,,award,complete,,https://www.find-tender.service.gov.uk/Notice/061538-2026,2026-07-01T10:39:58.344234+00:00
FTS,ocds-h6vhtk-05e38d_061537-2026,Best Start in Life Match Fund,"Overview / requirement
The Department for Education is procuring a Supplier to act as the Delivery Partner for the Best Start in Life Match Fund programme. The programme forms part of the Government’s commitment to ensuring every child has the Best Start in Life by transforming early years systems and supports Local Authorities to achieve the ambitions for early child development including through the Best Start Family Hubs programme through match-funded investment, capacity building, and learni",Department for Education,,2625000.0,GBP,2026-07-01,2026-07-31,tender,active,,https://www.find-tender.service.gov.uk/Notice/061537-2026,2026-07-01T10:39:58.344240+00:00
FTS,ocds-h6vhtk-065d9d_061536-2026,Barnes Primary School Cleaning,"Barnes Primary School is a successful split site primary school located in Barnes, London. They are a thriving, two-form entry primary school with a nursery. They currently have approximately 490 pupils across the two sites, including 60 in the nursery, as well as approximately 70 teaching and support staff onsite. 
The School is tendering its cleaning services with a contract start date of 1st August 2026. The initial  term will run for three years, ending on 31st July 2029, with a requirement ",Barnes Primary School,,,GBP,2026-07-01,,award,complete,,https://www.find-tender.service.gov.uk/Notice/061536-2026,2026-07-01T10:39:58.344246+00:00
FTS,ocds-h6vhtk-06c0d3_061535-2026,Compliance Sanctions & Shareholder Disclosures system,FundApps Shareholding Disclosure - Long Only & Sanctions Monitoring and Infrastructure Service. System to be integrated with Blackrock Aladdin.,BORDER TO COAST PENSIONS PARTNERSHIP LIMITED,,,GBP,2026-07-01,,award,complete,,https://www.find-tender.service.gov.uk/Notice/061535-2026,2026-07-01T10:39:58.344249+00:00
FTS,ocds-h6vhtk-06c0d2_061534-2026,British Sign Language,"Translation and interpretation providers to provide translation services for those whose first language is BSL in the provision of:
•	Face to Face interpreting for interviews, meetings, consultation and social care requirements;
•	Video interpreting (i.e. video conference)",Trafford Council,,,GBP,2026-07-01,,award,complete,,https://www.find-tender.service.gov.uk/Notice/061534-2026,2026-07-01T10:39:58.344253+00:00
FTS,ocds-h6vhtk-06c0d1_061533-2026,Heartwood 2026 Maintenance,"Tender and subsequent works are required for the first-year maintenance schedule of 21 newly planted woodland creation sites. 3 quotes were sought on 17/06/26 from 3 sources, Thompsons Tree Services, Brindle and Green and Chevron. The end date for the process was 26/06/26 and 2 quotes were received. One from Thompsons Tree Services for the value of £39,694.20 (exc VAT), one from Brindle and Green for the value of £72,602.41 (exc VAT), Chevron did not enter a quote. DHW want to go ahead with the ",Derbyshire County Council,,,GBP,2026-07-01,,award,complete,,https://www.find-tender.service.gov.uk/Notice/061533-2026,2026-07-01T10:39:58.344256+00:00
FTS,ocds-h6vhtk-06c0d0_061532-2026,CATERING FOR THE BRITISH EMBASSY BUCHAREST,EVENT CATERING FOR THE BRITISH EMBASSY BUCHAREST,"Foreign, Commonwealth and Development Office",,,GBP,2026-07-01,,award,complete,,https://www.find-tender.service.gov.uk/Notice/061532-2026,2026-07-01T10:39:58.344260+00:00
FTS,ocds-h6vhtk-06c0cf_061531-2026,C26042 - Smoke Machines - Pre-Market Engagement Notice,"Kent Fire and Rescue Service (The Authority) is undertaking pre-market engagement to gain a better understanding of the current market for smoke generation equipment, training smoke fluids, and associated maintenance and support services used within firefighter training environments.  
The Authority delivers a range of operational training activities including: 
- Breathing Apparatus (BA) training 
- Search and Rescue exercises 
- Incident Command simulations 
- Fire Behaviour Training  
Smoke g",Kent Fire and Rescue Service,,,GBP,2026-07-01,,planning,planning,,https://www.find-tender.service.gov.uk/Notice/061531-2026,2026-07-01T10:39:58.344263+00:00
FTS,ocds-h6vhtk-06c0ce_061530-2026,CATERING SERVICES FOR BRITISH EMBASSY ZAGREB,EVENT CATERING SERVICES FOR BRITISH EMBASSY ZAGREB,"Foreign, Commonwealth and Development Office",,,GBP,2026-07-01,,award,complete,,https://www.find-tender.service.gov.uk/Notice/061530-2026,2026-07-01T10:39:58.344267+00:00
FTS,ocds-h6vhtk-06c0cd_061529-2026,TECHNICAL SETUP FOR THE BRITISH CONSULATE GENERAL ISTANBUL,EVENT TECHNICAL SETUP FOR THE BRITISH CONSULATE GENERAL ISTANBUL,"Foreign, Commonwealth and Development Office",,,GBP,2026-07-01,,award,complete,,https://www.find-tender.service.gov.uk/Notice/061529-2026,2026-07-01T10:39:58.344270+00:00
FTS,ocds-h6vhtk-06bcbe_061528-2026,NP90726m Vedolizumab (Entyvio®),Supply of Vedolizumab (Entyvio®) to NHS Scotland.,The Common Services Agency (more commonly known as Public Services Delivery Scotland) (PSD Scotland),,,GBP,2026-07-01,,award,complete,33600000,https://www.find-tender.service.gov.uk/Notice/061528-2026,2026-07-01T10:39:58.344276+00:00
FTS,ocds-h6vhtk-06c0cc_061527-2026,System thinking training and in-house facilitation development,"The FAST programme is intended to deliver a sustainable, in-house training capability within WCC, enabling staff to deliver FAST training independently through accredited facilitators and senior facilitators.",Westminster City Council,,,GBP,2026-07-01,,award,complete,,https://www.find-tender.service.gov.uk/Notice/061527-2026,2026-07-01T10:39:58.344279+00:00
FTS,ocds-h6vhtk-066d95_061526-2026,Professional Cookery & Hospitality Kits and Uniforms,Provision of Uniforms and Kits for Edinburgh College Professional Cookery & Hospitality Students,Edinburgh College,,,GBP,2026-07-01,,award,complete,39220000,https://www.find-tender.service.gov.uk/Notice/061526-2026,2026-07-01T10:39:58.344283+00:00
FTS,ocds-h6vhtk-06c0cb_061525-2026,Enham Refurbishment,"Aster Group (Welcome to Aster) is a housing associating which provides quality, affordable homes to thousands of people across the south of England and London.  Its vision is that everyone has a home.  The not-for-dividend business was established in 1990 and has £2.4 billion worth of assets, the group reinvests profits from open market sale and shared ownership to support the development of affordable homes.  It owns and maintains over 37,000 homes and employs nearly 2,000 people.  Looking ahea",ASTER GROUP LIMITED,,,GBP,2026-07-01,,award,complete,,https://www.find-tender.service.gov.uk/Notice/061525-2026,2026-07-01T10:39:58.344288+00:00
FTS,ocds-h6vhtk-06c0ca_061522-2026,NHSSC-Hologic Ltd - Faxitron CoreVision,NHSSC-Hologic Ltd - Faxitron CoreVision maintenance,Norfolk and Norwich University Hospitals NHS Foundation Trust,,,GBP,2026-07-01,,award,complete,,https://www.find-tender.service.gov.uk/Notice/061522-2026,2026-07-01T10:39:58.344293+00:00
FTS,ocds-h6vhtk-06c0c9_061520-2026,Purchase of Luminometer Reader,Purchase of Luminometer Reader for MMC,Northumbria Healthcare Facilities Management,,,GBP,2026-07-01,,award,complete,,https://www.find-tender.service.gov.uk/Notice/061520-2026,2026-07-01T10:39:58.344296+00:00
FTS,ocds-h6vhtk-0589fb_061519-2026,Requirement for 2 No. Patrol Boats at the Port of Southampton,,,,,GBP,2026-07-01,,tenderCancellation,cancelled,,https://www.find-tender.service.gov.uk/Notice/061519-2026,2026-07-01T10:39:58.344300+00:00
FTS,ocds-h6vhtk-06c0c8_061518-2026,Dyecoats Interior Fit-Out,Latimer Marketing Project - Marketing Suite furnishing,LATIMER DEVELOPMENTS LTD,,,GBP,2026-07-01,,award,complete,,https://www.find-tender.service.gov.uk/Notice/061518-2026,2026-07-01T10:39:58.344303+00:00
FTS,ocds-h6vhtk-06c0c7_061517-2026,Property QUDM,"This QUDM will provide a platform for building contractors to support Cadents property portfolio.
The services cover a broad range of property, building, and site improvements, including refurbishments, installations, compliance works, infrastructure upgrades, environmental adaptations, and security-related activities.
The scope of works will encompass all RIBA stages, can be design/build or build only, and have CDM requirements.",CADENT GAS LIMITED,,,GBP,2026-07-01,,tender,active,,https://www.find-tender.service.gov.uk/Notice/061517-2026,2026-07-01T10:39:58.344306+00:00
FTS,ocds-h6vhtk-06c0c6_061516-2026,Allen & Overy Treasury Legal Services,Legal services for treasury purposes to secure the Euro medium-term note programme,Clarion Housing Group,,,GBP,2026-07-01,,award,complete,,https://www.find-tender.service.gov.uk/Notice/061516-2026,2026-07-01T10:39:58.344310+00:00
FTS,ocds-h6vhtk-05e7ee_061515-2026,250293 AMIC Chemically Assisted Ion Beam Etching (CAIBE) Tool,"Queen's requires a Contract for supply, installation and commissioning and ongoing maintenance of a Chemically Assisted Ion Beam Etching tool; and the provision of associated ancillaries, consumables and complimentary goods. The machine will be situated in the factory of the future, Global Point, Newtownabbey.",Queen's University Belfast,,,GBP,2026-07-01,,award,complete,,https://www.find-tender.service.gov.uk/Notice/061515-2026,2026-07-01T10:39:58.344317+00:00
FTS,ocds-h6vhtk-06b19a_061514-2026,Purchase of 2 No manometry systems with accessories and solid state catheters,Purchase of 2 No manometry systems supplied complete with accessories and solid state catheters,NORFOLK AND NORWICH UNIVERSITY HOSPITALS NHS FOUNDATION TRUST,,,GBP,2026-07-01,,award,complete,,https://www.find-tender.service.gov.uk/Notice/061514-2026,2026-07-01T10:39:58.344320+00:00
FTS,ocds-h6vhtk-06c0c5_061513-2026,Provision of Support within Homelessness Accommodation (Penzance),"This project focuses on delivering trauma informed support within homelessness accommodation, designed to address the underlying causes of homelessness and promote recovery and resilience. The property comprises four rooms in a shared house in the centre of Penzance. Given the scale of the service, staffing is estimated to include 1 FTE support worker, along with a proportion of line management cover, and an estimated additional 0.2 FTE support worker to provide cover during leave or training, i",Cornwall Council,,,GBP,2026-07-01,,award,complete,,https://www.find-tender.service.gov.uk/Notice/061513-2026,2026-07-01T10:39:58.344324+00:00
FTS,ocds-h6vhtk-06c0c4_061512-2026,Provision of Support within Homelessness Accommodation (Pool),"This project focuses on delivering trauma informed support within homelessness accommodation, designed to address the underlying causes of homelessness and promote recovery and resilience. The property comprises ten self contained modular units on the outskirts of Pool. Given the scale of the service, staffing is estimated to include 1.7 FTE support worker, along with a proportion of line management cover, and an estimated additional 0.3 FTE support worker to provide cover during leave or traini",Cornwall Council,,,GBP,2026-07-01,,award,complete,,https://www.find-tender.service.gov.uk/Notice/061512-2026,2026-07-01T10:39:58.344327+00:00
FTS,ocds-h6vhtk-06b79f_061511-2026,Engineering Services for Castle Quarry,"CORSERV Solutions Limited on behalf of its CORMAC division is seeking to procure specialist engineering services contractors. The successful suppliers will be appointed to a multi supplier agreement to provide engineering, and fabrication works to the Asphalt Plant and Aggregate Crushing Plant at Castle-an-Dinas Quarry, Ludgvan, Cornwall.",Corserv Solutions Ltd,,800000.0,GBP,2026-07-01,2026-07-06,tenderUpdate,active,,https://www.find-tender.service.gov.uk/Notice/061511-2026,2026-07-01T10:39:58.344331+00:00
FTS,ocds-h6vhtk-060dce_061510-2026,PRP305 Servicing and Testing of Gas Pipeline and Equipment,"Derbyshire County Council (DCC) is currently seeking to appoint a fully registered and experienced commercial Contractor to carry out the servicing of gas and oil fired heating, hot water appliances, pressurisation units and the testing of all natural gas/LPG/oil installations to all of their premises throughout the county of Derbyshire",Derbyshire County Council,,,GBP,2026-07-01,,award,complete,,https://www.find-tender.service.gov.uk/Notice/061510-2026,2026-07-01T10:39:58.344334+00:00
FTS,ocds-h6vhtk-06c0c3_061509-2026,Toilet Refurbishment at Mintlyn Crematorium,The refurbishment of the customer toilets at Mintlyn Crematorium. Refurbishment of 5 customer toilets (of which one is an accessible unit) and the decommissioning of a 6th toilet cubicle and conversion to a changing room.,King's Lynn and West Norfolk Borough Council,,,GBP,2026-07-01,,award,complete,,https://www.find-tender.service.gov.uk/Notice/061509-2026,2026-07-01T10:39:58.344338+00:00
FTS,ocds-h6vhtk-06c0c2_061508-2026,Political intelligence and public affairs support,Political intelligence and public affairs support to promote Clarion's vision,Clarion Housing Group,,,GBP,2026-07-01,,award,complete,,https://www.find-tender.service.gov.uk/Notice/061508-2026,2026-07-01T10:39:58.344341+00:00
FTS,ocds-h6vhtk-06aeae_061507-2026,Supply and Installation of Esless Lane Cycleway Bridge,Supply and Installation of Esless Lane Cycleway Bridge | Proc-26-47,Wrexham County Borough Council,,200000.0,GBP,2026-07-01,2026-07-09,tenderUpdate,active,,https://www.find-tender.service.gov.uk/Notice/061507-2026,2026-07-01T10:39:58.344344+00:00
FTS,ocds-h6vhtk-06c0c1_061506-2026,Bellevue Place Education Trust Fixed Electricity& Gas Supply Contracts,"Through this tender, the Trust is seeking to appoint a reliable and experienced energy supplier(s) capable of supporting a multi-site portfolio with varied consumption profiles. Tenderers are expected to demonstrate competitive pricing, high-quality account management, robust and accurate billing, and a proactive approach to risk management and sustainability, aligning with the Trust’s operational and environmental objectives.",Bellevue Place Education Trust,,4000000.0,GBP,2026-07-01,2026-07-31,tender,active,,https://www.find-tender.service.gov.uk/Notice/061506-2026,2026-07-01T10:39:58.344348+00:00
FTS,ocds-h6vhtk-06c0c0_061505-2026,St Mary's Refurbishment to Accommodate Special Needs School,"Merthyr Tydfil County Borough Council is seeking tenders from experienced and reputable contractors for the internal and external refurbishment of the existing St. Marys school to form a suitable additional educational facility for Greenfield Special School. The works comprise of Internal alterations, formation of changing room WC’s, internal finishes, and external fencing",Merthyr Tydfil County Borough Council,,900000.0,GBP,2026-07-01,2026-07-29,tender,active,,https://www.find-tender.service.gov.uk/Notice/061505-2026,2026-07-01T10:39:58.344353+00:00
