source,notice_id,title,description,organisation,value_low,value_high,currency,published_date,deadline,notice_type,status,cpv_codes,url,scraped_at
FTS,ocds-h6vhtk-06ce8f_068121-2026,Provision of Compensation Claims Handling Services for HMPPS,"This notice relates to the re-procurement of the Provision of Compensation Claims Handling Services for His Majesty’s Prison and Probation Service (HMPPS) via further competition under Crown Commercial Service (CCS) Framework RM6323 Insurance and Related Services 4, Lot 2 Claims Handling and Related Services which was established in accordance with the Public Contracts Regulations 2015 (PCR 2015).
Each year the Ministry of Justice (the Contracting Authority) typically receives in excess of three",Ministry of Justice,,1610000.0,GBP,2026-07-20,2026-08-03,tender,active,66500000,https://www.find-tender.service.gov.uk/Notice/068121-2026,2026-07-20T09:57:16.867274+00:00
FTS,ocds-h6vhtk-06ce8e_068120-2026,Public Outdoor Space Maintenance,Maintenance of public open space including grass cutting hedge maintenance and checking of ponds,Sandymoor Parish Council,,,GBP,2026-07-20,2026-08-12,tender,active,,https://www.find-tender.service.gov.uk/Notice/068120-2026,2026-07-20T09:57:16.867307+00:00
FTS,ocds-h6vhtk-06bf73_068119-2026,Provision of Air Traffic Control Visual Simulators at Royal Air Force Locations,"The requirement is for the provision of 16 x Visual Control Simulators (VISSIM) for training, currency, and assurance for Air Traffic Control Officers (ATCOs) and Air & Space Operations Specialists (ASOS) in the RAF. The requirement is for an Air Traffic Control (ATC) synthetic training environment tool, with ongoing maintenance and software update assistance throughout Contract lifetime. The equipment is to be installed on-site by the Contractor into an office-like environment at all 16 locatio",Ministry of Defence,,2000000.0,GBP,2026-07-20,2026-07-31,tenderUpdate,active,,https://www.find-tender.service.gov.uk/Notice/068119-2026,2026-07-20T09:57:16.867314+00:00
FTS,ocds-h6vhtk-06ce8c_068118-2026,UPN-00618 - Future Places Fund,"Executive Summary & Background:
The Investment Team is advancing the development of the £500m Future Places Fund (FPF). The fund is evolving its core strategy to operate as a regional impact investment platform specifically targeting stalled, ""oven-ready"" housing and commercial schemes across the region.
Unlike traditional public sector funding architectures, the FPF will move away from grant reliance. Instead, it will deploy a revolving, largely repayable investment model designed to recycle ca",The West of England Combined Authority,,1000000.0,GBP,2026-07-20,,planningUpdate,planning,,https://www.find-tender.service.gov.uk/Notice/068118-2026,2026-07-20T09:57:16.867320+00:00
FTS,ocds-h6vhtk-06ce8d_068117-2026,Approved Contractor Panel,"About us
George Cadbury founded Bournville Village Trust, as a custodian of the Bournville Estate - the village he developed around the Cadbury chocolate factory in 1900, following the death of his brother Richard in 1899.
By founding Bournville Village Trust, it meant even after his death, the homes, buildings, amenities, parks and open spaces on the Bournville estate would continue to benefit the community.
Since then, Bournville Village Trust has evolved to become a values-led charitable trus",BOURNVILLE VILLAGE TRUST,,,GBP,2026-07-20,,planning,planning,,https://www.find-tender.service.gov.uk/Notice/068117-2026,2026-07-20T09:57:16.867325+00:00
FTS,ocds-h6vhtk-06ce8c_068116-2026,UPN-00618 - Future Places Fund,"Executive Summary & Background:
The Investment Team is advancing the development of the £500m Future Places Fund (FPF). The fund is evolving its core strategy to operate as a regional impact investment platform specifically targeting stalled, ""oven-ready"" housing and commercial schemes across the region.
Unlike traditional public sector funding architectures, the FPF will move away from grant reliance. Instead, it will deploy a revolving, largely repayable investment model designed to recycle ca",The West of England Combined Authority,,1000000.0,GBP,2026-07-20,,planningUpdate,planning,,https://www.find-tender.service.gov.uk/Notice/068116-2026,2026-07-20T09:57:16.867330+00:00
FTS,ocds-h6vhtk-06c377_068115-2026,ReBoot team PhD addition,,,,,GBP,2026-07-20,,tenderCancellation,cancelled,,https://www.find-tender.service.gov.uk/Notice/068115-2026,2026-07-20T09:57:16.867335+00:00
FTS,ocds-h6vhtk-0503f7_068114-2026,ITSM Service Renewal,,Liverpool City Region Combined Authority,,,GBP,2026-07-20,,contractAmendment,,,https://www.find-tender.service.gov.uk/Notice/068114-2026,2026-07-20T09:57:16.867348+00:00
FTS,ocds-h6vhtk-06061a_068113-2026,Home Ownership Door Entry and Intercoms,"The scope of this contract covers both the reactive repair and planned capital replacement of various door entry and intercom systems predominantly focused on residential properties (houses, flats, maisonettes, and potentially mixed-tenure properties as required), which will be called-off via individual instructions under a Measured Term Contract. 
The works shall include, but are not limited to: 
Reactive Repairs and Fault Finding: Diagnosing and repairing faults in existing audio and video doo",ONWARD GROUP LIMITED,,,GBP,2026-07-20,,award,complete,,https://www.find-tender.service.gov.uk/Notice/068113-2026,2026-07-20T09:57:16.867354+00:00
FTS,ocds-h6vhtk-06ce8c_068112-2026,UPN-00618 - Future Places Fund,"Executive Summary & Background:
The Investment Team is advancing the development of the £500m Future Places Fund (FPF). The fund is evolving its core strategy to operate as a regional impact investment platform specifically targeting stalled, ""oven-ready"" housing and commercial schemes across the region.
Unlike traditional public sector funding architectures, the FPF will move away from grant reliance. Instead, it will deploy a revolving, largely repayable investment model designed to recycle ca",The West of England Combined Authority,,1000000.0,GBP,2026-07-20,,planning,planning,,https://www.find-tender.service.gov.uk/Notice/068112-2026,2026-07-20T09:57:16.867360+00:00
FTS,ocds-h6vhtk-06ce8b_068111-2026,Project VENTURE,Project VENTURE will deliver Gilder Support Services.,Ministry of Defence,,,GBP,2026-07-20,,planning,planning,,https://www.find-tender.service.gov.uk/Notice/068111-2026,2026-07-20T09:57:16.867363+00:00
FTS,ocds-h6vhtk-0649bb_068110-2026,SWI26002 SWISCo Replacement Walking Floor Trailers and Food Waste Trailers,To supply 4 new walking Floor Articulated waste trailers and 2 new food waste trailers for SWISCo residual waste and food waste haulage.,Torbay Council,,,GBP,2026-07-20,,award,complete,,https://www.find-tender.service.gov.uk/Notice/068110-2026,2026-07-20T09:57:16.867368+00:00
FTS,ocds-h6vhtk-066388_068109-2026,Multi Functional Devices and Digital Solutions,"The Framework covers the provision of a full range of Multi-functional Devices and Digital Solutions including, but not limited to, Leased and Purchased Multi-functional Devices and Digital Solutions, Digital Solutions and Associated Services, Leased and Purchased Inkjet Printers.
The Framework has been split into three (3) Lots which allows Customers a choice of how best to approach the market. 
As product ranges increase with technological advances, it is anticipated that any future innovative",Kent County Council (t/a Procurement Services),,,GBP,2026-07-20,,award,complete,,https://www.find-tender.service.gov.uk/Notice/068109-2026,2026-07-20T09:57:16.867373+00:00
FTS,ocds-h6vhtk-06ce8a_068108-2026,Provision for Membership to The Global Health Network (Global Health Protection,"The Global Health Research Accelerator (TGHRA) is providing IHR-SP with use and access to The Global Health Network (TGHN) establishing a knowledge hub to host publications, news stories and general information from the IHR-SP to a diverse global audience. However, it is also used across Global Operations with projects such as UKOTs, UKPHRST and WEPHREN having sites hosted on the platform",Secretary of State for Health and Social Care acting as part of the Crown through UK Health Security Agency,,,GBP,2026-07-20,,award,complete,,https://www.find-tender.service.gov.uk/Notice/068108-2026,2026-07-20T09:57:16.867377+00:00
FTS,ocds-h6vhtk-06ce89_068107-2026,"Procurement  for the Refurbishment of Raised Access Floor, Luton Campus","Procurement  for the Refurbishment of Raised Access Floor, Luton Campus -UoB",University of Bedfordshire,,32500.0,GBP,2026-07-20,2026-08-03,tender,active,,https://www.find-tender.service.gov.uk/Notice/068107-2026,2026-07-20T09:57:16.867383+00:00
FTS,ocds-h6vhtk-06ce88_068106-2026,Material Damage and Business Interruption Policy,The University of Cumbria require cover for Material Damage and B.I for multiple locations.,THE UNIVERSITY OF CUMBRIA,,,GBP,2026-07-20,,award,complete,,https://www.find-tender.service.gov.uk/Notice/068106-2026,2026-07-20T09:57:16.867387+00:00
FTS,ocds-h6vhtk-069e4c_068105-2026,Arboriculture and Landscape Services,"The Borough Council of King’s Lynn and West Norfolk intends to form a Framework Agreement covering 2 separate lots for Arboricultural and Landscape Services. 
Lot 1: This service involves aspects of Arboricultural work including work to trees that require climbing in order to carry out maintenance work.  The majority of programmed and reactive tree pruning and felling work will be awarded through this Lot.   
Lot 2: Emergency call out service 24 hours a day, 7 days a week to attend tree related ",Borough Council of Kings Lynn and West Norfolk,,498000.0,GBP,2026-07-20,2026-08-17,tender,active,,https://www.find-tender.service.gov.uk/Notice/068105-2026,2026-07-20T09:57:16.867391+00:00
FTS,ocds-h6vhtk-064c66_068104-2026,CPH157 Lot 1 - Children and Young People Social Prescribing for Mental Health and Lot 2 Mental Health Youth Outreach for Children and Young People,"Derbyshire County Council (the Council) is seeking Providers with a proven track record to deliver a social prescribing and youth outreach service for Children and Young People (CYP) in Derbyshire (excluding Derby City). This service is being procured under the Light Touch Regime of the Procurement Act 2023. 
The services will provide community based support that promotes positive mental wellbeing by engaging with CYP, building trust and helping them to improve self-esteem and confidence. They w",Derbyshire County Council,,6500000.0,GBP,2026-07-20,2026-09-02,tender,active,,https://www.find-tender.service.gov.uk/Notice/068104-2026,2026-07-20T09:57:16.867396+00:00
FTS,ocds-h6vhtk-06620e_068103-2026,Design and Installation of a Solar Farm and Battery Energy Storage System (BESS) at Docks Way Landfill Site,,,,,GBP,2026-07-20,,tenderCancellation,cancelled,,https://www.find-tender.service.gov.uk/Notice/068103-2026,2026-07-20T09:57:16.867399+00:00
FTS,ocds-h6vhtk-06b8c4_068102-2026,AI and Automation Implementation Partner,"London LGPS CIV Limited (London CIV) is seeking to appoint an AI and Automation Implementation Partner to lead and support the practical implementation of prioritised artificial intelligence and automation use cases across its operations.
London CIV is an FCA-authorised Alternative Investment Fund Manager (AIFM) that manages approximately £30 billion of Local Government Pension Scheme (LGPS) assets on behalf of its 32 London Local Authority members and the City of London Corporation. London CIV ",LONDON LGPS CIV LIMITED,,525000.0,GBP,2026-07-20,2026-07-25,tenderUpdate,active,,https://www.find-tender.service.gov.uk/Notice/068102-2026,2026-07-20T09:57:16.867404+00:00
FTS,ocds-h6vhtk-06ce87_068101-2026,Provision of OSINT Screening for the Metropolitan Police Service (MPS),"BlueLight Commercial (Tendering Authority) on behalf of  The Metropolitan Police Service (Contracting Authority) (together the Authorities) issued a Further Competition to award a Call-Off Contract for the Provision of Open-Source Intelligence (OSINT) Social Media Screening Capabilities.  
This Further Competition was conducted under the Open-source Intelligence (OSINT) Software for social media screening Framework Reference BLC0288.  
The Metropolitan Police Service are looking to purchase Open",Mayor's Office for Policing and Crime,,,GBP,2026-07-20,,award,complete,,https://www.find-tender.service.gov.uk/Notice/068101-2026,2026-07-20T09:57:16.867408+00:00
FTS,ocds-h6vhtk-06ce86_068100-2026,Podiatry service provision - SGP and Northgate,Provision of podiatry to inpatient services on the SGP and Northgate sites of CNTW.,"Cumbria, Northumberland, Tyne and Wear NHS Foundation Trust",,,GBP,2026-07-20,,award,complete,85100000,https://www.find-tender.service.gov.uk/Notice/068100-2026,2026-07-20T09:57:16.867413+00:00
FTS,ocds-h6vhtk-06ce85_068099-2026,LATICZONE OLDHAM - CLASSROOM REFURBISHMENT,"To submit the tender:
https://procontract.due-north.com/Advert?advertId=6f871f59-1084-f111-813c-005056b64545
Oldham Council wish to appoint a Works contractor for refurbishment of classroom for Lacticzone (Oldham). 
The works scope includes:
•	Strip out and demolition
•	Internal partitions, fit out works and joiner
•	Mechanical and Electrical works 
•	External works
•	Kitchen Installation",Oldham Metropolitan Borough Council,,140000.0,GBP,2026-07-20,2026-08-07,tender,active,,https://www.find-tender.service.gov.uk/Notice/068099-2026,2026-07-20T09:57:16.867418+00:00
FTS,ocds-h6vhtk-06ce84_068098-2026,Community Wellbeing Partnership Service  - Pre Market Engagement Event,"Bournemouth, Christchurch, and Poole (BCP) Council is pleased to invite providers to a virtual Market Engagement Event taking place on Tuesday 4th August, 11:30am–12:30am via Microsoft Teams. The purpose of the session is to outline our commissioning intentions for the upcoming Community Wellbeing Partnership Service. BCP Council is seeking provider views on the development of a new Community Wellbeing Partnership Service that will strengthen collaboration between statutory services and the volu",Bournemouth Christchurch and Poole Council,,573960.0,GBP,2026-07-20,,planning,planning,,https://www.find-tender.service.gov.uk/Notice/068098-2026,2026-07-20T09:57:16.867422+00:00
FTS,ocds-h6vhtk-06ce83_068097-2026,Renewal of Parity Portfolio Licence,"The Portfolio system provides retrofit scenario 
planning capability, supporting effective 
decision-making on the most appropriate 
measures to bring properties up to required 
energy performance standards.",London Borough of Haringey,,,GBP,2026-07-20,,award,complete,,https://www.find-tender.service.gov.uk/Notice/068097-2026,2026-07-20T09:57:16.867426+00:00
FTS,ocds-h6vhtk-05f49e_068096-2026,Apprentice Training and Assessment: ECITB APTUS Modern Apprentice Offshore Region - September 2026,"The ECITB wishes to appoint a provider to fulfil its requirement for Apprentice Training and Assessment Contracts for ECITB APTUS Modern Apprentice ECITB Offshore Region - September 2026.
The ECITB is looking to procure a training provider to deliver training and assessment services leading to the ECITB's Modern Apprenticeship in Engineering Construction qualification for apprentices in the employment of employers, in-scope to the ECITB and working in the upstream oil and gas sector.
Please see ",ENGINEERING CONSTRUCTION INDUSTRY TRAINING BOARD,,,GBP,2026-07-20,,award,complete,,https://www.find-tender.service.gov.uk/Notice/068096-2026,2026-07-20T09:57:16.867430+00:00
FTS,ocds-h6vhtk-06ce7a_068095-2026,Stockton on Tees Borough Council NHC Active Fire July 2026,This contract details notice is to notify the market that Stockton on Tees Borough Council has appointed Tersus Consultancy Ltd for their Active Fire (2026-2030). This appointment has been made under the Northern Housing Consortium's Active Fire Framework. OCID (Open Contracting ID) Ref: ocds-h6vhtk-056a88.,Stockton on Tees Borough Council,,,GBP,2026-07-20,,award,complete,,https://www.find-tender.service.gov.uk/Notice/068095-2026,2026-07-20T09:57:16.867435+00:00
FTS,ocds-h6vhtk-06ce82_068094-2026,High Path Phases 4-7 Geotechnical & Geo-environmental Ground Investigation Services,High Path Phases 4-7. Provision of Geotechnical & Geo-environmental Ground Investigation Services,Clarion Regeneration Limited,,,GBP,2026-07-20,,award,complete,,https://www.find-tender.service.gov.uk/Notice/068094-2026,2026-07-20T09:57:16.867439+00:00
FTS,ocds-h6vhtk-065ae9_068093-2026,"External Envelope Works to Rawdon St Peter’s CE Primary School, Town St, Rawdon, Leeds LS19 6PP","The project is for: Replacement of windows, doors and curtain walling.
The scope of the work involves:
To Block 1: E1, E2 and Block 2: E2, E17 - Strip out existing windows, doors and curtain walls and make good. Replace existing windows with new double glazed PVC windows with opening casements and insulated panels, as identified on drawings 004/005. Replace existing doors with powder coated aluminium, with glazed panels as identified on drawings 004, 005, 006 and 007. Replace existing curtain wa",Leeds City Council,,,GBP,2026-07-20,,award,complete,,https://www.find-tender.service.gov.uk/Notice/068093-2026,2026-07-20T09:57:16.867448+00:00
FTS,ocds-h6vhtk-06ce81_068092-2026,12 Month membership of the Institution of Civil Engineers,"Yearly Membership to the Infrastructure Client Group. This includes access to Boards, knowledge and materials.",Nuclear Decommissioning Authority,,,GBP,2026-07-20,,award,complete,,https://www.find-tender.service.gov.uk/Notice/068092-2026,2026-07-20T09:57:16.867452+00:00
FTS,ocds-h6vhtk-06ce80_068091-2026,Uninterruptible Power Supply (UPS) solution for the ECB Building,"Coventry University has a requirement for a complete Uninterruptible Power Supply (UPS) solution for the ECB Building, including the supply, delivery, installation, commissioning and associated works.",Coventry University,,,GBP,2026-07-20,,award,complete,,https://www.find-tender.service.gov.uk/Notice/068091-2026,2026-07-20T09:57:16.867457+00:00
FTS,ocds-h6vhtk-06910d_068090-2026,Provision of Client Assisted Passenger Transport Services,"Surrey County Council is dedicated to providing sustainable, safe, secure, and reliable Home to School transport services that meet the needs of students across the county. In accordance with the Education Act 1996 and subsequent amendments, the Council
ensures that eligible students have access to free or subsidized
transport to and from school.
The responsibility for providing Home to School transport services primarily lies with the local authority, especially for students who meet specific c",Surrey County Council,,,GBP,2026-07-20,,award,complete,,https://www.find-tender.service.gov.uk/Notice/068090-2026,2026-07-20T09:57:16.867463+00:00
FTS,ocds-h6vhtk-06a2b8_068089-2026,DLSITT1100 - Supply of APPLE-II Undulator for Beamline K07 for Diamond Light Source,"Located on the Harwell Science & Innovation Campus in Oxfordshire, Diamond Light Source (DLS) is a leading-edge facility for science, engineering and innovation. DLS allows researchers from academia and industry to investigate the structure and behaviour of the world around us at the atomic and molecular level. To continue delivering the world changing science that Diamond enables, the facility is being upgraded to Diamond-II, a co ordinated programme of development that combines a major machine",DIAMOND LIGHT SOURCE LIMITED,,,GBP,2026-07-20,,award,complete,,https://www.find-tender.service.gov.uk/Notice/068089-2026,2026-07-20T09:57:16.867467+00:00
FTS,ocds-h6vhtk-06ce7f_068088-2026,Rough Sleeping Navigators Service,The service will support people with a history of rough sleeping who experience multiple disadvantages and barriers to accessing accommodation and support services. The service will help them navigate the various systems and advocate for positive outcomes.,Bristol City Council,,517835.0,GBP,2026-07-20,,planning,planning,,https://www.find-tender.service.gov.uk/Notice/068088-2026,2026-07-20T09:57:16.867472+00:00
FTS,ocds-h6vhtk-06ce7e_068087-2026,Ruth Kent,"Northamptonshire Fire and Rescue Service are undertaking Preliminary Market Engagement (PME) to seek information from suitably qualified Turnout Solution providers for Fire Stations. 
A turnout solution is a smart automation system that manages a fire station when a 999 call comes in. It instantly triggers station alarms, turns on lights, opens garage doors, and provides incident details to firefighters so they can leave the station as fast and safely as possible. Interested parties should regis","The Police, Fire and Crime Commissioner for Northamptonshire",,300000.0,GBP,2026-07-20,,planning,planning,,https://www.find-tender.service.gov.uk/Notice/068087-2026,2026-07-20T09:57:16.867477+00:00
FTS,ocds-h6vhtk-0514c9_068086-2026,Leeds Central Library - Sleeves and Core Drilling,Leeds Building Services (LBS) have a requirement for a sub-contractor to price for sleeves & core drilling for Leeds Central Library,Leeds City Council,,,GBP,2026-07-20,,award,complete,,https://www.find-tender.service.gov.uk/Notice/068086-2026,2026-07-20T09:57:16.867481+00:00
FTS,ocds-h6vhtk-06bb38_068085-2026,Local Enhanced Clinical Effectiveness Service W94017,The service requires review of patients' prescribing in primary care in line with national targets to optimise medicines.,Betsi Cadwaladr University Health Board,,,GBP,2026-07-20,,award,complete,85121100,https://www.find-tender.service.gov.uk/Notice/068085-2026,2026-07-20T09:57:16.867485+00:00
FTS,ocds-h6vhtk-06ce7d_068084-2026,Framework for provision of Earthworks,"•	General earthwork operations associated with civil engineering works excavation and disposal of suitable and unsuitable materials.
•	Deposition of excavated and imported materials (imported materials may be either natural or recycled aggregates supplied by the Contractor)
•	Soiling",Durham County Council,,500000.0,GBP,2026-07-20,2026-08-07,tender,active,,https://www.find-tender.service.gov.uk/Notice/068084-2026,2026-07-20T09:57:16.867489+00:00
FTS,ocds-h6vhtk-06ce7c_068083-2026,CPD Courses 26/27 Eden Learning,"CPD Courses 26/27 Eden Learning
Staff Training Courses",Mid and South Essex NHS Foundation Trust,,,GBP,2026-07-20,,award,complete,,https://www.find-tender.service.gov.uk/Notice/068083-2026,2026-07-20T09:57:16.867493+00:00
FTS,ocds-h6vhtk-06ce7b_068082-2026,Female Suicide Lived Experience Research Project,"Hull City Council (The Authority) is seeking tenders from interested organisations to provide the Female Suicide Lived Experience Research Project. It shall be via the open procedure consisting of a one stage process. The contract is anticipated to commence 1st September 2026 ending by 31st March 2028. The Authority has estimated the value of the Services to be £30,500 overall. The estimated value is given in good faith to assist tenderers in making their submissions, it should not be interprete",Hull City Council,,30500.0,GBP,2026-07-20,2026-08-07,tender,active,,https://www.find-tender.service.gov.uk/Notice/068082-2026,2026-07-20T09:57:16.867498+00:00
FTS,ocds-h6vhtk-06ce7a_068081-2026,Stockton on Tees Borough Council NHC Active Fire July 2026,This contract award notice is to notify the market that Stockton on Tees Borough Council has appointed SUPPLIER for their Active Fire (2026-2030). This appointment has been made under the Northern Housing Consortium's Active Fire Framework. OCID (Open Contracting ID) Ref: ocds-h6vhtk-056a88.,Stockton on Tees Borough Council,,,GBP,2026-07-20,,award,complete,,https://www.find-tender.service.gov.uk/Notice/068081-2026,2026-07-20T09:57:16.867501+00:00
FTS,ocds-h6vhtk-066f0b_068080-2026,Specialist Community Gynaecology Service,"NHS Arden and Greater East Midlands CSU on behalf of NHS Coventry and Warwickshire, intend to award a contract for the provision of Specialist Community Gynaecology Service.",NHS Coventry and Warwickshire Integrated Care Board (ICB),,,GBP,2026-07-20,,award,complete,85121210,https://www.find-tender.service.gov.uk/Notice/068080-2026,2026-07-20T09:57:16.867506+00:00
FTS,ocds-h6vhtk-06a152_068079-2026,Basic analysis of soil samples,"Basic analysis of 440 soil samples - bulk density, loss on ignition, total N and C, pH, stone and water content. Please see RFQ for more details.",Natural England,,,GBP,2026-07-20,,award,complete,,https://www.find-tender.service.gov.uk/Notice/068079-2026,2026-07-20T09:57:16.867510+00:00
FTS,ocds-h6vhtk-06ce79_068078-2026,WBS-DCO-62192 HLA Rapid Typing Systems,Welsh Blood Service intend to award WBS-DCO-62192 HLA Rapid Typing Systems against NHS Blood and Transplant Framework 2024/S 000-037005 ,NHS Wales Shared Services Partnership-Procurement Services (hosted by Velindre University NHS Trust),,,GBP,2026-07-20,,award,complete,,https://www.find-tender.service.gov.uk/Notice/068078-2026,2026-07-20T09:57:16.867513+00:00
FTS,ocds-h6vhtk-058bd0_068077-2026,The Supply of Three Section Plinths,"In April 2015 the MOD signed a thirteen year contract with Leidos Europe Ltd to provide the procurement and inventory management of commodity items (as well as the storage and distribution services) historically provided in-house by the Logistic Commodities and Services Operating Centre. Leidos, working with the MOD, will transform the way these services are delivered to ensure requirements continue to be met whilst providing best value for money for the department. The organisation delivering t","LEIDOS SUPPLY, LIMITED",,,GBP,2026-07-20,,award,complete,,https://www.find-tender.service.gov.uk/Notice/068077-2026,2026-07-20T09:57:16.867517+00:00
