source,notice_id,title,description,organisation,value_low,value_high,currency,published_date,deadline,notice_type,status,cpv_codes,url,scraped_at
FTS,ocds-h6vhtk-051cfe_063548-2026,Provision of Debt Collection Services,"The Driver and Vehicle Licensing Agency (DVLA) is undertaking preliminary market engagement in advance of a future procurement for the provision of debt collection services.
The requirement will support DVLA in the recovery of outstanding debts arising from its statutory functions. The services are required include a ‘prime’ contractor who is FCA regulated.  Interested parties are required to have the capacity and capability to oversee a panel of subcontracted DCA’s to provide continuity and sca",Driver and Vehicle Licensing Agency,,25230000.0,GBP,2026-07-07,,planning,planned,,https://www.find-tender.service.gov.uk/Notice/063548-2026,2026-07-07T10:23:09.937729+00:00
FTS,ocds-h6vhtk-06c4f3_063547-2026,WHTHT - Cloud Based Communication Interface - Labnogistics,"West Hertfordshire Teaching Hospitals NHS Trust award for Cloud Based Communication Interface - Labnogistics,",West Hertfordshire Teaching Hospitals NHS Trust,,,GBP,2026-07-07,,award,complete,,https://www.find-tender.service.gov.uk/Notice/063547-2026,2026-07-07T10:23:09.937758+00:00
FTS,ocds-h6vhtk-05e2e0_063546-2026,Civic Centre & Arnot Hill Fire Door Remedials,"Gedling Borough Council requires remedial fire door works at two of its sites, Arnot Hill House and the Civic Centre to ensure compliance with current fire safety regulations.",Gedling Borough Council,,,GBP,2026-07-07,,award,complete,,https://www.find-tender.service.gov.uk/Notice/063546-2026,2026-07-07T10:23:09.937764+00:00
FTS,ocds-h6vhtk-06c4f2_063545-2026,Papercut MF Print Management,"This is a renewal of the subscription of our Papercut print management service, used by staff and students across campus. The software is used for monitoring and reporting, and includes a pull printing feature which adds to print queues from staff and student PCs. It is also used for charging for printing and adding credit to accounts.",University of Portsmouth Higher Education Corporation,,,GBP,2026-07-07,,award,complete,,https://www.find-tender.service.gov.uk/Notice/063545-2026,2026-07-07T10:23:09.937769+00:00
FTS,ocds-h6vhtk-058971_063544-2026,PRN25064 Coolnagard Phase 2b Omagh Land Design and Build,"Choice Housing seeks to appoint Developer(s) to provide Competitive Land, Design and Build works opportunities in the Omagh area to deliver social housing projects as part of the Social Housing Development Programme (SHDP). This will include the supply of land and design and construction of properties to meet the Department for Communities’ Housing Association Guide and statutory requirements (e.g. Planning Permission, Building Control approval), as well as adhering to Choice Housing’s Design Re",Choice Housing Ireland Limited,,,GBP,2026-07-07,,award,complete,,https://www.find-tender.service.gov.uk/Notice/063544-2026,2026-07-07T10:23:09.937773+00:00
FTS,ocds-h6vhtk-059f50_063543-2026,Oxygen Therapy Products and Anaesthetic Breathing Systems,Procurement for the supply and delivery of Oxygen Therapy Products and Anaesthetic Breathing Systems,"Regional Business Services Organisation, Procurement and Logistics Service",,,GBP,2026-07-07,,award,complete,,https://www.find-tender.service.gov.uk/Notice/063543-2026,2026-07-07T10:23:09.937781+00:00
FTS,ocds-h6vhtk-06c4f1_063542-2026,Traffic Census Data Storage Software Solution,"Traffic Census Data Storage Software Solution
C2 Licence - drakewell",Derbyshire County Council,,,GBP,2026-07-07,,award,complete,,https://www.find-tender.service.gov.uk/Notice/063542-2026,2026-07-07T10:23:09.937786+00:00
FTS,ocds-h6vhtk-06b9cb_063541-2026,"Nature-based interventions evidence review: ecosystem function, benefits, and nature-related risks","Natural England's Natural Capital Team is seeking to commission an evidence review that examines the confidence with which nature-based interventions deliver specific ecosystem services and benefits from nature, and reduce nature related risks. The nature-based interventions used will build on the evidence on priority actions for nature recovery from the State of Natural Capital Report for England 2024: Risks to nature and why it matters.
The review's objectives are to:
- Assess confidence in th",Natural England,,41250.0,GBP,2026-07-07,2026-07-17,tenderUpdate,active,,https://www.find-tender.service.gov.uk/Notice/063541-2026,2026-07-07T10:23:09.937798+00:00
FTS,ocds-h6vhtk-065f1a_063540-2026,BNSSG ICB -Second Step - Community Rehabilitation,"The Community Rehabilitation Service provides holistic, trauma‑informed rehabilitation for adults in Bristol with complex and enduring mental health needs, primarily psychosis. Its purpose is to build independence, reduce relapse, minimise hospital admissions and out‑of‑area placements, and support people to achieve stable, meaningful lives in the community. It delivers two core functions: 24/7 residential rehabilitation at Wellbridge House, offering psychosocial interventions, medication manage","NHS BRISTOL, NORTH SOMERSET AND SOUTH GLOUCESTERSHIRE INTEGRATED CARE BOARD",,,GBP,2026-07-07,,tenderUpdate,,85100000,https://www.find-tender.service.gov.uk/Notice/063540-2026,2026-07-07T10:23:09.937804+00:00
FTS,ocds-h6vhtk-06c4f0_063539-2026,MED6402,UHNM TB Outsourced Pharmacy Dispensing Service,University Hospitals of North Midlands NHS Trust,,651517.0,GBP,2026-07-07,2026-08-03,tender,active,,https://www.find-tender.service.gov.uk/Notice/063539-2026,2026-07-07T10:23:09.937810+00:00
FTS,ocds-h6vhtk-043b03_063538-2026,Forensic & Statement Reconciliation Software,Direct award via the G-Cloud 14 Framework for the NHS Wales Forensic and Statement Reconciliation Software contract.,NHS Wales Shared Services Partnership-Procurement Services (hosted by Velindre University NHS Trust),,,GBP,2026-07-07,,award,complete,48000000,https://www.find-tender.service.gov.uk/Notice/063538-2026,2026-07-07T10:23:09.937814+00:00
FTS,ocds-h6vhtk-06c4ef_063537-2026,09TS Victoria Line Supply of Vertical and Lateral Dampers,"This is a goods only requirement   estimated to be circa £559,345 for the supply of 1480 vertical and 729 lateral dampers to support the 09TS Victoria Line Fleet Heavy Overhaul Program Lift (HOPL) project. . These dampers are critical suspension components connecting the bogies (wheelsets) to the car body, primarily to absorb vibrations, control excessive movement, and ensure a smooth stable ride by managing vertical bumps and side-to-side (lateral) swaying, boosting passenger comfort and reduci",London Underground Limited,,,GBP,2026-07-07,,award,complete,,https://www.find-tender.service.gov.uk/Notice/063537-2026,2026-07-07T10:23:09.937819+00:00
FTS,ocds-h6vhtk-06a3e0_063536-2026,Provision of Washroom Services,"Tenders are invited by the Council from Suppliers with relevant experience and ability to demonstrate sufficient capacity for the provision of Provision of Washroom Services (the
""Services"").
The council is seeking a Service Provider capable of delivering the provision of Sanitary Bins, Nappy Bins, and Sharps Bins/Containers for Washroom Services. Additionally, the provider should be able to supply any other rental items required by the services at an agreed price upon request.
The council may r",The Council of the Borough of Kirklees,,550000.0,GBP,2026-07-07,2026-08-05,tender,active,,https://www.find-tender.service.gov.uk/Notice/063536-2026,2026-07-07T10:23:09.937824+00:00
FTS,ocds-h6vhtk-066b3a_063535-2026,Provision of Childcare Services (Flying Start & Non-maintained Early Education),UK6 - WCBC is establishing a compliant procurement route for the execution of Childcare Provision – Flying Start/Non-Maintained Funded Early Education. This will provide an unlimited number of suitably qualified and experienced Childcare Providers (referred to as Potential Providers).The provision is being purchased under two Lots: LOT 1 – FLYING STARTLOT 2 – NON-MAINTAINED EARLY EDUCATION,Wrexham County Borough Council,,,GBP,2026-07-07,,award,complete,,https://www.find-tender.service.gov.uk/Notice/063535-2026,2026-07-07T10:23:09.937828+00:00
FTS,ocds-h6vhtk-05e2e0_063534-2026,Civic Centre & Arnot Hill Fire Door Remedials,,,,,GBP,2026-07-07,,contractTermination,,,https://www.find-tender.service.gov.uk/Notice/063534-2026,2026-07-07T10:23:09.937832+00:00
FTS,ocds-h6vhtk-06c4e8_063533-2026,W231259 Meta Advertising July/August Campaigns,"This contract is for the provision of three marketing campaigns on META including NHS Healthy Start, NHS Matex/Medex and NHS Eligibility Tracker.",NHS Business Services Authority,,,GBP,2026-07-07,,award,complete,,https://www.find-tender.service.gov.uk/Notice/063533-2026,2026-07-07T10:23:09.937835+00:00
FTS,ocds-h6vhtk-06c4ee_063532-2026,GMCA 1792.6 GFF Valuations,"The Red Book Valuations are required to limit risk and ensure the GMCA Good Growth Fund investments are being made appropriately.
The Red Book Valuations are based on the following assumptions:
Market Value at current state;
Market Value once developed and assuming vacant possession;
Market Value once the scheme is complete and occupied, and;
Market Rent once the scheme is complete.
GMCA will require:
Full RBV for Phase 1;
Indicative Value of future phases.
Route to Market: Exemption in line wit",Greater Manchester Combined Authority,,,GBP,2026-07-07,,award,complete,,https://www.find-tender.service.gov.uk/Notice/063532-2026,2026-07-07T10:23:09.937841+00:00
FTS,ocds-h6vhtk-061468_063531-2026,Project SafeSight - 3d Scanning Technology Platform,"This Procurement was let under Framework RM1557.14 which uses PCR 2015 regulations and the corresponding notices under those regulations.
The procurement of a platform that will enable Defence Housing to meet its Defence Housing Strategy implement effective Asset Management via usage of 3D scanning technology. The information in this UK1 Pipeline Notice is purely for information, and no further details are available at this stage. Please do not contact the DIO contracting authority regarding thi",Defence Infrastructure Organisation,,1250000.0,GBP,2026-07-07,,planningUpdate,planned,,https://www.find-tender.service.gov.uk/Notice/063531-2026,2026-07-07T10:23:09.937845+00:00
FTS,ocds-h6vhtk-0669c2_063530-2026,"Procurement for Purchase, Delivery and Maintenance of One (1) New, Wheeled Materials Handling Excavator (20-24 GVW)","Yorwaste Ltd has awarded a contract for the purchase, delivery, and three-year
maintenance of one (1) new wheeled materials handling excavator with a gross vehicle
weight of 22 tonnes.
The successful supplier is responsible for ensuring compliance with the technical
specification and providing ongoing maintenance services for up to three years following
delivery.",Yorwaste Ltd,,,GBP,2026-07-07,,award,complete,,https://www.find-tender.service.gov.uk/Notice/063530-2026,2026-07-07T10:23:09.937849+00:00
FTS,ocds-h6vhtk-06c4ed_063529-2026,"CE-49-26 - Measured Term Contract (MTC) for Planned, Reactive Servicing & Maintenance of Gas, Oil, Biomass, LPG Boilers inc Associated Parts","South Ayrshire Council are looking to establish a Measured Term Contract (MTC) for a suitably experienced and resourced Contractor who can deliver Planned and Reactive Servicing & Maintenance to Boilers within non-domestic properties covering a range of heating types including Gas, Electric, Bio-mass and LPG.
The contract will be awarded to one Contractor who has the capacity and experience to fully service and maintain all of the various elements.",South Ayrshire Council,,,GBP,2026-07-07,2026-08-11,tender,active,50531100,https://www.find-tender.service.gov.uk/Notice/063529-2026,2026-07-07T10:23:09.937853+00:00
FTS,ocds-h6vhtk-06a264_063528-2026,Maintenance of Building Management System (Hospital and SC),NHS Golden Jubilee Board requires the provision of ongoing maintenance and support of existing Metasys Building Management System within main hospital building and surgical centre.,NHS Golden Jubilee,,,GBP,2026-07-07,,award,complete,50710000,https://www.find-tender.service.gov.uk/Notice/063528-2026,2026-07-07T10:23:09.937857+00:00
FTS,ocds-h6vhtk-069937_063527-2026,Molis Support Contract (2026-31),"To procure Molecular Laboratory Information System (MoLIS) LIMS for 3 years with further 2 (1+1) years extension options.
The Molis LIMS (Laboratory information management system) is utilised by former PHE UKHSA laboratories for the management of laboratory information in the reference labs at Colindale and Porton Down.  It is also utilised by our regional laboratories to support COVID-19 sequencing, management of sample information and reporting of reference and specialist microbiology results,",Secretary of State for Health and Social Care acting as part of the Crown through UK Health Security Agency,,,GBP,2026-07-07,,award,complete,,https://www.find-tender.service.gov.uk/Notice/063527-2026,2026-07-07T10:23:09.937860+00:00
FTS,ocds-h6vhtk-06c4ec_063526-2026,Satellite Ground Station,"Satellite antenna that connects ships to the internet. It easily tracks fast-moving satellites across space and stays locked onto the signal, even during harsh ocean waves and rough weather.",SATELLITE APPLICATIONS CATAPULT LIMITED,,,GBP,2026-07-07,,award,complete,,https://www.find-tender.service.gov.uk/Notice/063526-2026,2026-07-07T10:23:09.937864+00:00
FTS,ocds-h6vhtk-0690e8_063525-2026,Water Quality Statistics training,"The primary Audience (training recipients) will be the Environment Agency’s staff in environment planning, permitting, analysis & reporting, data and evidence teams and WQ regulatory teams (but will be available to other officers where knowledge of statistics is required).
It is expected that the audience will directly regulate activities through a various of planning assessments, audits and desk-based compliance assessments. Similarly, this training is for officers who will be assessing water q",ENVIRONMENT AGENCY,,,GBP,2026-07-07,,award,complete,,https://www.find-tender.service.gov.uk/Notice/063525-2026,2026-07-07T10:23:09.937871+00:00
FTS,ocds-h6vhtk-06bb27_063524-2026,VORANIGO (VORASIDENIB TABLETS),Procurement of VORANIGO (VORASIDENIB TABLETS),Belfast Health & Social Care Trust,,,GBP,2026-07-07,,award,complete,,https://www.find-tender.service.gov.uk/Notice/063524-2026,2026-07-07T10:23:09.937875+00:00
FTS,ocds-h6vhtk-069fd1_063523-2026,GBRX UDM Innovation and Technology,"Network Rail Infrastructure Limited through its division GBRX (‘GBRX’), intends to establish a dynamic market for rail innovation and technology. The X platform (the shop window) will provide a compliant, transparent and continuously open route to market for suppliers to participate in future innovation, research development, trials, pilots and scalable deployment opportunities.
It is intended that the Utilities Dynamic Market (UDM) will be made available for use by Network Rail Infrastructure L",NETWORK RAIL INFRASTRUCTURE LIMITED,,,GBP,2026-07-07,,planning,planned,,https://www.find-tender.service.gov.uk/Notice/063523-2026,2026-07-07T10:23:09.937880+00:00
FTS,ocds-h6vhtk-06c4e7_063522-2026,PA23 UK1 - Pipeline Notice - Development Advisory Framework (DAF),"The Foreign, Commonwealth & Development Office (FCDO) intends to procure a Development Advisory Framework (DAF) to succeed the existing Evaluation and Advisory Consultancy and Delivery Services 2 (EACDS2) Framework.
The DAF is expected to provide access to a range of suitably qualified advisory, analytical and professional services to support the design and development of FCDO’s international development portfolio, including but not limited to, scoping studies, business case development and inpu","Foreign, Commonwealth and Development Office",,25000000.0,GBP,2026-07-07,,planningUpdate,planned,,https://www.find-tender.service.gov.uk/Notice/063522-2026,2026-07-07T10:23:09.937886+00:00
FTS,ocds-h6vhtk-06c4eb_063521-2026,Property Law Advisor,The requirement is for property law and related legal services to support the management of legal documentation associated with the organisation's property portfolio.,SATELLITE APPLICATIONS CATAPULT LIMITED,,,GBP,2026-07-07,,award,complete,,https://www.find-tender.service.gov.uk/Notice/063521-2026,2026-07-07T10:23:09.937889+00:00
FTS,ocds-h6vhtk-065825_063520-2026,"Needle Sweeps, Environmental Cleans and Cleaning","Two service providers for the provision of environmental cleans, needle sweeps and cleaning to all void properties across VIVID's housing stock.
The contract is divided into 2 lots, to cover both the North and South of our operational area (Hampshire and surrounding areas). The Lots have been awarded to one contractor each.",VIVID Housing Ltd,,,GBP,2026-07-07,,award,complete,,https://www.find-tender.service.gov.uk/Notice/063520-2026,2026-07-07T10:23:09.937893+00:00
FTS,ocds-h6vhtk-06c4ea_063519-2026,"TENDER FOR DESIGN, AND DELIVERY OF FUTUREPROOF PROGRAMME (REISSUE) - 2627 TNDR CW 008","Fermanagh and Omagh District Council invite tenders for the design and delivery of the RESTART Futureproof youth engagement programme part of the RESTART PEACEPLUS project. Rural Economic & Social Transformation And Resilience Transition Together (RESTART) is an investment of €8.4 million under Investment Area 4.2 - Rural Regeneration and Social Inclusion - of the PEACEPLUS programme. The project will see significant strategic investment in the towns of Newtownbutler, Clones and Belturbet and su",Fermanagh and Omagh District Council,,89400.0,GBP,2026-07-07,2026-08-11,tender,active,,https://www.find-tender.service.gov.uk/Notice/063519-2026,2026-07-07T10:23:09.937897+00:00
FTS,ocds-h6vhtk-0519e4_063518-2026,The Provision of Agency Operational Workers for the  Probation Service,"This requirement is to support the Authority (Ministry of Justice) and His Majesty's Prison & Probation Services (HMPPS) in the future delivery of temporary resources for Probation Services across England and Wales. The Probation Services is seeking a supplier(s) to provide qualified probation operational workers to      address temporary staff shortfalls that could jeopardise the delivery of core business objectives. This may include covering periods of absence, in lieu of permanent recruitment",Ministry of Justice,,,GBP,2026-07-07,,awardUpdate,complete,,https://www.find-tender.service.gov.uk/Notice/063518-2026,2026-07-07T10:23:09.937901+00:00
FTS,ocds-h6vhtk-06c4e9_063517-2026,Consultant for Framework Review (ISC and PCT),"This project aims to review and align ORR's Incident Selection Criteria and Guide to Handling Enquiries and Complaints to ensure they are consistent with ORR's statutory and regulatory duties, support proportionate and risk-based decision making, and aligned with ORR's current working practices and with our newly revised RSD annual work planning processes.",Office of Rail and Road,,20000.0,GBP,2026-07-07,2026-08-03,tender,active,,https://www.find-tender.service.gov.uk/Notice/063517-2026,2026-07-07T10:23:09.937905+00:00
FTS,ocds-h6vhtk-06ba3e_063516-2026,Maintenance of Surgical Diathermy Machines and Rapid Vacs,Comprehensive maintenance cover of Surgical Diathermy machines and Rapid Vacs (x55) used throughout all of Theatres/Colposcopy across Hywel Dda University Health Board.,Hywel Dda University Health Board,,,GBP,2026-07-07,,award,complete,,https://www.find-tender.service.gov.uk/Notice/063516-2026,2026-07-07T10:23:09.937908+00:00
FTS,ocds-h6vhtk-06c4e8_063515-2026,W231259 Meta Advertising July/August Campaigns,"This notice is for the provision of three marketing campaigns on META including NHS Healthy Start, NHS Matex/Medex and NHS Eligibility Tracker.",NHS Business Services Authority,,,GBP,2026-07-07,,award,complete,,https://www.find-tender.service.gov.uk/Notice/063515-2026,2026-07-07T10:23:09.937913+00:00
FTS,ocds-h6vhtk-06c4e7_063514-2026,PA23 UK1 - Pipeline notice template (Development Advisory Framework),"The Foreign, Commonwealth & Development Office (FCDO) intends to procure a Development Advisory Framework (DAF) to succeed the existing Evaluation and Advisory Consultancy and Delivery Services 2 (EACDS2) Framework.
The DAF is expected to provide access to a range of suitably qualified advisory, analytical and professional services to support the design and development of FCDO’s international development portfolio, including but not limited to, scoping studies, business case development and inpu","Foreign, Commonwealth and Development Office",,25000000.0,GBP,2026-07-07,,planning,planned,,https://www.find-tender.service.gov.uk/Notice/063514-2026,2026-07-07T10:23:09.937917+00:00
FTS,ocds-h6vhtk-067cc9_063513-2026,The Provision of Mystery Shoppers,CITB operates mystery shops with the core objective of consistently monitoring testing and training centres to provide CITB with assurance that those centres are operating and following the scheme rules for each product and are delivering the standards and customer experience CITB expects.,Construction Industry Training Board,,,GBP,2026-07-07,,award,complete,,https://www.find-tender.service.gov.uk/Notice/063513-2026,2026-07-07T10:23:09.937920+00:00
FTS,ocds-h6vhtk-06c4e2_063512-2026,Maintenance of Nurse Call System,Maintenance and service of Nurse Call System and Scarborough Hospital,YORK TEACHING HOSPITAL FACILITIES MANAGEMENT LLP,,,GBP,2026-07-07,,award,complete,,https://www.find-tender.service.gov.uk/Notice/063512-2026,2026-07-07T10:23:09.937926+00:00
FTS,ocds-h6vhtk-0649f8_063511-2026,Barnet Homes Aids and Adaptations Works Contract,"Barnet Homes have procured a Contractor for the delivery of their Aids and Adaptations Works Contract. The estimated annual contract value is circa GBP800000.00 . This figure does not take into account annual indexation considerations or VAT. It is intended that the contract will run for a period of three years with the option for renewal, as decided by Barnet Homes, for an extension of up to a further two years. The maximum duration of the contract is therefore five years. The contract value in",Barnet Homes Ltd,,,GBP,2026-07-07,,award,complete,,https://www.find-tender.service.gov.uk/Notice/063511-2026,2026-07-07T10:23:09.937929+00:00
FTS,ocds-h6vhtk-06bbe0_063510-2026,"OPDIVO (NIVOLUMAB) 600MG/5ML SOLUTION FOR INJECTION VIAL, 5 mL","Procurement of OPDIVO (NIVOLUMAB) 600MG/5ML SOLUTION FOR INJECTION VIAL, 5 mL",Belfast Health & Social Care Trust,,,GBP,2026-07-07,,award,complete,,https://www.find-tender.service.gov.uk/Notice/063510-2026,2026-07-07T10:23:09.937933+00:00
FTS,ocds-h6vhtk-06c4e6_063509-2026,CSP26659 - Leak detector service plan,"Procurement Description
***** THIS IS A CONTRACT DETAILS NOTICE, NOT A CALL FOR COMPETITION *****
This procurement is being concluded without competition due to an absence of competition for technical reasons, only a particular supplier can supply the goods, services or works required.
Brief Description of Requirement
Leak detector service plan",UK Research and Innovation,,,GBP,2026-07-07,,award,complete,,https://www.find-tender.service.gov.uk/Notice/063509-2026,2026-07-07T10:23:09.937938+00:00
FTS,ocds-h6vhtk-06a7e7_063508-2026,TfW Accessibility Modelling Tool,"TfW are seeking to establish a Research & Design partnership to develop and deliver an analytical methodology tool to measure and quantify the level of access and opportunity provided by the Welsh transport network, and future network proposals. 
The key output will be the development of an algorithm and model to quantify proximity analysis and access to opportunity analysis of the Bus and Rail networks. In addition to this, an MVP prototype of the front end interface will be developed. The mode",Transport for Wales (TfW),,,GBP,2026-07-07,,award,complete,,https://www.find-tender.service.gov.uk/Notice/063508-2026,2026-07-07T10:23:09.937941+00:00
FTS,ocds-h6vhtk-06a8e5_063507-2026,Public Health EoE Specialty Training 1 - MPhil Population Health Sciences UoC,"The Public Health East of England currently supports Speciality Training 1 (ST1) registrars in gaining the knowledge foundation through attendance at the Master of Philosophy in Population Health Sciences at the University of Cambridge. Increasingly, new ST1's may already possess an appropriate Masters level qualification and, in discussion with the Training
Programme Director, they may attend modules on the MPhil course if they have specific identified learning needs prior to sitting the Facult",NHS England,,,GBP,2026-07-07,,award,complete,,https://www.find-tender.service.gov.uk/Notice/063507-2026,2026-07-07T10:23:09.937945+00:00
FTS,ocds-h6vhtk-05dd8c_063506-2026,Investment Manager Appointment and Onboarding,FloodRe appointed a reputable asset manager for its £1bn of assets. Looking for a partnership relationship with an asset management institution with strong brand and insurance asset management capabilities to assist in managing our investments in line with our investment risk appetite.,FLOOD RE LIMITED,,,GBP,2026-07-07,,award,complete,,https://www.find-tender.service.gov.uk/Notice/063506-2026,2026-07-07T10:23:09.937948+00:00
FTS,ocds-h6vhtk-06c4e5_063505-2026,CM65 - Multifunctional Devices (MFD) Printer Replacement and Service Agreement,"Trinity House utilised a CCS Framework RM6361 - Multifunctional Devices, GovPrint Hardware, Managed Print Provision and Digital - Lot 1 to purchase new office printers along with a 5 year service/maintenance contract.",THE CORPORATION OF TRINITY HOUSE,,,GBP,2026-07-07,,award,complete,,https://www.find-tender.service.gov.uk/Notice/063505-2026,2026-07-07T10:23:09.937952+00:00
FTS,ocds-h6vhtk-06c4e4_063504-2026,Werrington HC Refurb,Werrington HC Refurb space for new GP,NHS Property Services Limited,,,GBP,2026-07-07,,award,complete,,https://www.find-tender.service.gov.uk/Notice/063504-2026,2026-07-07T10:23:09.937955+00:00
