source,notice_id,title,description,organisation,value_low,value_high,currency,published_date,deadline,notice_type,status,cpv_codes,url,scraped_at
FTS,ocds-h6vhtk-069c1c_045833-2026,Hosted platform for DBS checks,"Implementation a hosted platform to ensure a safe and compliant workplace with DBS Checks. Manage the entire application, tracking, and ID verification process online. The solution to integrate directly with the Disclosure and Barring Service.",Oldham Metropolitan Borough Council,,1792000.0,GBP,2026-05-19,,planning,planned,,https://www.find-tender.service.gov.uk/Notice/045833-2026,2026-05-19T16:49:45.163139+00:00
FTS,ocds-h6vhtk-069c1b_045832-2026,Provision of External Audit Services,The University of Dundee seeks to appoint an External Audit Partner for the provision of external audit services.,University of Dundee,,,GBP,2026-05-19,2026-07-10,tender,active,79212000,https://www.find-tender.service.gov.uk/Notice/045832-2026,2026-05-19T16:49:45.163142+00:00
FTS,ocds-h6vhtk-0677d9_045831-2026,Spire Healthcare Limited,The existing provider has fully satisfied the original contract and is expected to deliver the proposed contract to a sufficient standard (100%).,West Hertfordshire Hospitals NHS Trust,,,GBP,2026-05-19,,tenderUpdate,,85100000,https://www.find-tender.service.gov.uk/Notice/045831-2026,2026-05-19T16:49:45.163146+00:00
FTS,ocds-h6vhtk-055545_045830-2026,Short Breaks Commissioning,"Our aim is to improve our local Short Breaks offer for disabled children and young people in Devon. Disabled children and young people have the right to be supported at home and in their local communities, to have opportunities to meet and make friends, feel confident, and to thrive with a good family life. Short breaks help to do this by giving an opportunity for children and young people to meet new people, take part in activities, enjoy positive learning opportunities and have different exper",Devon County Council,,44000000.0,GBP,2026-05-19,,planning,planned,,https://www.find-tender.service.gov.uk/Notice/045830-2026,2026-05-19T16:49:45.163150+00:00
FTS,ocds-h6vhtk-069c1a_045829-2026,TSC for the Maintenance and Periodic Inspection and Testing of Emergency Lighting Installations,"To carry out the maintenance and periodic inspection and testing of emergency lighting installations in various occupied operational properties either owned and controlled or managed under Service Level Agreements, located within the geographical boundaries of the East Riding of Yorkshire. Some new installations or modifications to existing lighting systems may be requested under the contract.",East Riding of Yorkshire Council,,,GBP,2026-05-19,,planning,planned,,https://www.find-tender.service.gov.uk/Notice/045829-2026,2026-05-19T16:49:45.163154+00:00
FTS,ocds-h6vhtk-067810_045828-2026,One Stop Doctors Ltd,The existing provider has fully satisfied the original contract and is expected to deliver the proposed contract to a sufficient standard (100%).,West Hertfordshire Hospitals NHS Trust,,,GBP,2026-05-19,,tenderUpdate,,85100000,https://www.find-tender.service.gov.uk/Notice/045828-2026,2026-05-19T16:49:45.163157+00:00
FTS,ocds-h6vhtk-05fa9b_045827-2026,Lift Technical Audit Services 2,"The Services are comprised of certain core Services, which the Supplier is required to deliver, and certain ad-hoc Services, which the Supplier is required to deliver at the Buyer's request.
The Supplier will provide the following core Services (the scope of which is described further in this Specification):
(the ""Core Services"")
Maintenance audits of lift Planned Preventative Maintenance (""PPM"") and reactive works
Compliance spot checks of lifts
Checking remedial estimates provided by the Lift ",Department for Work & Pensions,,,GBP,2026-05-19,,award,complete,,https://www.find-tender.service.gov.uk/Notice/045827-2026,2026-05-19T16:49:45.163160+00:00
FTS,ocds-h6vhtk-069c19_045826-2026,Market Engagement - Bus Franchising Technology Ecosystem,"This soft market testing exercise is issued by the South Yorkshire Mayoral Combined Authority (SYMCA) to inform the development of a future procurement strategy for the digital, data and technology ecosystem required to support the delivery of bus franchising services.
The Authority is seeking input from organisations with relevant experience in delivering integrated transport, operational, financial, customer and data platforms at scale.
This exercise is not a call for competition or procuremen",South Yorkshire Mayoral Combined Authority,,,GBP,2026-05-19,,planning,planning,,https://www.find-tender.service.gov.uk/Notice/045826-2026,2026-05-19T16:49:45.163164+00:00
FTS,ocds-h6vhtk-067802_045825-2026,HCA International Ltd,The existing provider has fully satisfied the original contract and is expected to deliver the proposed contract to a sufficient standard (100%).,West Hertfordshire Hospitals NHS Trust,,,GBP,2026-05-19,,tenderUpdate,,85100000,https://www.find-tender.service.gov.uk/Notice/045825-2026,2026-05-19T16:49:45.163168+00:00
FTS,ocds-h6vhtk-069c18_045824-2026,PURCH2867 – PPE1004077 Direct Award for the Provision of Guardtech Cleanrooms,PURCH2867 – PPE1004077 Direct Award for the Provision of Guardtech Cleanrooms,University of Glasgow,,,GBP,2026-05-19,,award,complete,44211100,https://www.find-tender.service.gov.uk/Notice/045824-2026,2026-05-19T16:49:45.163171+00:00
Contracts Finder,ocds-b5fd17-22c310e1-916b-4cf9-a9ee-d48e07d4277d_baff1378-d01e-4513-86b2-e7b3dfe397a9-898187,2026-016 Legal Support for CSR Project,"This contract is for the supplier to provide advice, support and drafting in relation to the procurement and implementation of a new enterprise resource planning (ERP) system referred to by Ofgem as the Corporate Systems Refresh (CSR) as and when reasonably requested by the Buyer.",Ofgem,,120000.0,GBP,2026-05-19,2026-01-01,award,complete,79100000,https://www.contractsfinder.service.gov.uk/Notice/baff1378-d01e-4513-86b2-e7b3dfe397a9-898187,2026-05-19T16:49:47.030957+00:00
Contracts Finder,ocds-b5fd17-f66f27d8-0766-4597-bb82-9d9cf168193d_4945c356-0ae3-4a60-adcd-4b26fd9f09d7-898186,2025-102 Corporate Responsibilities Project - Strategy and Policy Review,"This contract is for consultancy work to review Ofgem's corporate policy documents to support our ambition to make corporate compliance feel simpler, faster, and more connected.  The review will assess the existence, accessibility, completeness, clarity, and conciseness of policies and make recommendations for where these can be strengthened.",Ofgem,,148452.0,GBP,2026-05-19,2026-01-01,award,complete,72221000,https://www.contractsfinder.service.gov.uk/Notice/4945c356-0ae3-4a60-adcd-4b26fd9f09d7-898186,2026-05-19T16:49:47.030978+00:00
Contracts Finder,ocds-b5fd17-cc7ffc69-9937-44b2-9765-3115df7c4aff_a0859f2b-c9b8-4820-a1ea-2f3cde957356-898184,RM6360 - Legal Services,"This is a call-off under the Crown Commercial Services Framework RM6360 Legal Panel for Government, for legal services.

This Contract Award Notice is being published retrospectively in order to meet the transparency requirements of the Public Contract Regulations 2015. The contract was awarded on an earlier date; however, the Central Digital Platform (CDP) does not permit publication where award dates are in the past. For system compliance purposes only, the dates entered in this notice refle",Ministry of Defence,,35000.0,GBP,2026-05-19,2026-05-19,award,complete,79100000,https://www.contractsfinder.service.gov.uk/Notice/a0859f2b-c9b8-4820-a1ea-2f3cde957356-898184,2026-05-19T16:49:47.030985+00:00
Contracts Finder,ocds-b5fd17-c979f346-2538-4088-adbb-65c9d758aa46_e5f10acb-a127-47f7-be6a-d99f04c9101b-898185,Homes England - Economic Crime Risk Assessment and Review of existing policies (Direct Award - RM6309 - Lot 4),"As part of our work to establish the National Housing Bank (""NHB"" or ""the Bank""), we need to deliver a Target Operating Model agreed with MHCLG and HMT. This sets the operational standard required for HMT to grant approval for the Bank to launch as a Public Financial Institution (PuFIn) and deploy financial interventions. 

As part of this work, we require the provision of:

a) Review of existing policies and risk management frameworks

A gap analysis of existing HE policies against pruden",Homes England (the name adopted by the Homes and Communities Agency),,135000.0,GBP,2026-05-19,2026-02-28,award,complete,79212000,https://www.contractsfinder.service.gov.uk/Notice/e5f10acb-a127-47f7-be6a-d99f04c9101b-898185,2026-05-19T16:49:47.030991+00:00
Contracts Finder,ocds-b5fd17-74ce5a45-cb8d-45d0-bbaf-fefac8606188_d966368d-76be-4f40-ab20-3151ec169818-898182,Delivery Manager Metro,Delivery manager metro,West Midlands Combined Authority,,63250.0,GBP,2026-05-19,2026-03-01,award,complete,79400000,https://www.contractsfinder.service.gov.uk/Notice/d966368d-76be-4f40-ab20-3151ec169818-898182,2026-05-19T16:49:47.030996+00:00
Contracts Finder,ocds-b5fd17-ba6898bd-30f9-45c6-a5f6-67f7ac897b44_8ac56532-10e9-4495-a9bf-69e698185b37-898180,Strategic Contract Advisor,Strategic Contract Advisor,West Midlands Combined Authority,,55200.0,GBP,2026-05-19,2026-03-01,award,complete,79400000,https://www.contractsfinder.service.gov.uk/Notice/8ac56532-10e9-4495-a9bf-69e698185b37-898180,2026-05-19T16:49:47.031001+00:00
Contracts Finder,ocds-b5fd17-9942d918-d1fb-46ed-91ff-282eb4c2b0a7_d41c092f-2d67-4a50-bffd-436958c5c73b-898179,Construction Manager Metro,Construction Manager for Metro,West Midlands Combined Authority,,64400.0,GBP,2026-05-19,2026-03-01,award,complete,79400000,https://www.contractsfinder.service.gov.uk/Notice/d41c092f-2d67-4a50-bffd-436958c5c73b-898179,2026-05-19T16:49:47.031006+00:00
Contracts Finder,ocds-b5fd17-ce00c5ba-faf9-48b7-9c91-e47a2a619735_4aff8d74-4c1a-4347-80e4-b9c5e07f29e8-898178,Sign into Legal Aid Services and Digital Delivery Services,Sign into Legal Aid Services and Digital Delivery Services,Ministry of Justice,1.0,8000000.0,GBP,2026-05-19,2026-02-26,award,complete,72262000,https://www.contractsfinder.service.gov.uk/Notice/4aff8d74-4c1a-4347-80e4-b9c5e07f29e8-898178,2026-05-19T16:49:47.031017+00:00
Contracts Finder,ocds-b5fd17-fe56cc3f-057f-48fb-8737-51b172585b45_074050b3-b1e0-40e2-b8a6-62d7c267ced8-898177,Head of Delivery Metro,Head of delivery Metro,West Midlands Combined Authority,,86250.0,GBP,2026-05-19,2026-03-01,award,complete,79400000,https://www.contractsfinder.service.gov.uk/Notice/074050b3-b1e0-40e2-b8a6-62d7c267ced8-898177,2026-05-19T16:49:47.031023+00:00
Contracts Finder,ocds-b5fd17-ac94f9e1-9914-45a0-89b2-5cab36597474_2188f04d-cc38-412f-8e99-d7fa24ce89c8-898176,Assistant Contract Manager Metro,Assistant contract manager for Metro,West Midlands Combined Authority,,40250.0,GBP,2026-05-19,2026-02-01,award,complete,79400000,https://www.contractsfinder.service.gov.uk/Notice/2188f04d-cc38-412f-8e99-d7fa24ce89c8-898176,2026-05-19T16:49:47.031028+00:00
Contracts Finder,ocds-b5fd17-a36c1bfd-ce64-4f45-8dba-01344bf2bc35_76d603c7-1e68-4870-97af-df250b464b1a-898175,Transitional Care Beds - Lincolnshire,"Lincolnshire Community Health Services NHS Trust is seeking to notify the market of an upcoming opportunity relating to the provision of short-term bed-based Transitional Care services in Lincolnshire.

The service will support timely discharge from acute hospital settings by providing time-limited care for individuals who no longer require acute treatment but are not yet ready to return home.

This notice is issued for market awareness purposes and to support transparency. Further details r",Lincolnshire Community Health Services NHS Trust,3152589.0,5254315.0,GBP,2026-05-19,2026-06-05,tender,active,85323000,https://www.contractsfinder.service.gov.uk/Notice/76d603c7-1e68-4870-97af-df250b464b1a-898175,2026-05-19T16:49:47.031033+00:00
Contracts Finder,ocds-b5fd17-2ea7233f-a412-45a8-857e-bf77f96d5e03_a962d356-3460-49da-83da-81f01d5f6298-898174,CA17565 - RFQ 2026/01 - Intrusive Structural Condition Survey Warrenpoint Baths Associated Buildings,"The Council seeks to appoint a suitably qualified and experienced Chartered Structural Engineer (MIStructE, MICE or equivalent) to undertake an intrusive structural condition survey of Warrenpoint Baths and associated structures.

To access this competition: 

Registered:
Login to https://suppliers.multiquote.com and view the opportunity CA17565.

Not registered:
Visit https://suppliers.multiquote.com then register and quote CA17565 as the reason for registration. 

 Any queries please","Newry, Mourne and Down District Council (NMD)",,,GBP,2026-05-19,2026-05-18,awardUpdate,complete,71312000,https://www.contractsfinder.service.gov.uk/Notice/a962d356-3460-49da-83da-81f01d5f6298-898174,2026-05-19T16:49:47.031038+00:00
Contracts Finder,ocds-b5fd17-1d981d9c-85be-400b-a8e8-98fb14d1e9ae_8c1037f4-2617-4f73-8e7d-afb92a959d0a-898172,Project Planner Metro,Project Planner for Metro,West Midlands Combined Authority,,95550.0,GBP,2026-05-19,2026-02-01,award,complete,79400000,https://www.contractsfinder.service.gov.uk/Notice/8c1037f4-2617-4f73-8e7d-afb92a959d0a-898172,2026-05-19T16:49:47.031042+00:00
Contracts Finder,ocds-b5fd17-19659bfd-213a-47e8-92da-e0a87f0f5b32_fb21be99-a2b8-4c5c-980d-c6ccf6951a7b-898171,Design Manager Metro,Design Manager for Metro team,West Midlands Combined Authority,,55000.0,GBP,2026-05-19,2026-03-01,award,complete,79400000,https://www.contractsfinder.service.gov.uk/Notice/fb21be99-a2b8-4c5c-980d-c6ccf6951a7b-898171,2026-05-19T16:49:47.031046+00:00
Contracts Finder,ocds-b5fd17-b177e471-afe4-4f6e-be84-ca9f8e7429ee_a3c90a7a-c3a0-483e-a36e-78fb02bc4efe-898169,Programme Director Metro,Programme Director for Metro,West Midlands Combined Authority,,125800.0,GBP,2026-05-19,2026-02-01,award,complete,79400000,https://www.contractsfinder.service.gov.uk/Notice/a3c90a7a-c3a0-483e-a36e-78fb02bc4efe-898169,2026-05-19T16:49:47.031051+00:00
Contracts Finder,ocds-b5fd17-3a5cf012-cea1-474e-b951-9c17a8f31bef_6dc1d8c8-f53b-4bc6-9ad9-b99cdab81d55-898170,CA16964 - Salford City College - Student Transport Services,"Salford City College - Provision of Student Transport Services

To access this competition: 

Registered:
Login to https://suppliers.multiquote.com and view the opportunity CA16964.

Not registered:
Visit https://suppliers.multiquote.com then register and quote CA16964 as the reason for registration. 

 Any queries please contact MultiQuote on 020 3920 8054.",Salford City College,,,GBP,2026-05-19,2026-02-02,awardUpdate,complete,60000000,https://www.contractsfinder.service.gov.uk/Notice/6dc1d8c8-f53b-4bc6-9ad9-b99cdab81d55-898170,2026-05-19T16:49:47.031056+00:00
Contracts Finder,ocds-b5fd17-de9bb68d-7844-4e7c-9121-ae283eada816_b90e576d-5a95-4241-8386-c2e8216568a1-898168,KA00AWB - Arle Court to Prestbury,Public transport,Gloucestershire County Council,,210000.0,GBP,2026-05-19,2026-05-11,award,complete,60140000,https://www.contractsfinder.service.gov.uk/Notice/b90e576d-5a95-4241-8386-c2e8216568a1-898168,2026-05-19T16:49:47.031060+00:00
Contracts Finder,ocds-b5fd17-997ac149-4999-4297-8d07-235d56e4873e_6c687af6-588a-4391-ad20-00bb96c8721d-898165,CA17843 - Boston College Summer Refurb,"ELT Suite to be remodelled into existing office space.
Refurbishment of top floor of Rochford building.

To access this competition: 

Registered:
Login to https://suppliers.multiquote.com and view the opportunity CA17843.

Not registered:
Visit https://suppliers.multiquote.com then register and quote CA17843 as the reason for registration. 

 Any queries please contact MultiQuote on 020 3920 8054.",Boston College,,300000.0,GBP,2026-05-19,2026-06-12,tender,active,45214300,https://www.contractsfinder.service.gov.uk/Notice/6c687af6-588a-4391-ad20-00bb96c8721d-898165,2026-05-19T16:49:47.031065+00:00
Contracts Finder,ocds-b5fd17-03281431-74be-4dcf-a82e-71dd2ea9832b_6d8a7f1a-417a-42a6-a0ae-eb58d257b13b-898166,GB-Manchester: ACE 694 CCS - Relocation and Recycling of furniture from Brighton Office,Relocation and Recycling of furniture from Brighton Office,The Arts Council of England,,10385.0,GBP,2026-05-19,2025-08-06,award,complete,90514000,https://www.contractsfinder.service.gov.uk/Notice/6d8a7f1a-417a-42a6-a0ae-eb58d257b13b-898166,2026-05-19T16:49:47.031069+00:00
Contracts Finder,ocds-b5fd17-f9a3afd0-962c-4303-a3d9-5d9329a65d5c_2814b1fd-4dee-49b7-a736-0f78301ee480-898164,YAS 58 2026_27 (DA Non FW) Various Ortus Parts & Labour,YAS 58 2026_27 (DA Non FW) Various Ortus Parts & Labour,YORKSHIRE AMBULANCE SERVICE NHS TRUST,,13262.47,GBP,2026-05-19,2026-05-04,award,complete,33100000,https://www.contractsfinder.service.gov.uk/Notice/2814b1fd-4dee-49b7-a736-0f78301ee480-898164,2026-05-19T16:49:47.031074+00:00
Contracts Finder,ocds-b5fd17-093f9169-e7cb-477c-9f73-d9917fbe4e30_a58ee822-8083-4c92-866d-71b653d34b66-898162,Head of Delivery Metro,Head of delivery for Metro,West Midlands Combined Authority,,97088.0,GBP,2026-05-19,2026-03-01,award,complete,79400000,https://www.contractsfinder.service.gov.uk/Notice/a58ee822-8083-4c92-866d-71b653d34b66-898162,2026-05-19T16:49:47.031078+00:00
Contracts Finder,ocds-b5fd17-304a5848-c948-4b3c-8679-cf8825ad6446_3068b0a9-f0ba-40aa-bb33-ed82a5fbf688-898163,SIP and Voice Services,SIP and Voice Services,West Sussex County Council,,418909.0,GBP,2026-05-19,2025-09-17,award,complete,72260000,https://www.contractsfinder.service.gov.uk/Notice/3068b0a9-f0ba-40aa-bb33-ed82a5fbf688-898163,2026-05-19T16:49:47.031081+00:00
Contracts Finder,ocds-b5fd17-437cd21d-aa0f-4242-8217-633902bb9ca5_c8793679-8a05-48b5-9e0c-ec0c9deed27a-898161,Structural Surveys,"For a structural engineering consultancy to assist the Council with its statutory obligations and maintain regulatory compliance. This is required to:
•	Independently validate and consolidate existing structural information;
•	Produce regulator ready structural safety reports;
•	Strengthen Safety Case documentation in line with updated national standards;
•	Avoid enforcement action or reputational risk;
•	Demonstrate continued proactive management of structural safety.
",London Borough of Hounslow,,548000.0,GBP,2026-05-19,2026-03-12,award,complete,71312000,https://www.contractsfinder.service.gov.uk/Notice/c8793679-8a05-48b5-9e0c-ec0c9deed27a-898161,2026-05-19T16:49:47.031086+00:00
Contracts Finder,ocds-b5fd17-c455dcaa-80d1-4cc6-9cd7-1498a5145862_3617eccf-72dc-456f-8834-f2f6acb5bbd2-898160,CP2772-26 Virtual School System,"The Personal Education Plan (PEP) is a statutory requirement of the LA, the ePEP solution allows a cloud based hosting of this information in a compliant format. Contract has an initial period of 1 year with the option to extend for a further 2 x 1 years",Devon County Council,,94950.0,GBP,2026-05-19,2026-04-27,award,complete,72000000,https://www.contractsfinder.service.gov.uk/Notice/3617eccf-72dc-456f-8834-f2f6acb5bbd2-898160,2026-05-19T16:49:47.031090+00:00
Contracts Finder,ocds-b5fd17-4881ae9e-6b6d-4f01-8477-246980d0a9a7_2f1edd25-0865-41b0-afe5-b4301690bdde-898158,Interface Manager Metro Owners team,Interface Manager for Metro Owners team,West Midlands Combined Authority,,138580.0,GBP,2026-05-19,2026-02-01,award,complete,79400000,https://www.contractsfinder.service.gov.uk/Notice/2f1edd25-0865-41b0-afe5-b4301690bdde-898158,2026-05-19T16:49:47.031094+00:00
Contracts Finder,ocds-b5fd17-eaaa9114-0d27-4ba7-89d2-adfbfbbb7318_319a92ca-8f6f-44e0-b1d7-744d16304251-898159,DDaT25204 - Intelligence Platform,"***Please note this is an award notice, not a call for competition***

Department for Energy Security and Net Zero (DESNZ) had a requirement for the purchase of an Intelligence Platform. This Call Off contract has been sourced via a longlist shortlist exercise on the G Cloud 14 framework (RM1557.14)

A variation has been implemented in order utilise the optional 12 month extension included within the original Contract. This extension is of the value £13,500.00 excluding VAT and takes the tot",ICS on behalf of DSIT and DESNZ,40500.0,54000.0,GBP,2026-05-19,2025-04-29,awardUpdate,complete,30211300,https://www.contractsfinder.service.gov.uk/Notice/319a92ca-8f6f-44e0-b1d7-744d16304251-898159,2026-05-19T16:49:47.031099+00:00
Contracts Finder,ocds-b5fd17-a28127d9-23e3-4bcf-b55e-313d6a068010_f1696d26-aa90-41a6-93d5-5adde5a84e8b-898157,HS2 Interface Manager for Metro,HS2 Interface Manager for the Metro team,West Midlands Combined Authority,,55000.0,GBP,2026-05-19,2026-03-01,award,complete,79400000,https://www.contractsfinder.service.gov.uk/Notice/f1696d26-aa90-41a6-93d5-5adde5a84e8b-898157,2026-05-19T16:49:47.031103+00:00
Contracts Finder,ocds-b5fd17-f51b009c-a148-4dd1-8dc3-0cf82ea0d349_b25b5ec5-aa7c-4cee-ac5f-1bf54fac76b7-898131,Supply & Delivery of F-35 Fuel to Inverness PSD - July 2026 to June 2027 (DDP),Contract covers supply and delivery of F-35 fuel into Inverness for use by Ministry of Defence. A competition was held amongst suppliers via a pre-existing framework; The Global Bulk Fuels Service 2 (GBFS2).,MINISTRY OF DEFENCE,,26545104.3,GBP,2026-05-19,2026-05-18,award,complete,09111300,https://www.contractsfinder.service.gov.uk/Notice/b25b5ec5-aa7c-4cee-ac5f-1bf54fac76b7-898131,2026-05-19T16:49:47.031107+00:00
Contracts Finder,ocds-b5fd17-137d71ae-6f33-4f13-8fc3-f74356c31f27_d9bf362c-317c-4f95-9bde-d2223eb8412a-898154,Special Education Transport Contract SBKF2,Special Education Transport Contract SBKF2,Halton Borough Council,,95000.0,GBP,2026-05-19,2025-09-08,award,complete,60120000,https://www.contractsfinder.service.gov.uk/Notice/d9bf362c-317c-4f95-9bde-d2223eb8412a-898154,2026-05-19T16:49:47.031112+00:00
Contracts Finder,ocds-b5fd17-f03ba878-a886-4940-bedf-dab62848a5e0_0a88922f-8251-4574-8feb-3ccd3e103ad4-898156,NCMP IT System - Discovery Phase,The Authority require a team to build on previous discovery findings from 2021-22 to develop a replacement National Child Measurement Programme IT system.,Department of Health and Social Care (DHSC),,183768.0,GBP,2026-05-19,2026-01-13,award,complete,79315000,https://www.contractsfinder.service.gov.uk/Notice/0a88922f-8251-4574-8feb-3ccd3e103ad4-898156,2026-05-19T16:49:47.031116+00:00
Contracts Finder,ocds-b5fd17-f03ba878-a886-4940-bedf-dab62848a5e0_2493024a-01b6-4ea7-a880-9b71c9ca63ec-898153,NCMP IT System - Discovery Phase,The Authority require a team to build on previous discovery findings from 2021-22 to develop a replacement National Child Measurement Programme IT system.,Department of Health and Social Care (DHSC),,183768.0,GBP,2026-05-19,2026-01-13,award,complete,79315000,https://www.contractsfinder.service.gov.uk/Notice/2493024a-01b6-4ea7-a880-9b71c9ca63ec-898153,2026-05-19T16:49:47.031120+00:00
Contracts Finder,ocds-b5fd17-e9738e72-7650-4901-b945-be0af8752c87_9083aae1-0e4f-475b-aba1-ac7d6c0ee060-898151,GB-Manchester: ACE 719 CCS - Legal Advice,"Provision of expert legal advice in relation to data protection provisions and documentations

Additional information: Awarded under CCS Framework RM6360",The Arts Council of England,,13850.0,GBP,2026-05-19,2026-03-09,award,complete,79100000,https://www.contractsfinder.service.gov.uk/Notice/9083aae1-0e4f-475b-aba1-ac7d6c0ee060-898151,2026-05-19T16:49:47.031124+00:00
Contracts Finder,ocds-b5fd17-e6c781f5-1e5e-423a-b648-e8fc7290c9ab_6ba26488-fbd4-414b-b2c1-5d80bd1b17e6-898150,Special Education Transport Contract SABB3,Special Education Transport Contract SABB3,Halton Borough Council,,133000.0,GBP,2026-05-19,2025-09-08,award,complete,60120000,https://www.contractsfinder.service.gov.uk/Notice/6ba26488-fbd4-414b-b2c1-5d80bd1b17e6-898150,2026-05-19T16:49:47.031128+00:00
Contracts Finder,ocds-b5fd17-5d1df5bb-c622-42d6-a972-18412ac48f4a_16786626-fa7e-4f0c-9b2b-1d6bf07c6e36-898145,Residential and Nursing Care Home Services,"Staffordshire County Council (the Council) has put in place a Dynamic Purchasing System (DPS) arrangement for the provision of residential and nursing care home services for its clients. 

The Council has received applications to join the DPS from providers registered with the Care Quality Commission and has entered into a DPS Agreement for the provision of Residential and Nursing Care Home Services (the DPS Agreement) with each of the successful applicants in respect of one or more of ten lot",Staffordshire County Council,247330000.0,274810000.0,GBP,2026-05-19,2017-07-14,award,complete,85000000,https://www.contractsfinder.service.gov.uk/Notice/16786626-fa7e-4f0c-9b2b-1d6bf07c6e36-898145,2026-05-19T16:49:47.031133+00:00
Contracts Finder,ocds-b5fd17-f93f7267-f85e-4b2c-8a9a-d3de9085dcea_c9d4c4f5-421d-43d7-9b8a-0d61c7a3d0af-898148,Special Education Transport Contract SGRP8,SEN Transport SGRP8,Halton Borough Council,,87400.0,GBP,2026-05-19,2025-09-08,award,complete,60120000,https://www.contractsfinder.service.gov.uk/Notice/c9d4c4f5-421d-43d7-9b8a-0d61c7a3d0af-898148,2026-05-19T16:49:47.031137+00:00
Contracts Finder,ocds-b5fd17-bf4e262b-6de9-4502-80c5-5e9a432ead39_32bb76d3-4da6-42cc-b0e7-b406b45c3ae8-898143,Special Education Transport Contract SCLH1,Special Education Transport Contract SCLH1,Halton Borough Council,,63900.0,GBP,2026-05-19,2025-09-08,award,complete,60120000,https://www.contractsfinder.service.gov.uk/Notice/32bb76d3-4da6-42cc-b0e7-b406b45c3ae8-898143,2026-05-19T16:49:47.031141+00:00
